date,review,rating,isEdited,userName,title,developerResponse,App_Name
2023-05-09 17:46:27,"I just retired in December ‘22 so January ‘23 was the beginning of my foray into Medicare.  I chose Aetna Medicare Advantage as it provided the best low cost option for me.  I had to chose the HMO since I didn’t want to spend all of my retirement dollars on benefits.  I have to say I have been pleased.  I have had to pay some out of pocket fees for special doctor visits, but there is no monthly premium, no fees for generic drugs and low out of pocket maximum.  What’s not to like? Thank you Aetna for providing a plan for those of us who cannot afford the higher cost plans which I was able to afford when working.",5,False,crazee21,Very Pleased So Far,,Aetna Health 
2022-02-10 14:13:58,"I’m looking for a cardiologist and I’ve been using the app for a while. A few cardiologists are listed as 2 specialties—Cardiology and Cardiovascular Disease Physician. Those that are have an ! In their info that says they’re In Network but ‘certain providers may be out of network for certain specialities at this location: Cardiology’. How can that be? Functionally those two specialties are the same thing. All a Cardiologist does is Cardiology, how can he be listed as out of network for a location for the only thing he does there? The doctors office themselves says they take Aetna insurance all the time, but then what does that ! mean? 

On the website it says nothing about out of network specialties for any provider and it even lets me use the price estimation tool for that location. Aetna needs to get their information correct one way or another, most people can’t waste time or money accidentally going to an appointment for a provider that’s actually out of network because the app and website have different info. 

Calling is no help either, I’ve gotten 2 opposite answers from 2 different people, but the second person emailed me a provider list as proof showing the doctor I want to see as In Network as a Cardiovascular Disease Physician. Do I have to check every doctor I want to see 3 times now to average out the answer? I don’t even trust the Provider List I was given at this point.",1,False,LeahD1215,Provider In-Network Info Doesn’t Match,,Aetna Health 
2019-05-14 19:28:22,"Aetna failed to process my payment to provider twice. I placed payment for two of my claims using this Aetna mobile app. They both failed. I’ve got past due notice from the provider after I made payment. I called them to explain that I made payment via Aetna mobile app already and had a receipt. Then, a few days later, I’ve got refund for this payment, it was almost month later since I made a payment. I called the provider and apologized this late payment which was not my fault and sent a check them immediately. Now, another claim, I paid for the claim on Mar 19, 2019. Today, on May 14, I’ve got past due notice from the provider. So far, I didn’t see refund logged for the claim on the Aetna mobile app, so I thought my payment was processed and sent to the provider successfully. I called Aetna, I was on hold for a few minutes, and this is what they said: They, Aetna, sent my payment to the provider on May 25, 2019, 6 days after I made a payment via Aetna mobile app. However, the provider never cash it, hence my payment was automatically refunded. Then, why the refund wasn’t shown app soon? And, why payment process didn’t work? Why the provider never cash my payment, is it their fault or Aetna’s fault?  My conclusion: I will never use Aetna mobile app to make my payment to provider. I will use my HSA account, the provider’s online payment system, or send a check!",1,False,earth on cirs,Do not use Aetna App to make a payment,"{'id': 8707139, 'body': ""Hello, cirs. Thanks for your post. We care about your Aetna Health app experience. I work on Aetna’s support team. If you’ll email our support mailbox, I’ll be happy to help you. That shouldn't be happening and we can help you with this issue. Our email address is AetnaHealth-AppSupport@aetna.com. Thanks! Rick G.."", 'modified': '2019-05-16T17:08:21Z'}",Aetna Health 
2022-04-02 16:06:24,"The Aetna app has been consistent in two areas for the last several years, consistency in lack of redesign for the app and consistent poor performance.  The app has not changed in years, it provides little to know real useful information without diverting you back to the web based platform, which is an exercise in how many times you can login despite being logged in on the app and the three previous tabs opened in your browser.   The answers provided by Aetna are akin to a poorly written mystery novel, you know something happened and you owe some amount of money to someone but you are never really sure.  Do not worry, there is a link that will explain it too you; nope it’s just another tab asking you to log in again.   The one true feature of this app and Atena’s entire platform is security.  No one can login that many times unless it is the user and secondly you can never get actual useful information about your healthcare coverage to utilize it in the best way possible, which lets be honest is the real goal of Aetna.  My only wish is that employer moves away from them, as for the app abandon all hope ye who enters.",1,False,TrueSpleen,Still the poorest and most inefficient health insurance app,,Aetna Health 
2022-06-01 21:41:23,"Nice App for searching Network providers and also easy access to check all the claims. Some providers details needs to be updated as after the Pandemic there are lot of changes occurred. The Payment system is 50% good & 50% bad , as it takes almost 30 days and more once you pay by Credit Card in the App however the providers doesn’t get the money immediately. It will be better if the App provides Payment details / links  for providers and not AETNA Payment department which pays provider through a third party agent. I strongly disagree the payment mode as once we received a Letter from Provider stating that they had handed over to a third party to chase our payment whereas we had paid 2 months ago via our Credit Card. The issue was that we were not notified about the payment return back to our Credit Card after a month which is not our fault. This App is only good for searching Network providers.",3,False,Smat68,User friendly App helps navigating your providers & bills,,Aetna Health 
2019-05-23 12:34:27,"Most recent issue: I lost my job and needed a document stating my last day of coverage, which was about 1 week away. Aetna could not produce a digital version, mail and fax were the only option. They absolutely would not help in my effort to get new coverage in a week, and could only say “I’m sorry” to the fact that their terrible infrastructure was going to leave me without coverage for a month. They don’t seem to understand that there are humans on the customer side of their business. 

UX failure: I cannot search for a doctor (there is no search bar). Cannot filter doctors. The only way you can find a doctor is to walk in front of the office building because it’s based on location with no other way of functioning. From a UX, and general usability position this app is dumb and pointless. What’s worse is when I had to call, the person took 10 min to do the search I could do myself, then they could only provide me with a phone number. Then after that the doctor office themselves won’t book appointments on Friday at all. I feel like I just warped into 1983.",1,True,Not-Mozart,Doesn’t function well. Infrastructure is 20th century.,"{'id': 8010778, 'body': 'Hello Not-Mozart, Thanks for your post. We care about your Aetna Health app experience. I work on Aetna’s support team. If you’ll email our support mailbox, I’ll be happy to look into the issue. Our email address is AetnaHealth-AppSupport@aetna.com. Thanks! Rick G.', 'modified': '2019-04-01T22:06:04Z'}",Aetna Health 
2021-09-18 12:03:13,"Overall you’ve finally come close to getting it right!!! However normally I use your Mail-order Pharmacy for my medications. For one offs and emergency fills I’ve always used Walmart on Hope Church Rd. For whatever reason you have defaulted my local Pharmacy to Medley, whom I’ve never used, let alone heard of. Each time I try and price a medication you default me to Medley. Can’t you fix this??? Related to Pharmacy issues being a heart patient I’ve always kept Nitroglycerin Spray on hand for its convenience. But when I try and price it, your App/Site gives me an error that pricing isn’t available. I’ve asked about this multiple times and have been requested to attach a screenshot. Problem is you won’t accept screenshots or embedded images. Go figure. Lastly someone dropped the ball and I’m out of my 40 mg Furesomide and although the app says it’s available there doesn’t seem to be a way to request it. 

Thanks, 

Jack Collins",3,False,ifubai,Issues with App/Website,"{'id': 25208004, 'body': 'Hello, ifubai. Thanks for your post. We care about your Aetna Health app experience. I work on Aetna’s support team. If you’ll email our support mailbox, I’ll be happy to look into the issue. Our email address is AetnaHealth-AppSupport@aetna.com. Thanks! Cindy K.', 'modified': '2021-09-20T12:58:39Z'}",Aetna Health 
2022-04-11 19:01:31,"My experience is based on Aetna Dental PPO. Dont know how useful it is for other coverages. I give it two stars: one for being able to access my ID card, one for being able to view claims.  For determining my specific coverages it is as useless as their website.  For instance, my Plan Summary page tells me that it pays 80% of “Major Services”.  It doesn’t say what those services are or what my annual limit is.  It tells me to look at Plan Documents for specific coverage information.  When I go to Plan Documents I am greeted by an empty page that says I have no plan documents.  The Plan Summary page has an option labeled Spending Details.  When I click that link it takes me to a blank page that tells me to go to the Plan Summary (the page I just came from) to view my spending details.  Majority of the app is just a copy of the dysfunctional website, even though the website urges you to get the app to see all the details of your coverage.  PATHETIC",2,False,Helinoob,Sadly just like the website for Dental,,Aetna Health 
2023-07-03 05:45:08,"I am a diabetic and had all just about in control using Tresiba and Mounjaro. It was a hard road suffering through Trulicity and Ozempic before finally having Mounjaro do well with my body.  Had brought my A1C from 11 to 7.9 and changed to Aetna from another insurance.  I had no idea that an insurance company would decide it just dd not like what I was taking.  After so months of steady improvement, Aetna decided it did not want me on Mounjaro citing I had to take four of the five they requested first.  I explained this was the third of the five that they were asking for though my body at 6 months of Mounjaro was doing great.  Why switch something that is working? Long story short, they would not cover my medicine and then declined the one they said I had to take. Three months of fighting them and yes my A1C is climbing up again and I feel really bad.  The only thing I can see here is their dollar was more important then their member.  When do insurance companies now tell doctors what they need to prescribe to their patient?",1,False,ssfano,Dollar before member,,Aetna Health 
2021-12-06 19:02:19,"I recently had a baby. We met our deductible and out of pocket maximum during that time. We received bills in the mail amounting to over $4k over our out of pocket max. I called customer service eight times and was told something different every time and no one could resolve the issue. We have insurance for a reason. We pay a good amount for our premium and we have a high deductible and max oop. We are willing to pay our max oop, which is no issue. Unfortunately, no one at Aetna can do their job and guide us in the right direction, so now two of my bills went to collections. No one seems to care and no one is being held accountable. When I asked to speak to a supervisor the reps said they don’t have one. How is that even possible? It’s not. There is always someone above someone and always someone in charge. This is causing me a lot of stress and anxiety. Stay away from Aetna! Also, the app is terrible! It doesn’t give us all of the information we need to navigate our claims properly.",1,False,R.Ouk,Aetna error/terrible customer service,,Aetna Health 
2020-07-08 01:49:44,"Overall, I was excited to use the app rather than having to call Aetna all the time, but I have two problems with this one:
(1) I have aetna for my dental (through my work, and I am the primary account holder) and my medical (through my husband). With the old Aetna app, I had two different logins to see medical or dental. Now both logins go to my medical insurance only and I can’t see my dental insurance details at all. There should be a possibility to have two cards and two accounts stored on the app.
(2) When I go to ‘Search for providers’ all I can search for are the popular searches that the app suggests, I can’t type in what providers I need myself. 
Would be great if both of the above could be fixed. 
Also would be amazing if you could get pre-approval and understand how much you would be charged for each procedure with a specific doctor through the app rather than having to call.",2,False,anonqowirueufidj,"Difficult to search for providers, impossible to have to log ins",,Aetna Health 
2021-04-14 18:11:23,"So yes, if I jumped on this app in 2015 I probably would have given it 5 stars, just look at all this information!! Sadly it’s 2021, and Aetna’s algorithm leaves a lot to be desired. Tried to find a Chiropractor, app tells me “You can use these Chiropractors in the area buddy!” and so I say thank you app, and book an appointment. Luckily the woman at the desk at the Doctor’s office was sharp, and after calling me back three times, finally realized that I was NOT cleared to go to their offices, since they were in network, but not in the “medical group” I selected. Like I said, in 2015, sure no problem. In 2021, you show me WHO I CAN ACTUALLY GO TO or you failed. Add to that the fact that the app makes me type out my sign in every time (doesn’t remember me, won’t use face recognition) and this app seems more like the winner at a 9th Grade Science Fair then something a Fortune 500 company paid a developer thousands and thousands for...",2,False,Lyon>LA,5 Stars in 2015!,,Aetna Health 
2023-06-07 12:19:27,"Aetna is denying my preauthorizations and I feel like I have to fight for my health care at a point in my life where I’m retired and having health issues and suffering daily with pain and my day to day activities are affected.  I suffered collapsed discs in my cervical spine in 2020 and have gone through steps to improve my health by way of physical therapy, steroid injections, and am at a point where I saw a neurosurgeon and together after CT scan and MRI we came to the conclusion that surgery is medically necessary.  Aetna has required I have more physical therapy.  I had to stop pt because it was causing more pain.  I went for 8 months.  I feel as though I have done all I can to get better but am at a point now where pt will not achieve the goal of improved condition.  It’s degenerative disc disease protruding into spinal space pressing on nerves.  I want to try pt, but don’t want to do it if it isn’t helping.  My review is not a good one but I’m living with daily pain and denied health care I need.",1,False,poor review from retiree,Denials,,Aetna Health 
2022-06-21 01:08:14,"I am a 57 year old woman. I have had several life or death surgeries. These surgeries required me to have both my legs opened up and resulted in me losing half a foot. Aetna was good enough to send me to a L tag rehab. I am not sure if I was sent there just because of the extended antibiotics and the wound vac or what. I have been finished with the antibiotics, but still require wound care daily. I can not stand on my left leg with a walker for more than 2 minutes. My right leg is still several weeks from being allowed to bare weight. Aetna has refused the Dr request to send me down a step to acute rehab. I imagine this acute rehab is cheaper and now almost 2 weeks have been wasted in fighting to try and get me to a facility that could really help me get stronger & more stable on my foot. I just don’t understand it. Please help me to get better.",2,False,Jersey gal 813,Coverage let down.,"{'id': 30506996, 'body': 'Hello, Jersey gal 813. We care about your app experience, and we care about your health, too. I work on Aetna’s website/app support team. If you’ll email our mailbox at AetnaHealth-AppSupport@aetna.com, we’d love to get some information so we can forward it to member services. I look forward to hearing from you. Thanks! Cindy K. ', 'modified': '2022-06-22T19:58:30Z'}",Aetna Health 
2023-01-20 18:21:35,"Overall the app is easy to navigate. The only issue is that there is no tab to make payments on your plan. I can’t tell you how long I spent searching so I wasn’t late on my monthly bill. Finally, after thinking I’m crazy and must be missing something I went to the web and search there. Sure enough you have to create a different account on a different Aetna site in order to pay your bill. All they have to do is add a tab that says “pay your bill “ linking you to the other site in order to have a smooth transaction. No one will ever know it is a different site. Besides that everything else seems to be easy and straight forward.",4,False,Old_Man_John,Aetna App,,Aetna Health 
2020-01-14 15:31:45,"This app has a lot of potential, unfortunately, this is my second time downloading the app with roughly 3 months in between and still getting a blank white screen. Thinking it may be my connection... however it is not.  Fix the bugs and I may download it again.
*UPDATE*
Okay so after almost 5 months I decided to try to download the app again. Thinking that the developers would have had plenty of time to do some updates and bug fixes... WRONG download the app and... blank white screen.
My family and I use (Mailhandlers) Aetna insurance and would really love to use this app. But again I download it, open it and blank white screen!?!? Yet my wife downloads the same app on her phone and it works as it should?!?!?
 Answers would be great I want to use the app. Since I am one of millions who pump money into this insurance company.  A functioning  app would be great",1,True,CrlticRaven84,Blank screen...?,"{'id': 11738356, 'body': 'Hello, CrlticRaven84. Thanks for your post. We care about your Aetna Health app experience. I work on Aetna’s support team. If you’ll email our support mailbox, I’ll be happy to look into the issue of your white screen. Our email address is AetnaHealth-AppSupport@aetna.com. Thanks! Cindy K.', 'modified': '2019-11-08T16:40:30Z'}",Aetna Health 
2019-06-15 01:28:24,"In November of 2018 you took back claims that were paid on my daughter whom I carry primary insurance. I called you multiple times to address her double coverage and explanation of benefits with her secondary coverage. You called them and they also explained and you took primary coverage but the bills never got paid. I called again and talked to sandy on 5/9/19 and she told me that she would call Aetna and take back and have all bills processed that they had. Today I got a collections notice in the mail for all those bills that your service reps told me they were absolutely taken care of. I’m extremely angry and will be writing a letter to the ceo of the company I work for. I’ll also be calling your management on Monday. I’ve had your insurance for almost 17 years, this is outrageous and ridiculous how much time and energy I’ve put into this, only to be extremely disappointed In your company.",1,False,KD 0809&,Horrible,,Aetna Health 
2019-08-07 01:07:23,"I’ve had Aetna for a year and have never been able to log onto this app. I’ve reset my password twice, and spoken to customer service about potential account lockout. Each time I try to sign in, the app displays a page that states that the service is momentarily down and offers to redirect to a secure log-in webpage. No luck there either, as it just instructs me to do whatever I need to do by calling customer service with the phone number on my card. 

I get mail about how awesome the Aetna app is, and the features honestly sound great. Virtual therapy session offerings, wireless prescription mgmt, online dermatologist recommendations- but I can’t even log on. I’m going to be talking to my employer about why we even get our insurance through Aetna when other providers actually care about having an online presence.",1,False,ChromeChomsky,I can’t even log-in and the redirect site has been down for weeks,"{'id': 10099558, 'body': 'Hello ChromChomsky. Thanks for your post. We care about your Aetna Health app experience. I work on Aetna’s support team. If you’ll email our support mailbox, I’ll be happy to look into the issue. Our email address is AetnaHealth-AppSupport@aetna.com. Thanks! Rick G..\n', 'modified': '2019-08-09T20:04:31Z'}",Aetna Health 
2019-12-17 21:47:54,"When I order my specialty pharmacy medications it’s very nice to work with your employee that answers the call, the problem is you will not send them without someone signing for them. You tell the customer that a signature is required by Medicare but this is NOT true.  Medicare doesn’t require a signature, your internal policies and procedures do.  I’ve been taking these medications for 7.5 years and every insurance company, including yours, has processed the order with no signature required.   When I started taking these medications 7.5 years ago you were my specialty pharmacy and did NOT require a signature.  I hope you decide to allow the patient to order their medications without a signature.",4,False,JaybirdM,No Signature Required!,,Aetna Health 
2023-07-23 15:48:26,This is a poor quality application tool. Very few things bug me but this tool gets deleted an reloaded to fix issues more then anything I use. Information on claims is ten days slower then is useful. Notifications do not dismiss after acknowledgment. Support? None!!! Been reporting these issues for a month and nothing. Now on to there service. The encore they use for evaluating needed services is evil. Terribly non empathetic. And do far unhealthy unhelpful and plain stupid. Had to go on disability to get the attention of joe wrong they are on third diagnostic efforts. Three levels of in network doctors request denied. Very stressful. If I wasn't locked into this insurance through my job I would fire them then sue them gor insurary and mentss as l anguish.,2,False,Big Dyna,Only a fair tool. Not. Do good,,Aetna Health 
2019-05-30 10:24:41,"I registered online and have been able to get in through my computer, but when I try to go in through the app it auto-replies with a message that it’s only for limited users. 

What is the point of making the app available if only a limited number of people are using it, or can use it. My health insurance goes live on June 1 and everything about United Health was ready and working weeks before. 

Developers: please don’t ask me to email you with the problem. Either take it off Apple App Store until it’s fully functional for EVERYONE, or FIX IT!",5,False,Randymartine312,Worthless so far,,Aetna Health 
2023-05-13 00:17:14,"Tried searching whether a doctor recommended pharmaceutical was covered, after more than an hour and a high level of frustration and the app bouncing me back and forth to the member site and back to the app (shouldn’t the app have access to the member site without asking me to login again?) It never revealed a view of the covered pharmaceuticals list. I gave up trying with the app, and used a link on my PC to view it. Why did they take care to hide it from the app? Why is the app not intuitive to use? Ever hire a usability consultant to make the app easy to use? It needs a lot of design work to bring it to even a mediocre user tool Aetna. And it’s years away from being a pleasure to use.",2,False,bitoguy,Impossible to Search Approved Pharmaceuticals,,Aetna Health 
2022-10-21 01:39:30,"For god sake , please respect prescription refills suggested by doctors, you don’t want to act like a doctor all the time, if you want to control medication then you treat the people directly and prescribe medications for 90 days or 365 days or till end of life whichever is best for you.
God sake , let doctor evaluate and decide medication duration, medication course and treatment plan, dosage can change or may be withdrawn , so let doctor decide what is best for the patients, don’t interfere in the middle of treatment and make arbitrary decisions on refills without talking to doctors, please relax and be patient world is not going end by December 31st 2022 
be kind to yourself and others , do not shock customers with medication refills and make them scape goat at pharmacy stores 
If this is what your policies are then you won and I lost in cat and mouse game !!!",1,False,sgdesai74,For god sake please,,Aetna Health 
