date,review,rating,isEdited,userName,title,developerResponse,App_Name
2019-07-01 13:26:27,"The information is not accurate when it comes to locating local providers. I know where the local in-network urgent care clinics are but when I search on the app, they are not shown. Very misleading.",1,False,IowaMomma5,Providers not showing in App,,Aetna Health 
2019-03-09 13:51:02,Not a bad start but would like for it to store things like my doctors for quick reference.,3,False,Phoenix Ryuu,Needs more. But a start,"{'id': 7676048, 'body': ""Hi there, Phoenix Ryuu. Thanks for your feedback. We'll pass your feedback on to our product team. Please note we’re in the process of rolling out different features throughout the year. Thanks! Rick G."", 'modified': '2019-03-11T16:37:00Z'}",Aetna Health 
2018-05-30 06:35:56,The app is only available for select users. Redirects you to their website or the login screen if you're not one of the select few who have special access.,1,False,Cells aureus,Limited users,,Aetna Health 
2023-10-27 14:04:39,"I would attach a screenshot but Apple Store doesn’t let me do that in this review. I just Updated Aetna app and the User Aggreement page is messed up, rendering the entire app unusable, as it will not allow me in.",1,False,Rachel Colorado,New bug oct 2023,"{'id': 39827095, 'body': 'Hello, Rachel Colorado. We care about your Aetna Health app experience. I work on Aetna’s support team. If you’ll email our support mailbox at AetnaHealth-AppSupport@aetna.com, we’ll be happy to assist with any issues you may be having with the app. I look forward to hearing from you. Thanks! Meg B.', 'modified': '2023-10-30T16:05:51Z'}",Aetna Health 
2023-10-16 18:06:18,Also your website does not show easily and clearly what treatments have been paid,1,False,newyorkworldtraveler,Providers cannot locate payments,,Aetna Health 
2022-12-03 11:08:39,Ability to add Id card to wallet would be a nice feature.,4,False,Grh1947,Wallet,"{'id': 33640046, 'body': 'Hi Grh1947. We care about your Aetna app experience. If you’ll contact me at aetnahealth-appsupport@aetna.com, I’ll work with you to  get you up and running. I look forward to working with you.  Greg H. ', 'modified': '2022-12-10T00:38:39Z'}",Aetna Health 
2023-09-16 10:10:04,I appeal a claim months ago and called multiple times but have received zero response. If my employer didn’t provide me with this insurance I would drop Aetna immediately,1,False,Dave Kurtz,Lack of response,,Aetna Health 
2023-08-14 02:09:49,"I like the App overall, but the preview images show the feature to add the Id card to the Apple Wallet, but that button does not exist on the real app.",2,False,WB_Apple,No Apple Wallet Support,,Aetna Health 
2023-01-26 01:40:46,Please train your representatives to listen to the client and answer what is being asked and not what they think the customer needs.,1,False,Blemershit,Poor customer service,,Aetna Health 
2022-07-09 00:22:30,That you have been grateful Mary,5,False,Masota60,Helpful,,Aetna Health 
2022-11-02 23:19:18,"I’ve seen a couple of updates to this app recently. Why can’t they get Face ID to work?

Face ID setup failed
Try accessing your settings later to enable Face ID.",2,False,johnclayton3,Face ID Fail,,Aetna Health 
2022-09-14 17:33:48,It’s much easier to navigate Aetna app. It works for me,4,False,ptince 12345,Easy to navigate,,Aetna Health 
2022-08-02 15:36:48,If I could give a zero star rating I would the app never works the website on the World Wide Web never works cannot login without it saying user error one,1,False,ginafry,Crap,,Aetna Health 
2022-08-02 03:57:22,App has never worked. Always crashes even after uninstalling and reinstalling.,1,False,mo_ca_jo,Always crashes,,Aetna Health 
2019-08-25 22:17:25,Very convenient tool for reviewing claims and paying providers,5,False,Joffman68,Really handy,"{'id': 10378943, 'body': ""Hello Joffman68 We appreciate your positive feedback and care about your Aetna Health app experience. We'll continue adding more features in the future so check back often for new updates. Thanks! Rick G.\n"", 'modified': '2019-08-27T14:16:30Z'}",Aetna Health 
2022-05-03 21:03:50,I’m trying to use this confusing site and it keeps wanting a review-so giving it a bad one as I still haven’t found what I’m looking for!,1,False,Goldilocks124,Always asking for reviews,,Aetna Health 
2022-01-06 17:51:44,Continually having issues accessing my ID card through the site.,2,False,Twinsmom4ever,ID card access,"{'id': 27383683, 'body': 'Hello, Twinsmom4ever. Thanks for your post. We care about your Aetna Health app experience. I work on Aetna’s support team. If you’ll email our support mailbox, I’ll be happy to look into your ID card issue. Our email address is AetnaHealth-AppSupport@aetna.com. Thanks! Cheryl M', 'modified': '2022-01-12T00:40:17Z'}",Aetna Health 
2021-01-10 18:17:47,Other then the login part. They need to add face recognition I hate logging in every time.,4,False,Sapo1251,Login,"{'id': 20383713, 'body': 'Hello, Sapo1251. Your Aetna member experience is important to us. We appreciate you taking the time to provide feedback. I work on Aetna’s support team. We’ll be sharing your feedback with our production team. In the meantime, we encourage you to continue using our app as we’re continuously adding new features. Thanks! Cindy K. ', 'modified': '2021-01-13T20:13:03Z'}",Aetna Health 
2019-11-25 04:32:47,"The new app looks nice, but I liked some of the features the previous Aetna app including the “guided search” and ratings available for each doctor. I didn’t see it on the new app.",2,False,Me111115573793,App is ok,"{'id': 12044831, 'body': ""Hello, Me111115573793. We appreciate your feedback and care about your Aetna Health app experience. We'll continue adding more features in the future so check back often for new updates. Thanks! Cindy K."", 'modified': '2019-11-25T18:39:19Z'}",Aetna Health 
2019-11-07 23:24:03,You can order medication through this thing,3,False,Twtzcc,Ordering medication,,Aetna Health 
2019-05-16 20:01:16,Having to enter the billing info for every single transaction is a pain.,3,False,Chil7,Could be improved,,Aetna Health 
2019-06-13 23:48:19,"What is the point of an app if it is only available to a small group of individuals. I have been an Aetna member for 28 years, and I can use the website but the app won’t work?! Poor execution.",1,False,Young Hefferson,Only available to small groups of individuals.,,Aetna Health 
2023-07-20 13:46:56,I was switched from a zero deductible plan to this $280 deductible plan by an overzealous sales agent. I am very unhappy and will switch back first chance I get!!,2,False,need andwers soon,Aetna is confusing.,,Aetna Health 
2019-02-09 11:01:51,After successful login it says it’s still in progress and asks to redirect back to aetna website. If the app isn’t ready then what’s the point of putting it to app store. Seems like a waste of time for the customers.,1,False,VTCTS121,App not available,,Aetna Health 
2019-02-03 03:46:58,"PDF forms should be available to download for member to submit to there FSA. This I not only a problem on app but on your full site, this was available before what happened? This would reduce the amount of calls to Aetna inquiries about claims just saying.",1,False,sanchez4385,Claims,"{'id': 7150851, 'body': ""Hi there, Sanchez4385. Thanks for your feedback. We'll pass your feedback on to our product team. Please note we’re in the process of rolling out different features throughout the year. Thanks! Cindy K."", 'modified': '2019-02-04T14:23:58Z'}",Aetna Health 
2018-07-06 14:49:53,I see reviews going all the way back to Jan 2018 about this.  Your company is so cheap that we only get one physical ID card now.  It would be nice to have access to this app so that we can get the ID card in our Apple wallet.,1,False,Joe Nevets,Why so long to rollout to all members??,,Aetna Health 
2018-06-07 01:31:08,What sense does that make? Are they paying a higher premium than me? Nice to see Aetna actively ranks customers to see who is worthy enough for their precious app. Have they ever heard of beta testing something before making it live?,1,False,Patsfan121994,Available for a limited audience?,,Aetna Health 
2022-08-22 20:42:23,Setting up Face ID doesn’t work. It was working since I downloaded the app last year but about 6 weeks ago it will not enable Face ID,2,False,Biggerkevo,Face ID,"{'id': 31679051, 'body': 'Hello, Biggerkevo. Thanks for your post. We care about your Aetna Health app experience. I work on Aetna’s support team. If you’ll email our support mailbox, I’ll be happy to look into the issue. Our email address is AetnaHealth-AppSupport@aetna.com. Thanks! Cindy K.', 'modified': '2022-08-26T13:34:50Z'}",Aetna Health 
2023-03-14 19:14:18,"The e-tech support guy I talked to at Aetna said not to use the app, because it causes problems. For one thing, it would not allow me to add my card to Apple Wallet, like the advertisement shows.",1,False,LowCountryLucy,Don’t use this app,"{'id': 35428932, 'body': 'Hello, LowCountryLucy. Thanks for your post. We care about your Aetna Health app experience. I work on Aetna’s support team. If you’ll email our support mailbox, I’ll be happy to look into the issue. Our email address is AetnaHealth-AppSupport@aetna.com. Thanks! Cindy K.', 'modified': '2023-03-16T19:24:40Z'}",Aetna Health 
2023-06-27 00:43:45,Excellent application to access needful information.,5,False,Sharona_az,Aetna App,,Aetna Health 
2022-01-13 19:35:35,"Seriously, I am a new user setting up an account and I have to scroll back to my birthday last century with month by month taps on your tiny little calendar???? You’re kidding, right?",1,False,Melvo845,DOB,,Aetna Health 
2021-12-02 19:51:03,I try to enable face ID but it keeps prompting me to try again later,3,False,"1948462$!,8.83!:",iphone 13 pro,,Aetna Health 
2021-03-27 00:04:46,Impossible for 60 yo to read the ID card.  Can’t expand or even rotate to read the fine print.,3,False,Act3Odyssey,ID card needs eye doctor :),"{'id': 21933328, 'body': 'Hello, Act3Odyssey. Thanks for your post. We care about your Aetna Health app experience. I work on Aetna’s support team. If you’ll email our support mailbox, I’ll be happy to look into this issue. Our email address is AetnaHealth-AppSupport@aetna.com. Thanks! Rick G.', 'modified': '2021-03-29T19:17:19Z'}",Aetna Health 
2020-12-29 13:42:44,Tracking updates are usually delayed!,2,False,His Girl 7,Tracking,,Aetna Health 
2020-07-01 03:25:30,"The Face ID doesn’t work even though it’s enabled. Unable to view EOB, unable to search by your criteria instead it’s what they want to use.",2,False,DCutty,Needs improvement,,Aetna Health 
2020-01-16 20:22:22,Downloaded the app to be able to upload documents from my phone to a claim I have. But says my session has timed out - have never logged into the app. How does one fix that? Thanks!,1,False,Güero0709,Won’t let me log in - says I’ve timed out,,Aetna Health 
2020-01-06 23:46:00,This application does not allow you to search by specialist. It also does not give you the option to see out of network doctors.,1,False,Patient333,Older version worked better,,Aetna Health 
2019-12-22 17:32:43,"This app makes it impossible to look up which providers are in or out of network. Whenever I perform a search, it turns up an error message.",1,False,jhc2019,Impossible to look up providers on this app,,Aetna Health 
2019-12-12 19:12:18,I try to open the app and just get a blank white screen with a spinning wheel and it never loads. At this point I’m not surprised by the shoddy service and products just enough to get by that seems to be the Aetna way.,1,False,Nate182545,Awful and Unresponsive,"{'id': 12367769, 'body': 'Hello, Nate182545. Thanks for your post. We care about your Aetna Health app experience. I work on Aetna’s support team. If you’ll email our support mailbox, I’ll be happy to look into your loading issue. Our email address is AetnaHealth-AppSupport@aetna.com. Thanks! Rick G.', 'modified': '2019-12-12T22:12:56Z'}",Aetna Health 
2019-11-09 01:42:39,"Can’t log in. On first launch it’s just a white screen. If I force close it and reopen, it says my session has expired and if I click the button, it’s the white screen again",1,False,kiddblur,Won’t launch on my iPhone 11,,Aetna Health 
2019-01-03 21:56:12,"I mean, it is literally unusable. An email from Aetna recommended that I use the app. But when I installed it and tried logging in, it told me that I’m not in the special program, and then it redirected me to the Aetna web page in Safari. What a waste of time.",1,False,NF6X,Unusable,"{'id': 6680651, 'body': ""Hi there, NF6X. We’re happy to hear you’re as excited about Aetna Health as we are. I work on Aetna’s support team. If you’ll email our support mailbox, I’ll be happy to see what's going on to send you to the web page. Our email address is AetnaHealth-AppSupport@aetna.com.\n\nThanks!\nCindy K."", 'modified': '2019-01-04T19:32:25Z'}",Aetna Health 
2018-10-10 20:04:29,Tried to register my insurance details and it says cannot find member.  Tried several times using my member ID and then with Social Security no.  Still doesn’t work.  Pointless unless you can fix this...,1,False,Ludballs,Doesn’t work,"{'id': 5526804, 'body': 'Thanks for your post. We care about your Aetna Health app experience. I work on Aetna’s support team. If you’ll email our support mailbox, I’ll be happy to figure out why your ID isn’t working. Our email address is AetnaHealth-AppSupport@aetna.com.\nThanks! Cindy K.', 'modified': '2018-10-16T16:01:57Z'}",Aetna Health 
2023-04-26 17:44:03,"Very cool app, user friendly interface, no bugs/bots 👍🏿💯💯🙏🏿😎",5,False,BRIAN LEADBETTER,Great App,,Aetna Health 
2023-03-12 00:05:50,Good Design.,4,False,Akkimeet,Should have been more fast,,Aetna Health 
2023-04-24 16:36:07,It has a lot of wrong information. Misleading and making you lose time to schedule appointments,1,False,Music Schools,It need updates,"{'id': 36233550, 'body': 'Hi Music Schools, We care about your Aetna app experience. If you’ll contact me at \r\naetnahealth-appsupport@aetna.com, I’ll work with you to get you up and running. \r\nI look forward to working with you.  Greg H.', 'modified': '2023-04-28T23:33:22Z'}",Aetna Health 
2022-08-10 15:11:43,"I Can only see personal deductible, no EOBs.  This is my login, but spouse plan.  So I have to ask her to send them to me before I pay a bill.",2,False,Steve-O-Rooney,"Can only see deductible, no EOBs",,Aetna Health 
2022-09-06 14:46:22,Why is it that all my previous claims… show a balance owed? I have paid these balances already and yet they are not updating on my app?,1,False,donbidis,Claims do not update when paid??,,Aetna Health 
2022-05-18 15:50:51,I’m trying to use you have any keeps freezing on me for some quite reason I don’t know why,1,False,edwin31 M,Unable to understand this with the app,"{'id': 29852775, 'body': 'Hello, edwin31. We care about your Aetna Health app experience. I work on Aetna’s support team. If you’ll email our support mailbox at AetnaHealth-AppSupport@aetna.com, we’ll be happy to assist with any issues you may be having with the app. I look forward to hearing from you. Thanks! Cheryl M.', 'modified': '2022-05-19T23:47:12Z'}",Aetna Health 
2022-03-12 02:46:31,Why is the medication search feature greyed out and not available? Whats the point  of having it there if its not usable? Frustrating,1,False,Believe458,Pharmacy portion,,Aetna Health 
2020-08-29 18:32:39,I hate this app! Can’t find anything as far as billing and EOBS,5,False,gladys bo,Bad app,,Aetna Health 
2022-02-12 02:38:43,"App crashes constantly, within seconds of trying to search for something.",1,False,starlight885,Crashes all. The. Time.,,Aetna Health 
2022-01-21 12:05:43,"Gives option for you to request card, but keeps given an error and not requesting them",1,False,fghvcfghuhhgfghhhgg,ID cards,,Aetna Health 
2022-01-06 03:19:04,I have had nothing but problems with this app since I downloaded it. I’ve deleted it and reinstalled it. It NEVER lets me log in! I have to go to the website every tine. Why have an app that NEVER works?!?!,1,False,Photodiva2000,TERRIBLE APP,"{'id': 27308077, 'body': 'Hello, Photodiva2000. Thanks for your post. We care about your Aetna Health app experience. I work on Aetna’s support team. If you’ll email our support mailbox, I’ll be happy to look into the issue. Our email address is AetnaHealth-AppSupport@aetna.com. Thanks! Cindy K.', 'modified': '2022-01-07T20:14:13Z'}",Aetna Health 
2021-09-07 22:53:13,It keeps taking me to the login screen on the web..telling me the app needs enhancements every time I try to login! Please fix this issue immediately,1,False,jaytheaquarius,Terrible,"{'id': 25008971, 'body': 'Hello, jaytheaquarius. Thanks for your post. We care about your Aetna Health app experience. I work on Aetna’s support team. If you’ll email our support mailbox, I’ll be happy to look into the issue. Our email address is AetnaHealth-AppSupport@aetna.com. Thanks! Cindy K.', 'modified': '2021-09-09T17:19:54Z'}",Aetna Health 
2021-08-20 02:41:53,My plan should show but it’s not. I’ll be back once it’s fixed to add / change it.,2,False,Mineral2004,Not loading plans,"{'id': 24672286, 'body': ""Hello Mineral2004, Thanks for your post. We care about your Aetna Health app experience. I work on Aetna's support team. If you’ll email our support mailbox, I’ll be happy to look into the issue. Our email address is AetnaHealth-AppSupport@aetna.com. Thanks! Rick G."", 'modified': '2021-08-23T16:33:53Z'}",Aetna Health 
2021-08-13 14:06:06,Takes you straight to the desktop version after you login so no real use for this mobile app.,1,False,R. Drew,Useless mobile app,"{'id': 24564376, 'body': 'Hello, R. Drew. Thanks for your post. We care about your Aetna Health app experience. I work on Aetna’s support team. If you’ll email our support mailbox, I’ll be happy to look into this for you. Our email address is AetnaHealth-AppSupport@aetna.com. Thanks! Cheryl M.\r\n\r\n', 'modified': '2021-08-17T22:21:57Z'}",Aetna Health 
2021-06-09 01:07:29,"Just downloaded and set up an account just to get told that this app is limited to certain audiences, with that being said don’t waste your time!",1,False,me9995,Not worth it,"{'id': 23399390, 'body': 'Hello, me9995. Thanks for your post. We care about your Aetna Health app experience. I work on Aetna’s support team. If you’ll email our support mailbox, I’ll be happy to look into this for you. Our email address is AetnaHealth-AppSupport@aetna.com. Thanks! Cheryl M.', 'modified': '2021-06-15T14:46:53Z'}",Aetna Health 
2021-01-21 21:30:19,"They claim to update this app regularly, but many providers are mislabeled as “accepting new clients” when in reality they are full. This is just one of several frustrating errors.",1,False,zippygal,Very poor,,Aetna Health 
2019-06-18 00:40:30,I love the new app it’s very cool and actually I can make payments.,5,False,Man4323,Convenient app,"{'id': 9290730, 'body': 'Hello, Man4323. We care about your Aetna Health app experience and appreciate your feedback.  We encourage you to continue using our app as we’re continuously adding new features. Thanks! Cheryl M.', 'modified': '2019-06-21T17:43:54Z'}",Aetna Health 
2020-08-15 09:07:59,The app has had ‘technical difficulties’ pulling up my health insurance card since I downloaded it. It makes me wonder what is the point of even having it.,1,False,Snetjob375,Can’t access my mobile health insurance card,"{'id': 17353335, 'body': 'Hello, Snetjob375. Thanks for your post. We care about your Aetna Health app experience. I work on Aetna’s support team. If you’ll email our support mailbox, I’ll be happy to look into the issue. Our email address is AetnaHealth-AppSupport@aetna.com. Thanks! Cindy K.', 'modified': '2020-08-18T12:14:09Z'}",Aetna Health 
2020-03-08 17:28:56,"All it has to do is store a digital insurance card, but when I open the card it says “we’re having technical issues, please try again later.” So if I’m at the dentist I guess I’m out of luck????",1,False,rpg702,Doesn’t work,,Aetna Health 
2020-03-07 16:20:51,The new update says This problem solved. Sorry to inform you but it’s not fixed. It freezes up when you enable it.,2,False,Toddg3,Face Recognition not fixed.,,Aetna Health 
2019-12-18 14:32:52,This app updates too often and very different every time. It’s not user friendly at all! I have to spend a lot of time trying to figure out the new set up.,1,False,Loki iuiu,Updates too often,"{'id': 12492771, 'body': 'Hello, Loki iuiu. We care about your Aetna Health app experience and appreciate your feedback. With every new app version we are introducing new features and improving existing ones. We are sure that your feedback will only help us improve further.\nThanks! Cindy K.', 'modified': '2019-12-19T16:19:40Z'}",Aetna Health 
2019-06-20 18:44:45,"The provider directory is out of date. Listed providers in my area are either not accepting new patients (even though the directory says they are), are no longer in that location, or their phone is disconnected.",1,False,aeoliphile,Provider Directory,"{'id': 9367403, 'body': 'Hello, aeoliphile. Thanks for your post. We care about your Aetna Health app experience. I work on Aetna’s support team. If you’ll email our support mailbox, I’ll be happy to look into the issue of your white screen. Our email address is AetnaHealth-AppSupport@aetna.com. Thanks! Rick G.', 'modified': '2019-06-26T16:33:06Z'}",Aetna Health 
2019-04-21 19:15:32,"Aetna is NOT cheap insurance to have, and had fewer benefits, including the fact that apparently regardless of the fact that I have one of their top plans and my employer is a HUGE client, we’re not important enough to have access to this “awesome” app.",1,False,LeoWife083,Not available for me?,,Aetna Health 
2023-04-29 00:42:14,I have never had such a hard time giving a company my money. Its a shame two well-known brands developed a product that is so flawed.,1,False,MaryGMacAtl,So disappointed,,Aetna Health 
2023-03-06 22:04:05,"Aetna is the worst insurance company I have ever had. You have to fight for every benefit, argue to get information and spend way too much time worrying if your claims will be paid or not.",1,False,chefscook,Any other company,,Aetna Health 
2022-11-02 20:32:40,When you get a statement it shows you owe money.  If the bill is paid it never shows that. I guess the only want to get paid,1,False,Hates shopping,Terrible app,,Aetna Health 
2022-06-02 06:59:59,"I tried multiple times to open the app or web version but it kept showing me ""ERROR 20"". Please fix it asap",1,False,biezairangwoqiminglexingbuxing,It kept sending me the error message  ERROR 20,"{'id': 30176236, 'body': 'Hello, biezairangwoqiminglexingbuxing. Thanks for your post. We care about your Aetna Health app experience. I work on Aetna’s support team. If you’ll email our support mailbox, I’ll be happy to look into the issue. Our email address is AetnaHealth-AppSupport@aetna.com. Thanks! Cindy K.', 'modified': '2022-06-06T02:46:07Z'}",Aetna Health 
2021-05-26 05:47:22,Fast access to app.   Touch ID  works  wonderfully.    Great app! 👌👍,5,False,1Anrs,Smack,"{'id': 23053285, 'body': 'Hello, Smack. We care about your Aetna Health app experience and appreciate your feedback.  We encourage you to continue using our app as we’re continuously adding new features. If you have any questions, email our support mailbox at AetnaHealth-AppSupport@aetna.com. Thanks! Cheryl M.\n\n', 'modified': '2021-05-27T23:03:48Z'}",Aetna Health 
2022-02-15 22:53:18,"EVERY SINGLE TIME I open this app it asks me to put in my email address. Not as a sign in, but once I’m in it gives me a pop up that demands my email “because it’s not on file”. Every. Single. Time.",1,False,rxk rxk,"Pls fix, thanks",,Aetna Health 
2021-10-27 18:14:30,Most of the functions just give me errors and it crashes often. Please fix your app.,1,False,churaghost,Slow and barely works,"{'id': 25968764, 'body': 'Hello, churaghost. Thanks for your post. We care about your Aetna Health app experience. I work on Aetna’s support team. If you’ll email our support mailbox, I’ll be happy to look into this for you. Our email address is AetnaHealth-AppSupport@aetna.com. Thanks! \r\nMeg B. \r\n\n\n', 'modified': '2021-10-29T13:01:02Z'}",Aetna Health 
2021-10-03 15:59:23,"Garbage coverage and a completely tucking application. I can’t even read this review as I’m typing it, I just see empty space and a carry moving across the screen.",1,False,minivanmegafun,Awful,,Aetna Health 
2021-07-15 09:52:31,I don’t think your app is very reliable. I know the numbers are wrong and I can’t find anything useful.,2,False,not the only one bored,Unreliable,"{'id': 24007596, 'body': 'Hello. We care about your Aetna Health app experience. I work on Aetna’s support team. If you’ll email our support mailbox at AetnaHealth-AppSupport@aetna.com, we’ll be happy to assist with any issues you may be having with the app. I look forward to hearing from you. Thanks! Cindy K.', 'modified': '2021-07-19T13:17:48Z'}",Aetna Health 
2019-11-26 07:17:35,It won’t let me even use it to do anything,4,False,jackd20420455,Wont let me use it,"{'id': 12070277, 'body': 'Hello, jackd20420455. Thanks for your post. We care about your Aetna Health app experience. I work on Aetna’s support team. If you’ll email our support mailbox, I’ll be happy to look into the issue. Our email address is AetnaHealth-AppSupport@aetna.com. Thanks! Cindy K.', 'modified': '2019-11-26T22:13:22Z'}",Aetna Health 
