date,review,rating,isEdited,title,userName,developerResponse,App_Name
2022-08-16 23:46:34,It’s not working and tried to delete and that didn’t work either 🙄,1,False,Cancel please,Dizznmo,,InPulse Heart Rate Monitor
2022-08-03 08:01:33,I can’t see how to measure blood pressure or oxygen levels.  Tutorial would help !,2,False,Confusing,DloiDean,,InPulse Heart Rate Monitor
2022-04-27 07:47:27,You have to write a message to cancel. This should be a click,1,False,Not easy to cancel,Bread1225,,InPulse Heart Rate Monitor
2021-12-20 09:16:33,It is okay and it works but if you want to use it it costs money and quite a lot of it. $50 for a year? Or you can choose $5 a week. Good lord.,1,False,App is ok,jaydenanst,,InPulse Heart Rate Monitor
2021-11-13 15:05:37,Don’t do it trust me huge scamTricked you into giving her information and signing up for an account first and then wants huge money,1,False,Scam,dumbrent,,InPulse Heart Rate Monitor
2021-09-10 02:44:23,Why do u gotta pay for something like this everything on here should be free the world we live in smh. I try not to give y’all a star but I know how that go lol,1,False,Smh,fckyallassdcvv,"{'id': 25280453, 'body': ""Hi! Thank you for your review. Our app offers a free trial with all premium features included. You can start a free trial or continue using the app for free with basic features. In the free version of the app you can only get 3 heart readings per day. The premium version has no limitations. Don't hesitate to reach out to us at support@aiby.com, if you have any questions."", 'modified': '2021-09-23T14:58:28Z'}",InPulse Heart Rate Monitor
2020-05-15 22:00:41,Please add a button to indicate this is a resting/normal. I was simply working remotely - no stress but my heart was racing at 113 bpm. Would like to make sure that’s reflected as rapid rather than normal.,2,False,"Record low, normal, and rapid",mperks shopper,,InPulse Heart Rate Monitor
2023-03-18 02:39:51,Has nice pulse checker and helped me to develop habitats,5,False,Great app!,owbsusvdhdgsbs,,InPulse Heart Rate Monitor
2023-05-05 07:48:15,Not as advertised! Doesn’t work. Not even worth downloading! Pass it up ! Thank you next.,1,False,Not worth it!,COOL GAME(:,"{'id': 36961098, 'body': 'Hello! Thank you for taking the time to leave us a review. We kindly ask you to contact us at support@aiby.com so that we can look into the matter and resolve this situation. Our support team will be able to assist you better.', 'modified': '2023-06-06T15:25:02Z'}",InPulse Heart Rate Monitor
2020-05-15 19:16:17,Very easy to use and informative.,5,False,Heart Rate,CMP@@,,InPulse Heart Rate Monitor
2022-11-28 15:43:37,I tried this for myself and I kept getting 70 so I tried it on clothing and it still said 70 and I don’t think clothing’s have heartbeats so this is a total scam,1,False,Scam,Jayden nn,,InPulse Heart Rate Monitor
2022-09-13 21:22:18,I purchased this by mistake and it seems like junk. I’m trying to get a refund.,2,False,Mistake,PankeyJM,,InPulse Heart Rate Monitor
2022-08-21 03:07:43,The only thing it gives you free is your heart rate. Must pay for everything else during the “free” trial time,1,False,Nothing free as advertised,Dan from South of Dallas,,InPulse Heart Rate Monitor
2021-12-20 14:40:28,"We have a Holter monitor, and we compared to it, not even close. This is bad as it can lead to a false reading.

Uninstalled",1,False,Not accurate at all,Pr1va73,,InPulse Heart Rate Monitor
2021-02-26 16:25:08,Spent 15 minutes trying to get it to read and it would only come up when I moved my finger OFF the camera.,1,False,Junk app.,mikeyprice1981,"{'id': 21395297, 'body': 'Hi! Thank you for your feedback! We are sorry to hear that. Please feel free to contact our support staff at support@aiby.mobi, we will be happy to investigate this issue.\r\n', 'modified': '2021-03-02T11:17:08Z'}",InPulse Heart Rate Monitor
2020-09-08 00:46:37,You can get much better apps that are free to use and you don’t need to pay monthly,1,False,You have to pay,user17382,,InPulse Heart Rate Monitor
2020-04-24 05:36:18,This app is I would say 95% accurate when it come to checking your heart rate. AMAZING APP!! BEST ONE YET!!!😃😃😃😃😃😃😃😃😃,5,False,AMAZING AND ACCURATE,CURRYGOAT101,,InPulse Heart Rate Monitor
2023-03-07 17:27:13,Scared,5,False,It’s funny an so times I am at scared scared,La’Miya,,InPulse Heart Rate Monitor
2023-10-15 22:26:58,Helping me calm down.,5,False,Constance,See Art,,InPulse Heart Rate Monitor
2023-03-20 17:05:15,Put it up to anything red and it’ll give it a pulse. Tried it with a water bottle that had dye in it and it came back with 90~ bpm. Waste of time.,1,False,Heart rate is fake,MrTangyrine,,InPulse Heart Rate Monitor
2022-10-12 22:15:04,"Lame, can’t do anything for you like actually measure things other than your pulse. Complete waste of money.",1,False,What a piece of crap,piss-0ff,,InPulse Heart Rate Monitor
2021-10-30 11:06:40,"Pulse enables me to know what’s going on inside my body at any given time!

You tell me! How good is that?

Thank you pulse for being easy to use!

Dr Mkh",5,False,So Happy!,University of Trading,,InPulse Heart Rate Monitor
2023-06-27 04:15:43,I just needed an app to measure heart rate not another reason to hate the business model of mobile apps.,1,False,Subscription model is predatory,MorphVex,"{'id': 37531831, 'body': ""Hello! Our app clearly displays all subscription-related information when offering subscriptions. We strive to offer a fair pricing structure that provides value to our users while also supporting the ongoing development and maintenance of our app. We understand that subscription models may not be suitable for everyone, and we respect your perspective. If you have any specific concerns or suggestions, please don't hesitate to reach out to our support team at support@aiby.com"", 'modified': '2023-07-07T08:41:38Z'}",InPulse Heart Rate Monitor
2022-11-18 13:55:22,"i have POTS(syndrome which affects my heart rate) and while i could feel my heart beating in my head it gave me a low score, which i knew, was false. it doesnt work.",1,False,DOES. NOT. WORK.,ska1a,,InPulse Heart Rate Monitor
2022-10-19 14:22:09,This app is misleading. It takes BPM on non human objects. It also made it seem like you can take your blood pressure! I WANT A REFUND! Had it for 5 minutes and deleting!,1,False,DONT DOWNLOAD,rae alfred,,InPulse Heart Rate Monitor
2022-07-05 14:30:28,Won’t do anything past info page like height and weight. Just horrible,1,False,Horrible,G20man,"{'id': 31763874, 'body': 'Hi there! Thanks for taking the time to share this feedback. We are sad to know that your experience on the app was not satisfactory. Please share your issue with us at support@aiby.com and we will look into it at the earliest.', 'modified': '2022-08-31T10:30:12Z'}",InPulse Heart Rate Monitor
2022-05-26 02:25:51,This app is a money scam it does not work. Your iPhone CANNOT check your heart rate. It DOES NOT contain the technology to read your heart rate. I put my phone on my vape and it said it had a heart rate of 91. DO NOT USE THIS APP OR ANY APP THAT CLAIMS TO CHECK YOUR HEART RATE THEY ARE SCAMS,1,False,Fake app,lihreschutvj,"{'id': 30288506, 'body': ""Hello! Thank you for your review. We are sorry that we didn't meet your expectations. We gladly offer a free trial with all premium features included before committing to payment. It's possible to use the app for free with basic features. A subscription is necessary to use the app without limitations. Please kindly note that our app is based on contact photoplethysmography. You may find this information in the FAQ section of the application. The algorithm detects variations of light absorption caused by arterial blood-volume pulsations. If you are open to sharing more details about the issue, please contact us at support@aiby.com."", 'modified': '2022-06-10T16:24:33Z'}",InPulse Heart Rate Monitor
2022-05-12 11:51:21,6.99 a week or 50 a month high price,1,False,Everything is pay here and there,Wanda Galloza,"{'id': 30993041, 'body': ""Hi! Thanks for taking the time to share this feedback. Our app offers a free trial with all premium features included. You can start a free trial or continue using the app for free with basic features. In the free version of the app you can only get 3 heart readings per day. The premium version has no limitations. Don't hesitate to reach out to us at support@aiby.com, if you have any questions."", 'modified': '2022-07-20T10:25:22Z'}",InPulse Heart Rate Monitor
2021-09-30 12:04:08,Great app I recommend,5,False,Best app,Black 182,"{'id': 25704354, 'body': ""Hi there! Thank you so much for taking the time to leave us a 5 star rating - it's much appreciated!"", 'modified': '2021-10-15T15:07:13Z'}",InPulse Heart Rate Monitor
2021-08-03 19:41:18,Nothing exciting 😑,5,False,Its okay,babygurllll💪🏼,,InPulse Heart Rate Monitor
2021-12-13 02:08:51,Like why,3,False,Why do you have to buy InPulse pro,Naruto........................,"{'id': 27446284, 'body': ""Hi! Thank you for your review. Our app offers a free trial with all premium features included. You can start a free trial or continue using the app for free with basic features. In the free version of the app you can only get 3 heart readings per day. The premium version has no limitations. Don't hesitate to reach out to us at support@aiby.com, if you have any questions."", 'modified': '2022-01-14T14:03:57Z'}",InPulse Heart Rate Monitor
2020-10-21 17:30:29,"at first this app was good and now i have to wait 20 friggen minutes for it to stop reading my pulse and give me an end result. it usually gives an amount of time telling how long the entire process should take, but it will get close to 2 secs left and then jump back up to 10 secs. and it does this multiple times.",1,False,terrible,Xferxanityy,"{'id': 18657286, 'body': 'Hello! We are sorry about the situation! Please contact our customer support at support@freeplay.mobi so we can investigate this issue. Thank you!', 'modified': '2020-10-23T07:11:29Z'}",InPulse Heart Rate Monitor
2020-09-21 20:26:58,This app is a waste of time they just use bots to give them 4-5stars I kept putting my finger in front of the flash/cam and it didn’t work,1,False,Horrible terrible,my tiktok is lwky.x.jhi,,InPulse Heart Rate Monitor
2023-11-09 17:01:39,This app kept charging me when I tried numerous times to delete it!,1,False,Do not download!,TommyLayne15,"{'id': 40131375, 'body': 'Hi there! Thank you for taking the time to leave us a review. Our customers are advised about subscription conditions beforehand with full transparency. If you canceled the subscription at least 24 hours before the end of the current period, then your account should not have been charged for renewal. Kindly note that only active subscriptions can be automatically renewed. Please contact our customer support at support@aiby.com so that we could look into the matter.  Our support team will be able to assist you better.\n', 'modified': '2023-11-14T16:09:37Z'}",InPulse Heart Rate Monitor
2023-06-05 03:49:46,I tested this app and it’s fake let me explain I tested it on something red like a toy or pillow and it still showed how many beats per min didn’t know pillows were alive,1,False,FAKE,XluxlyX,"{'id': 36960498, 'body': 'Hello! Thank you for taking the time to leave us a review. Kindly note that our app is based on contact photoplethysmography. You may find this information in the FAQ section of the application. The algorithm detects variations of light absorption caused by arterial blood-volume pulsations. However, this method may result in inaccurate readings if you try to measure the light on non-living objects. Just drop us an email at support@aiby.com if you require any assistance. We will be happy to help you.', 'modified': '2023-06-06T14:56:28Z'}",InPulse Heart Rate Monitor
2022-09-15 14:18:53,Appears to use dark pattern to get people to subscribe for even basic functionality.,1,False,Dark pattern,Falling Lots,,InPulse Heart Rate Monitor
2023-10-27 02:30:19,Now i gotta pay to see my heart score,2,False,Gotta pay,mrs washington21,"{'id': 39825890, 'body': 'Hello! We offer a free version of our app with certain limitations. We also offer a free trial without any limitations before committing to payment. Just drop us an email at support@aiby.com if you require any assistance. We will be happy to help.', 'modified': '2023-10-30T15:17:49Z'}",InPulse Heart Rate Monitor
2020-09-08 18:35:23,The reviews are fake they do that to get you to install the app it’s fake and it will not work it cannot accurately detect your heart rate through a camera and a flashlight.,1,False,THE REVIEWS ARE FAKE THIS DONT WORK IT IS TRASH.,Andre Radbod,,InPulse Heart Rate Monitor
2023-08-24 15:52:14,They will continue charging you after you unsubscribe . Worst thing an app can do,1,False,Don’t subscribe!,chellena90,"{'id': 38665770, 'body': 'Hello! Thank you for taking the time to leave us a review.  Our app clearly displays all subscription-related information when offering subscriptions. Our customers are advised about subscription conditions beforehand with full transparency. If you canceled the subscription at least 24 hours before the end of the current period, then your account should not have been charged for renewal. Kindly note that only active subscriptions can be automatically renewed. Please contact our customer support at support@aiby.com so that we could look into the matter.  Our support team will be able to assist you better.', 'modified': '2023-09-01T14:19:09Z'}",InPulse Heart Rate Monitor
2023-07-24 17:12:34,You can download the app for free but to use ANY if the features requires to sign up using a credit card. The app is a scam.,1,False,"Title says free, but actually isnt!!!",Cnlundgren,"{'id': 37940428, 'body': 'Hello! Thanks for the review! Our app offers a free trial with all premium features included. You can start a free trial or continue using the app for free with basic features. In the free version of the app you can only get 3 heart readings per day. If you have any questions or concerns, please let us know at support@aiby.com. We will be happy to assist you.', 'modified': '2023-07-27T15:00:38Z'}",InPulse Heart Rate Monitor
2023-03-02 22:34:25,"This app is a fraud and Support is worthless!! They sucker you to specific features and once you purchase, it disappears!!",1,False,Don’t buy the app!!!!!,Big red rage,,InPulse Heart Rate Monitor
2023-01-23 11:20:45,"Yeah, let me pay 7$ monthly to use locked hardware. The creators of this app and anyone who uses it should get aids for promoting this extortion.",1,False,Terrible app,ATHMEIC G,,InPulse Heart Rate Monitor
2022-12-08 03:28:08,This app only measures heart rate. It doesn’t measure bp or o2 sat. You have input those. For 9.00 a month? Rip off! I will cancel I can take my own pulse.,1,False,Misleading,Frank 37,,InPulse Heart Rate Monitor
2022-09-27 19:14:31,"The blood pressure measuring screen keeps loading, but not showing any data.
The heart rate measurement works fine.",1,False,Blood pressure not measured,Taylor88$,,InPulse Heart Rate Monitor
2022-09-02 02:51:19,Even with a paid subscription it doesn’t do what it says,1,False,App doesn’t do what it says,Lafreda,,InPulse Heart Rate Monitor
2022-08-25 12:21:15,App did not work for me I tried to cancel within minutes but the billed me any way.,1,False,Can’t cancel.,Tominrome,,InPulse Heart Rate Monitor
2022-08-14 21:12:21,I bought this to monitor my O2 & maybe heart rate. They won’t give me any info but keep. Changing the plan & uping the price.,1,False,They just keep upping the price,Disorganized and forgetful,,InPulse Heart Rate Monitor
2022-06-30 16:53:34,You’ll be a sucker if you buy it.,1,False,Too much money for the app and all the extra money to make it work😡😡,MaggieMcB,"{'id': 30987236, 'body': ""Hi there! Thanks for taking the time to share this feedback, your review is very important to us. We gladly offer a free trial with all premium features included before committing to payment. It's possible to use the app for free with basic features. A subscription is necessary to use the app without limitations. Please drop us an email at support@aiby.com and we will look into the matter immediately. We are always happy to help."", 'modified': '2022-07-20T06:45:31Z'}",InPulse Heart Rate Monitor
2022-02-10 04:34:58,I’m sure it would be good if yah want to pay for this app. Plenty of free ones out there,1,False,You have to pay,SofaKinghi7,"{'id': 28236388, 'body': ""Hi there! Thanks for taking the time to share this feedback, your review is very important to us. We gladly offer a free trial with all premium features included before committing to payment. It's possible to use the app for free with basic features. A subscription is necessary to use the premium features. We always appreciate hearing feedback from our members, so please feel free to reach out to us anytime at support@aiby.com to share your thoughts!"", 'modified': '2022-02-24T12:44:15Z'}",InPulse Heart Rate Monitor
2021-11-02 05:36:54,Not worth it,1,False,Wants money up front if u want to use this app you must pay not worth it delete,freethelion,,InPulse Heart Rate Monitor
2020-12-18 23:05:53,"I want a simple heart rate monitor. I don’t want goals, record keeping or subscriptions.

This one does not fill the bill.",1,False,"Sorry, not interested in subscriptions",JohnnyFry1,"{'id': 19930827, 'body': 'Hello! We see that you gave us 1 star. If you have any suggestions to help us improve, please let us know at support@freeplay.mobi. Thank you!', 'modified': '2020-12-22T12:40:31Z'}",InPulse Heart Rate Monitor
2020-08-19 22:26:06,The limited version will only allow one pulse check.,1,False,Limited version,84jric,,InPulse Heart Rate Monitor
2021-06-22 06:49:59,You need blood pressure an Spo2 to know any thing about a patients health conditions.,2,False,Blood Pressure doesn't display,CubanChevy,"{'id': 23905029, 'body': 'Please contact our customer support at support@aiby.com if you experience difficulties using our app. We will be happy to assist you. Thank you! \r\n', 'modified': '2021-07-13T12:42:54Z'}",InPulse Heart Rate Monitor
2022-08-03 06:42:24,I used my Apple Watch to check my bpm to compare at the same time it was 10 to 20 off,1,False,Fake,Bus Mechanic,,InPulse Heart Rate Monitor
2022-07-02 18:15:00,I entered all my info. App does nothing after that… no buttons to continue … nothing…,1,False,What’s going on,JWHudd,"{'id': 31763880, 'body': 'Hi there! Thanks for taking the time to share this feedback.  We are sad to know that your experience on the app was not satisfactory. Please share your issue with us at support@aiby.com and we will look into it at the earliest.', 'modified': '2022-08-31T10:30:35Z'}",InPulse Heart Rate Monitor
2022-03-01 14:51:35,Can’t exit out the part that they want money,1,False,No way to get out the money part,TorstenCoulson,,InPulse Heart Rate Monitor
2023-07-09 22:00:00,Free and simple. I use for school pea,5,False,Good,whatnameisnottakenomg,,InPulse Heart Rate Monitor
2021-06-21 08:58:18,"A little pricey for just a pulse reading, I thought the app would be able to take your blood pressure.",1,False,Review,jor men,"{'id': 23904967, 'body': 'Hi! Our app offers a free trial with all premium features included. You can start a free trial or continue using the app for free with basic features. In the free version of the app you can only get 3 heart readings per day. The premium version has no limitations.', 'modified': '2021-07-13T12:39:01Z'}",InPulse Heart Rate Monitor
2021-01-15 03:56:37,Downloaded for nothing it didn’t work 50 dollars to join a app that don’t work  don’t waste your time or money on this app,1,False,Didn’t work,stop askng 4nick name,"{'id': 20495162, 'body': 'Hi! \rThank you for your feedback! We are sorry to hear that. Please feel free to contact our support staff at support@aiby.mobi, we will be happy to investigate this issue.', 'modified': '2021-01-19T07:42:17Z'}",InPulse Heart Rate Monitor
2020-05-02 19:11:28,It could be me and my A-fun but I have a hard time getting a completed reading. I think I got 1 out of maybe 30 tries.,1,False,I’m Disappointed,oldbroad2,,InPulse Heart Rate Monitor
2023-10-29 06:48:49,There are no charts or definitions of what each score means? Try to google and it doesn’t match googles definition.,1,False,What does it mean?,notaceatall,"{'id': 39841935, 'body': ""Hello! We apologize for the inconvenience. If you're encountering issues with the definitions or charts within the app, we'd recommend contacting our support team directly at support@aiby.com. They can assist you further and provide clarity on the scores or any information you require."", 'modified': '2023-10-31T08:59:12Z'}",InPulse Heart Rate Monitor
2023-01-15 21:55:08,love the app it’s so useful . i’m an athlete and after track meets i measure my heart rate for fun . definitely a useful download ♥️🤗,5,False,my review,maddyyyyy♥️💕,,InPulse Heart Rate Monitor
2022-10-05 07:10:25,I love this app this app is a good app that I love,5,False,I love this app this app is a good app that I love,AnthonyMiller 808,,InPulse Heart Rate Monitor
2021-01-15 16:23:05,Tks for your service,5,False,Jorge,Corvette80$,,InPulse Heart Rate Monitor
2021-07-21 22:01:50,This app overcharges for what your Apple Watch already does for free. It can’t do anything other than take your pulse.,1,False,Waste,popbutq6591,"{'id': 24490540, 'body': 'Hi! Our app offers a free trial with all premium features included. You can start a free trial or continue using the app for free with basic features. In the free version of the app you can only get 3 heart readings per day. The premium version has no limitations.', 'modified': '2021-08-13T12:23:57Z'}",InPulse Heart Rate Monitor
2021-05-03 03:05:27,They do not tell you it cost money just want you to download the app,1,False,Too expensive,muhhh123,"{'id': 22790075, 'body': 'Hi! Our app offers a free trial with all premium features included. You can start a free trial or continue using the app for free with basic features. In the free version of the app you can only get 3 heart readings per day. The premium version has no limitations.', 'modified': '2021-05-13T14:10:08Z'}",InPulse Heart Rate Monitor
2021-01-18 01:06:38,"Tried 1000 times, either everyone around me and I are all dead... or this thing does not work...",1,False,Not working for iPhone 11,Cherturd,"{'id': 20504339, 'body': 'Hello! Thank you for your feedback! We are sorry to hear that. Please feel free to contact our support staff at support@aiby.mobi, we will be happy to investigate this issue.\r\n', 'modified': '2021-01-19T13:23:29Z'}",InPulse Heart Rate Monitor
2023-07-30 21:26:26,For this piece of crap? I’ll just buy a blood pressure machine for $20 never mind waste of time,1,False,Come on man 6.99 a week? $75 a year,Trashpanda 3938722772,"{'id': 38663525, 'body': 'Hello! Thanks for the review! Our app offers a free trial with all premium features included. You can start a free trial or continue using the app for free with basic features. In the free version of the app you can only get 3 heart readings per day. If you have any questions or concerns, please let us know at support@aiby.com. We will be happy to assist you.', 'modified': '2023-09-01T12:27:27Z'}",InPulse Heart Rate Monitor
2022-04-20 10:12:21,"This app appears to be free, but it tries to force you to buy a service immediately. Be careful if you try to download it.",1,False,Not free,Imwithher1965,,InPulse Heart Rate Monitor
2022-03-25 06:32:36,"Cant figure out how to get it to work, it just has a form to fill out my gender age weight etc…",1,False,I dont know,Ethreal.,,InPulse Heart Rate Monitor
2021-06-16 21:18:16,Never gave me a result even after holding for 5 minutes.,1,False,This is a joke,DontTellMeThisUnameIsTakenToo,"{'id': 23901623, 'body': 'Please contact our customer support at support@aiby.com if you experience difficulties using our app. We will be happy to assist you. Thank you! \r\n', 'modified': '2021-07-13T09:58:08Z'}",InPulse Heart Rate Monitor
2021-04-01 16:50:43,I didn’t get very far into this app and an in app purchase started before I could continue.  So disappointing.,1,False,Disappointing,Fairennuf,"{'id': 22067231, 'body': ""Hello! Our app offers a free trial subscription and provides full subscription information. It does not start any subscription without user's approval - it is impossible to start a subscription without authorization. App Store trial subscriptions will automatically be renewed and converted into a paid subscription until you choose to end them in iTunes Subscriptions (please check Apple Support page for details: https://support.apple.com/en-us/HT202039). This information is also displayed on the app description page, so users can see it before downloading the app. You can also review or cancel subscription using a link provided in the Subscription Confirmation email."", 'modified': '2021-04-06T07:39:12Z'}",InPulse Heart Rate Monitor
2023-01-22 04:56:40,Very good app,5,False,good so far,Bbuckk234523,,InPulse Heart Rate Monitor
