date,review,rating,isEdited,title,userName,developerResponse,App_Name
2023-10-15 17:09:17,If you put the camera on anything red it will give it a heart rate,1,False,Fake,hentusmjsjsms,"{'id': 39567766, 'body': 'Hello! Thank you for taking the time to leave us a review. Kindly note that our app is based on contact photoplethysmography. You may find this information in the FAQ section of the application. The algorithm detects variations of light absorption caused by arterial blood-volume pulsations. However, this method may result in inaccurate readings if you try to measure the light on non-living objects. Just drop us an email at support@aiby.com if you require any assistance. We will be happy to help you.\n', 'modified': '2023-10-17T13:33:21Z'}",InPulse Heart Rate Monitor
2023-09-25 00:10:24,"The social media ads make it seem like it checks blood pressure, but it does not.",1,False,Blood Pressure,Ethan A.,"{'id': 39148651, 'body': 'Hello! Thank you for sharing your feedback. We apologize for any confusion caused by the wording in our app description. The app does not measure blood pressure directly as it requires specialized equipment. However, it does allow users to log and track their blood pressure readings manually, which can be helpful for monitoring and managing their health over time. Thank you for your input.\n', 'modified': '2023-09-26T10:24:48Z'}",InPulse Heart Rate Monitor
2023-08-16 09:25:49,"Not a free app. It’s just a free trial, and they automatically charge you in a week. Deleted.",1,False,Fair warning,Another Beekeeper,"{'id': 38665737, 'body': 'Hello! Thanks for the review! Our app offers a free trial with all premium features included. You can start a free trial or continue using the app for free with basic features. In the free version of the app you can only get 3 heart readings per day. If you have any questions or concerns, please let us know at support@aiby.com. We will be happy to assist you.', 'modified': '2023-09-01T14:16:16Z'}",InPulse Heart Rate Monitor
2022-10-20 19:15:24,When I checked my heart rate it showed 99 at first then it became 107???,2,False,??,girluonfire,,InPulse Heart Rate Monitor
2023-04-23 03:55:04,If it’s not a free app why not be honest about pricing before downloading.,1,False,If it’s not a Free App. Charges comming your way.,R.O.123,"{'id': 36350583, 'body': 'Hello! Our app offers a free trial with all premium features included. You can start a free trial or continue using the app for free with basic features. In the free version of the app you can only get 3 heart readings per day. If you have any questions or concerns, please let us know at support@aiby.com. We will be happy to assist you.', 'modified': '2023-05-05T13:14:29Z'}",InPulse Heart Rate Monitor
2022-09-15 19:57:42,Was not impressed at all,1,False,Not very accurate at all,Uh I don't know?¿,,InPulse Heart Rate Monitor
2021-07-29 03:48:35,"States it’s free then when you download, only get a 3 day free trial and need to remember to cancel 😡",1,False,Not free after all,tiliietime,,InPulse Heart Rate Monitor
2019-12-27 10:55:39,I think this app is wow 💎,5,False,Congrates,jinshivan,,InPulse Heart Rate Monitor
2021-07-17 08:46:26,I’m having trouble getting it to take my pulse,1,False,Finger reading,Spankycvh,"{'id': 24490478, 'body': 'Hello! Please contact our customer support at support@aiby.com if you experience difficulties using our app. We will be happy to assist you. Thank you! ', 'modified': '2021-08-13T12:20:29Z'}",InPulse Heart Rate Monitor
2021-03-10 18:51:16,I did not want this and don’t know how I was charged for it.  Help.,1,False,Purchase,patsy6139,"{'id': 21653583, 'body': ""Hi! Our app offers a free trial subscription and provides full subscription information. It does not start any subscription without user's approval - it is impossible to start a subscription without authorization. App Store trial subscriptions will automatically be renewed and converted into a paid subscription until you choose to end them in iTunes Subscriptions (please check Apple Support page for details: https://support.apple.com/en-us/HT202039). This information is also displayed on the app description page, so users can see it before downloading the app. You can also review or cancel subscription using a link provided in the Subscription Confirmation email."", 'modified': '2021-03-15T09:32:50Z'}",InPulse Heart Rate Monitor
2023-08-09 21:22:46,"It might be right who k owns but it picked up a heart rate on a baby doll so
Im a bit skeptical if this is real or just a random reader.",1,False,?,Beaver Dash,"{'id': 38664928, 'body': 'Hello! Thank you for taking the time to leave us a review. Kindly note that our app is based on contact photoplethysmography. You may find this information in the FAQ section of the application. The algorithm detects variations of light absorption caused by arterial blood-volume pulsations. However, this method may result in inaccurate readings if you try to measure the light on non-living objects. Just drop us an email at support@aiby.com if you require any assistance. We will be happy to help you.', 'modified': '2023-09-01T13:29:36Z'}",InPulse Heart Rate Monitor
2022-08-31 13:57:52,To much money and I don’t know what the app is about,1,False,Price is to high,Regishtfp,,InPulse Heart Rate Monitor
2022-01-20 00:34:18,It pretends to be a “free” app.  But it’s not.  They try to get you after you install it.  It’s a rip off,1,False,Scam,fordy401962,,InPulse Heart Rate Monitor
2021-10-20 01:53:31,Trying to get me to pay before free trial is even over. The UX on this matter is disgusting and misleading.,1,False,Scam,BarSt Angele,"{'id': 26039053, 'body': 'Hi! Thanks for taking the time to share this feedback. Our app offers a free trial with all premium features included and provides full subscription information. App Store trial subscriptions will automatically be renewed and converted into a paid subscription until you choose to end them in iTunes Subscriptions (please check Apple Support page for details: https://support.apple.com/en-us/HT202039). You can start a free trial or continue using the app for free with basic features.  Feel free to contact us at support@aiby.com, if you experience any difficulties. \r\n\r\n\r\n', 'modified': '2021-11-02T15:08:02Z'}",InPulse Heart Rate Monitor
2021-03-06 06:51:53,Just wanted to check my heart rate and it couldn’t do the one thing it’s meant to do.,1,False,Useless,Marlee0717869,"{'id': 21653404, 'body': 'Hi! Thank you for your feedback! We are sorry to hear that. Please feel free to contact our support staff at support@aiby.mobi, we will be happy to investigate this issue.\r\n', 'modified': '2021-03-15T09:28:56Z'}",InPulse Heart Rate Monitor
2021-02-08 08:34:15,Don’t try it you have to pay for it,1,False,You have to pay,andy2019!!!!,"{'id': 20971496, 'body': 'Hi! Please be advised that our app offers a free trial with all premium features included. You can start a free trial or continue using the app for free with basic features. In the free version of the app you can only get 3 heart readings per day. The premium version has no limitations.', 'modified': '2021-02-10T08:33:33Z'}",InPulse Heart Rate Monitor
2023-03-17 15:42:14,Don’t waste your $ if you are trying to measure BP. This app only measures heart rate. The advertisement is misleading.,1,False,Does not measure blood pressure,leltul,,InPulse Heart Rate Monitor
2023-02-16 15:25:55,App works great.  Asking me 10 times a day whether I like the app has taught me to hate the app.,1,False,Ok,DustyBottoms320,,InPulse Heart Rate Monitor
2022-06-23 15:05:09,Deleted,1,False,Rip off too much money for a app,Madbomer.,"{'id': 30988227, 'body': ""Hi! Thank you for your review. Our app offers a 3-day free trial, so it's possible to take it for a run before purchasing a subscription. You can start a free trial or continue using the app for free with basic features. In the free version of the app you can only get 3 heart readings per day. The premium version has no limitations. Don't hesitate to reach out to us at support@aiby.com, if you have any questions."", 'modified': '2022-07-20T07:35:22Z'}",InPulse Heart Rate Monitor
2022-03-14 10:58:41,Doesn’t take me to the. Next step.,1,False,Doesn’t work,Bailey5774,,InPulse Heart Rate Monitor
2022-09-08 20:08:33,A payment for real,1,False,A payment for real,Tea0488,,InPulse Heart Rate Monitor
2022-07-14 05:48:03,The app was supposedly free but there’s always a catch if your feeling my drift sincerely-kadofrmgblock,1,False,False advertising,kadofrmgblock,"{'id': 31763313, 'body': ""Hi! Thank you for your review. Our app offers a free trial with all premium features included. You can start a free trial or continue using the app for free with basic features. In the free version of the app you can only get 3 heart readings per day. The premium version has no limitations. Don't hesitate to reach out to us at support@aiby.com, if you have any questions."", 'modified': '2022-08-31T10:03:28Z'}",InPulse Heart Rate Monitor
2021-05-31 21:27:52,Can’t get it to eorky,1,False,Just doesn’t work on a multi lens iPhone,Axminn1,"{'id': 23264228, 'body': 'Thank you for your feedback! We are sorry to hear that. Please feel free to contact our support staff at support@aiby.mobi, we will be happy to investigate this issue.\r\n', 'modified': '2021-06-08T12:24:01Z'}",InPulse Heart Rate Monitor
2022-09-16 03:22:53,Okay thank,5,False,Camacho1627,gris1627,,InPulse Heart Rate Monitor
2023-05-13 03:54:31,nothing bad about this app its cool,3,False,Pretty cool,yulywuly,"{'id': 36960962, 'body': ""We're very happy that you like our app. Be sure to give us more stars!"", 'modified': '2023-06-06T15:19:14Z'}",InPulse Heart Rate Monitor
2022-09-20 06:29:33,Scam. Stay away. Sign up for 50 dollars but then says need 70 dollars more for blood pressure and oxygen level. Total scam.,1,False,Scam,Eric Glandian,,InPulse Heart Rate Monitor
2022-09-13 01:26:09,Please cancel. I could not get it to work.,1,False,Stop,dinana is my nickname,,InPulse Heart Rate Monitor
2023-08-05 00:02:17,Great App too it’s not free,5,False,Good,Heidilange2018,,InPulse Heart Rate Monitor
2022-08-20 17:06:56,"This app c tricky I did not click to purchase but charged me as I was trying to delete it 
Scam",1,False,Scam,mrstanthony,,InPulse Heart Rate Monitor
2020-08-30 02:19:26,Not sure it fits my purpose.,2,False,Data I want?,tjsheen1,,InPulse Heart Rate Monitor
2023-03-13 00:19:41,I love this app,5,False,I,yingyang0305,,InPulse Heart Rate Monitor
2023-07-21 16:38:43,Tries to deceive you into a recurring subscription. . . No free will not work without payment,1,False,Scam,NetchicksNchill,"{'id': 37940404, 'body': 'Hello! Thanks for the review! Our app offers a free trial with all premium features included. You can start a free trial or continue using the app for free with basic features. In the free version of the app you can only get 3 heart readings per day. If you have any questions or concerns, please let us know at support@aiby.com. We will be happy to assist you.', 'modified': '2023-07-27T14:59:43Z'}",InPulse Heart Rate Monitor
2020-05-17 14:02:33,Great app. Just what I needed.,5,False,Nice,tphillipstdp,,InPulse Heart Rate Monitor
2021-08-04 23:44:09,May take up to 5 min to get it to read my bpm.,1,False,Will not read my bpm,Spudved,"{'id': 24600374, 'body': 'Hello! We are sorry about this situation and want to help. Could you please contact our customer support at support@aiby.com ? We will try our best to resolve this issue as soon as possible. Thank you!', 'modified': '2021-08-19T12:23:17Z'}",InPulse Heart Rate Monitor
2021-05-29 16:18:36,This app is expensive and not worth it.  If you’re worried about your heart invest elsewhere!,1,False,This is a scam beware,Marffuh,"{'id': 23264161, 'body': 'Hi! Our app offers a free trial with all premium features included. You can start a free trial or continue using the app for free with basic features. In the free version of the app you can only get 3 heart readings per day. The premium version has no limitations.', 'modified': '2021-06-08T12:21:06Z'}",InPulse Heart Rate Monitor
2021-02-06 06:28:04,Why do we have to place our finger on phone,1,False,So,tripey rec,"{'id': 20971465, 'body': 'Hi! Please contact our customer support at support@aiby.mobi if you experience difficulties using our app. We will be happy to assist you. Thank you! \r\n', 'modified': '2021-02-10T08:31:45Z'}",InPulse Heart Rate Monitor
2021-01-15 02:01:28,Doesn’t work and some how it charged me!  Unbelievable!,1,False,Rip off,PSURULES,"{'id': 20495133, 'body': ""Hi! Our app offers a free trial subscription and provides full subscription information. It does not start any subscription without user's approval - it is impossible to start a subscription without authorization. App Store trial subscriptions will automatically be renewed and converted into a paid subscription until you choose to end them in iTunes Subscriptions (please check Apple Support page for details: https://support.apple.com/en-us/HT202039). This information is also displayed on the app description page, so users can see it before downloading the app. You can also review or cancel subscription using a link provided in the Subscription Confirmation email. Please feel free to contact our support staff at support@aiby.mobi, we will be happy to investigate this issue.\r\n"", 'modified': '2021-01-19T07:41:05Z'}",InPulse Heart Rate Monitor
2020-10-14 22:03:13,Does not work. Keeps stalling at 10 more seconds.,1,False,Doesn’t work,Mdcamalama,"{'id': 18619652, 'body': 'Hello! Please contact our customer support at support@freeplay.mobi so we can investigate this issue. Thank you!', 'modified': '2020-10-21T13:41:57Z'}",InPulse Heart Rate Monitor
2021-03-03 01:09:33,Recommended,5,False,Great,jerrysuro,,InPulse Heart Rate Monitor
2020-03-25 06:24:47,App worked fine yesterday and now it is glitchy and will not take my heart rate. Boo.,1,False,Defective,stressed college student,,InPulse Heart Rate Monitor
2021-12-18 03:41:47,This not a free app. They want you to pay for it right away. What a bummer.,1,False,My review,Jenny.G98,,InPulse Heart Rate Monitor
2021-04-09 01:20:40,Stop,5,False,Stop,dollardeanmeyer,,InPulse Heart Rate Monitor
2020-09-20 21:12:52,The app glitched out in the beginning and it made me pay,1,False,Payment,tino_tacos,,InPulse Heart Rate Monitor
2020-06-05 18:28:15,It kept restarting to do measurements I never moved not liking this app at all deleting it.,1,False,This deserves a 0,megz austin,,InPulse Heart Rate Monitor
2022-03-03 07:19:09,Why can’t it be free ???actually help someone out,1,False,Why can’t it be free,ladykhaos86,,InPulse Heart Rate Monitor
2021-01-30 20:29:59,Not accurate,1,False,Not accurate,TonyCarl,"{'id': 20808647, 'body': 'Hello! Please contact our customer support at support@aiby.mobi if you experience difficulties using our app. We will be happy to assist you. Thank you! \r\n', 'modified': '2021-02-02T12:51:00Z'}",InPulse Heart Rate Monitor
2021-02-24 19:20:22,Just because it’s not free 4,4,False,Lol good app,gmoney1157,"{'id': 21395205, 'body': 'Hi! Our app offers a free trial with all premium features included. You can start a free trial or continue using the app for free with basic features. In the free version of the app you can only get 3 heart readings per day. The premium version has no limitations.', 'modified': '2021-03-02T11:12:22Z'}",InPulse Heart Rate Monitor
2021-01-24 23:23:20,I love this BPM machine. It is so convient and it’s free. Thank You❣️,5,False,BPM machine,image13,,InPulse Heart Rate Monitor
2020-10-20 00:27:39,It isn’t free not free versions. Only 3 days free. If they are going to charge they should advertise as a paid subscription.,1,False,Miss Leading,Cancel009875433007,"{'id': 18657197, 'body': 'Hello! Our app offers a free trial with all premium features included. You can start a free trial or continue using the app for free with basic features. In the free version of the app you can only get 1 heart reading per day. The premium version has no limitations.', 'modified': '2020-10-23T07:07:57Z'}",InPulse Heart Rate Monitor
2020-08-08 11:52:19,I checked my pulse simultaneously with the app and it’s about 20 bpm off.,1,False,Doesn’t work,JDGRN2022,,InPulse Heart Rate Monitor
2023-02-22 04:40:18,My resting heart beat is always between 110 and 120 I felt heart palpitations and used it and it gave me a 62…,1,False,Gotta be fake,M3wniX,,InPulse Heart Rate Monitor
2020-10-14 12:25:24,very helpful,5,False,Pulse app,PerelB,,InPulse Heart Rate Monitor
2020-11-04 23:34:41,This app is supposed to check your heart rate but all ot does is goves you an automated answer.,1,False,DOES NOT WORK,Dhruv Kaligotla,"{'id': 19140738, 'body': 'Hi! Please contact our customer support at support@freeplay.mobi if you experience difficulties using our app. We will be happy to assist you. Thank you! \r\n', 'modified': '2020-11-16T14:39:46Z'}",InPulse Heart Rate Monitor
2020-10-11 18:12:20,It does not work and you have to $50,1,False,Horrible,zoyiana,"{'id': 18500879, 'body': 'Hi! Our app offers a free trial with all premium features included. You can start a free trial or continue using the app for free with basic features. In the free version of the app you can only get 1 heart reading per day. The premium version has no limitations. Also, please feel free to contact our support staff at support@fitmeup.me if you still experience difficulties using our app.', 'modified': '2020-10-15T12:32:33Z'}",InPulse Heart Rate Monitor
2020-05-20 04:31:45,Very hard to use and very specific.,1,False,Questionable,NightFiru,,InPulse Heart Rate Monitor
2020-04-27 14:27:29,As far as I can tell there is no way to get oximeter data,1,False,False advertising - no oximeter,Piotrek111583,,InPulse Heart Rate Monitor
2020-09-24 13:14:56,You can tell this is fake when it uses a flashlight to measure your pulse lol,1,False,The worst,c bfxhxhhsbsisb,,InPulse Heart Rate Monitor
2020-01-15 15:35:09,Not consistent. Holding my finger where it says to and I have to redo and redo. Aggravating.,2,False,BP app not the best,wtvic,,InPulse Heart Rate Monitor
2023-06-30 02:55:07,Not worth $6.99 per week…,1,False,Expensive!!,Ladywegs,"{'id': 37531836, 'body': 'Hello! Thank you for your review. We would be grateful if you could give us more detailed feedback on our app, as your opinion matters to us. If you have any suggestions, please send them to support@aiby.com', 'modified': '2023-07-07T08:41:58Z'}",InPulse Heart Rate Monitor
2023-01-08 16:43:53,See the star ratings less please.,1,False,Stars,mr. larrivee,,InPulse Heart Rate Monitor
2022-12-23 15:33:08,Would be really concerned if I have a resting heart rate of 157 BPM tbh,2,False,Feels inaccurate,Fresky_Cookie,,InPulse Heart Rate Monitor
2022-07-01 23:06:23,I signed up for the free trial (3 days). The app claims all features are enabled — not true,1,False,review,zhawtr,"{'id': 31763941, 'body': ""Hi there! We are sorry that we didn't meet your expectations. Your feedback is important to us. Please kindly contact our support team at support@aiby.com so we can make things right. \ufeffLooking forward to hearing from you."", 'modified': '2022-08-31T10:35:04Z'}",InPulse Heart Rate Monitor
2022-03-08 20:32:44,This was a mistaken purchase. Please cancel and refund my money.,1,False,Mistaken purchase,Senojeed,,InPulse Heart Rate Monitor
2021-02-17 00:44:02,Not working at all,1,False,Doesn’t work,mpt7044,"{'id': 21133013, 'body': 'Hello! Thank you for your feedback! We are sorry to hear that. Please feel free to contact our support staff at support@aiby.mobi, we will be happy to investigate this issue.', 'modified': '2021-02-18T08:16:36Z'}",InPulse Heart Rate Monitor
2020-09-06 20:08:13,i wish there was a negative star so i can show how bad this app really is it wants you to pay 50 dollars just to measure your heart beat and it doesn’t even work i am so upset this app is so bad,1,False,awful,Great app but one thing,,InPulse Heart Rate Monitor
2022-07-22 04:16:06,Should be free at least once a day like come on,1,False,Hello,metsw,"{'id': 31762220, 'body': ""Hi! Thank you for your review. Our app offers a free trial with all premium features included. You can start a free trial or continue using the app for free with basic features. In the free version of the app you can only get 3 heart readings per day. The premium version has no limitations. Don't hesitate to reach out to us at support@aiby.com, if you have any questions."", 'modified': '2022-08-31T09:22:10Z'}",InPulse Heart Rate Monitor
2021-03-09 22:08:49,Not liking at all no reading,1,False,Does not give me a rating,llleight,"{'id': 21653554, 'body': 'Thank you for your feedback! We are sorry to hear that. Please feel free to contact our support staff at support@aiby.mobi, we will be happy to investigate this issue.\r\n\r\n', 'modified': '2021-03-15T09:32:13Z'}",InPulse Heart Rate Monitor
2020-12-15 15:31:53,So far good,5,False,Pulse,Boo061410,,InPulse Heart Rate Monitor
2023-08-16 14:52:35,Please cancel this app immediately. It does not do what I expected.,1,False,CANCEL!!,give me a nickname...,"{'id': 38665738, 'body': 'Hello! We apologize for any confusion you may have experienced while trying to cancel your subscription. To cancel, simply go to the ""Subscriptions"" section of your device settings and select our app from the list. From there, you can easily cancel your subscription. Please check Apple Support page for details: https://support.apple.com/en-us/HT202039. If you have any trouble, please don\'t hesitate to reach out to our support team at support@aiby.com and we\'ll be happy to assist you further.', 'modified': '2023-09-01T14:16:22Z'}",InPulse Heart Rate Monitor
2022-08-05 17:57:41,You have to pay upgrades to get pulse ox readings,1,False,Mislead,IshimuraByrd,,InPulse Heart Rate Monitor
2022-07-08 05:30:56,It’s not working I want to check my heart rate.,1,False,Its wrong,jledtheway,"{'id': 31763656, 'body': 'Hi there! Based on your review, unfortunately, we cannot gauge exactly what went wrong. Please write to us in detail about the issue at support@aiby.com so that we can look into it immediately and do our best to get it resolved.', 'modified': '2022-08-31T10:19:05Z'}",InPulse Heart Rate Monitor
2022-01-08 06:09:01,Please don’t waste money,1,False,Waste of money,Azhar19921019,,InPulse Heart Rate Monitor
2021-11-19 00:25:47,Why would I pay for this?,1,False,Not free,ogjay555,,InPulse Heart Rate Monitor
2021-04-28 19:58:08,So good and I use that,5,False,Mr,mb.sh,,InPulse Heart Rate Monitor
2023-05-06 17:26:22,Facebook add led me to believe it could measure blood pressure it cannot. What a rip off.,1,False,Pulse,SpringMark,"{'id': 36961143, 'body': 'Hello! Thank you for taking the time to leave us a review. We kindly ask you to contact us at support@aiby.com so that we can look into the matter and resolve this situation. Our support team will be able to assist you better.', 'modified': '2023-06-06T15:26:36Z'}",InPulse Heart Rate Monitor
2023-04-05 06:32:38,How can i get my money back?? I was asked for the 3 day free trial and they charged me $15 dollars. :((,1,False,I WAS CHARGED $15 FOR NO REASON,Tre.Flxp.ex,"{'id': 36352178, 'body': ""Hello! Thank you for your review. Our app clearly displays all subscription-related information when offering subscriptions, including free trial duration and the price/length of auto-renewable subscription that follows free trial. Our customers are advised about subscription conditions beforehand with full transparency. Our app does not start any subscription without user's approval - it is impossible to start a subscription without the user's confirmation. Please contact our customer support at support@aiby.com so that we could provide you with the accurate information on how to request a refund for your in-app purchase."", 'modified': '2023-05-05T14:35:48Z'}",InPulse Heart Rate Monitor
2021-01-10 19:46:13,Doesn’t work,1,False,Buggy,Maxxxx9991,"{'id': 20365833, 'body': 'Hello! Thank you for your feedback! We are sorry to hear that. Please feel free to contact our support staff at support@aiby.mobi, we will be happy to investigate this issue.\r\n\r\n', 'modified': '2021-01-13T06:41:35Z'}",InPulse Heart Rate Monitor
2020-10-12 18:00:22,I can’t even get my heart rate this thing is stupid and a waste,1,False,Waste,ayanna2finee,"{'id': 18619129, 'body': 'Hello! We are sorry about this situation and want to help. Could you please contact our customer support at support@freeplay.mobi ? We will try our best to resolve this issue as soon as possible. Thank you!', 'modified': '2020-10-21T13:13:16Z'}",InPulse Heart Rate Monitor
2020-04-11 21:15:40,Doesn’t work. Can’t read my finger heart rate but I am alive!!,1,False,Doesn’t work,meljelli,,InPulse Heart Rate Monitor
2022-08-31 21:32:07,Waist of time,1,False,It doesn’t work,hot 50oo7ball,,InPulse Heart Rate Monitor
2022-03-10 09:24:51,This app is so fake I did mine then my husbands his was the same as mine 🤔,1,False,Fake,mocha211,,InPulse Heart Rate Monitor
2022-02-04 23:58:28,I thought I could take my blood pressure with this app?!,1,False,BP,Lin 050755,"{'id': 28237068, 'body': ""Hi there! Thanks for taking the time to share this feedback, your review is very important to us. Kindly note that it's possible to use calendar to monitor your blood pressure. Don't hesitate to reach out to us at support@aiby.com, if you have any questions."", 'modified': '2022-02-24T13:21:29Z'}",InPulse Heart Rate Monitor
2022-01-14 20:10:43,I have to pay for common Heath knowledge that’s free anywhere eles I’m not ok with this,1,False,Trash,AJFMX,,InPulse Heart Rate Monitor
