date,developerResponse,review,rating,isEdited,title,userName,App_Name
2022-12-10 15:48:19,"{'id': 33690257, 'body': 'So SORRY for the unpleasant experience. Since JustFit has just launched, we were too busy to reply emails in time.  Could you please put your email name here? We\'ll get back to you as soon as possible\n\nHere are the steps to cancel your subscription on your iPhone: \r\n\r\n1. Open the ‘Settings’ of your iPhone (not the Settings of the app). \r\n\r\n2. Tap your name, then tap Subscriptions.* \r\n\r\n3. Tap the subscription that you want to manage. \r\n\r\n4. Choose a different subscription option, or tap Cancel Subscription. If you don’t see Cancel Subscription, it means that the subscription is already canceled and won’t renew. \r\n\r\n*If you don’t see “Subscriptions” in the Settings app, tap “iTunes & App Store” instead. Tap your Apple ID (which is usually your email address), then tap View Apple ID. Sign in, scroll down to Subscriptions, then tap Subscriptions. \r\n\r\n  \r\n\r\nIf you have cancelled your subscription and it was successful, you will receive an official email notice from Apple.  \r\n\r\nYou can also go to Settings, click on your account and open manage subscriptions, then you will see all your subscriptions, and if there is no JustFit, it means you have cancelled successfully. \n\nIf you have already paid and want a refund, you can contact Apple Pay for a refund. \r\n\r\n  \r\n\r\nHere are the steps: \r\n\r\n1. Sign in to reportaproblem.apple.com. \r\n\r\n2. Tap or click ""I\'d like to,"" then choose ""Request a refund.”  \r\n\r\n3. Choose the reason why you want a refund, then choose Next. \r\n\r\n4. Choose the JustFit, then choose Submit. If you were charged for a subscription that you no longer want, you can cancel the subscription. ', 'modified': '2022-12-13T04:39:31Z'}","This is the 2nd time I tried to contact via email about canceling my subscription and getting a refund. The first email was send in December 2nd, and my second was sent on December 8th. No response. I used the email for the JustFit app and also the company email. Just awful. I will be contacting the BBB.",1,False,No customer service,lanijwah,JustFit Lazy Workout Fit
2023-10-21 21:38:11,"{'id': 39719126, 'body': 'Hi, we appreciate your wonderful and kind feedback and are so pleasant to hear that you love this app. Your compliment made all our efforts worthy. Keep an eye out for more features and content. Have an awesome day!', 'modified': '2023-10-25T02:32:30Z'}",I love this app because it really helps to get me moving and motivated on having a more healthy lifestyle!,5,False,JustFit,Averi drama queen,JustFit Lazy Workout Fit
2022-06-15 16:23:00,,I am old and fat and needed a beginner program . Since when are Russian twists beginner ? Since when are slow mountain climbs beginner? Since when are 45 second straight arm planks beginner? I can’t get my money back. I feel so had . Don’t bother if you’re old and out of shape.,1,False,I pure rip off for an old fat woman,Claylane13,JustFit Lazy Workout Fit
2023-07-16 01:00:24,,I love it it gives you a good sweat I do it every night and sometimes in the middle of the day,5,False,Bend,Maggie ffr,JustFit Lazy Workout Fit
2023-08-25 20:31:45,"{'id': 38554131, 'body': 'Hi, sorry for the unpleasant experience. The refund can only be handled through Apple Pay. You can sign in to report problem.apple.com to finish. If you have any problems, please feel free to tell us through the feedback section in the app, we will help you out! Looking forward and wish you keep fit.', 'modified': '2023-08-28T01:11:20Z'}",I ordered free trial and it charged me right away! I right away canceled it it’s been a week or more and I still don’t see the money in the account but it says refunded every time I look at it !! Please give me my money back !! I do not recommend this app they are not trustworthy!,1,False,Just fit,Raquellarella,JustFit Lazy Workout Fit
2023-08-21 10:57:38,"{'id': 38466169, 'body': 'Hi! Thank you very much for your feedback. We have various workouts in “Workouts” where you can find the exercises you like. We take care of our user experience seriously. I have given your feedback to our development team. Our team is already working intensively to optimize the algorithm. Thank you for your understanding.', 'modified': '2023-08-23T01:15:33Z'}","I tried this app. Told it I had an injury and to avoid the areas injured. Instead the app continued to give me workouts for the injured area. I am now in so much pain I had to go back to the Dr. I tried canceling my subscription before the cut off date, but was still charged. Watch out ladies.",1,False,Not good,M. Scob,JustFit Lazy Workout Fit
2023-08-17 15:04:54,"{'id': 38413174, 'body': 'Hi! Thank you very much for your feedback. We have various workouts in “Workouts” where you can find the exercises you like. We take care of our user experience seriously. I have given your feedback to our development team. Our team is already working intensively to optimize the algorithm. Thank you for your understanding.', 'modified': '2023-08-21T01:38:07Z'}","I signed up because the workouts appeared to be customizable to my level, but it’s just another unrealistic boot camp full of burpees and other high impact exercises that I can no longer do. The ads show chair workouts, so this is a total bait and switch scam money grab. Don’t sign up.",1,False,Not as advertised,kelly89!,JustFit Lazy Workout Fit
2023-01-15 16:22:57,,I’m overweight out of shape. Thank you for making something easy to follow. This is amazing.,5,False,Thank you,omgaep,JustFit Lazy Workout Fit
2023-07-15 11:43:37,"{'id': 37705183, 'body': 'Hi sjd91783, sorry for the unpleasant experience. To cancel your subscription, you need to do it before the next debit. Open the ‘Settings’ of your iPhone (not the Settings of the app) and find the subscription you want to cancel. If you have any problems, please tell us through through the ""feedback"" in the app. Looking forward and wish you keep fit.', 'modified': '2023-07-17T01:34:50Z'}","I thought I was getting the chair yoga for seniors. I find these exercises too painful for me. I ended up signing up for a year thinking I will get other exercises and now I don’t know how to cancel. 
I did not see a free trial like others have mentioned. Please let me know how to cancel this",1,False,Not what I thought,sjd91783,JustFit Lazy Workout Fit
2023-07-11 15:49:45,,"Can’t find where to message for support- 
Great app, but can’t use it after 7 day trial then purchasing for the year at $70. Paywall comes up asking if I want to purchase for $40 less than I just paid for it. Very frustrating. Is there a fix?",1,False,Paywall after purchasing,jackaloco,JustFit Lazy Workout Fit
2023-07-10 02:27:15,,This price is to much I don’t wanna pay that much and this free trial isn’t as long as my lose weight date,4,False,Price,nennaaaaa(),JustFit Lazy Workout Fit
2023-06-16 02:40:16,,"Still trying to charge my card for 30 dollars when all I did was download it, didn’t like it and stop my subscription during the 1st day of the trial. It’s been almost 2 months and they’re still trying to charge my card even after I unsubscribed",1,False,SCAMMMMMMMM,Kelso12322,JustFit Lazy Workout Fit
2023-06-05 16:03:02,"{'id': 36968942, 'body': 'Hi Beachbabe146! We’re sorry you feel this way. JustFit is free to download. And users can use some of the features and content. However, you do need a subscription to unlock all the features. Thanks for your understanding. ', 'modified': '2023-06-07T01:22:13Z'}","I loved the 3 days I used this app, but on day 4 you are forced to sign up for a subscription. I don’t have the money to pay for this and am super disappointed that unless I pay, I can’t do my workout.",2,False,Day 4- subscription needed,Beachbabe146,JustFit Lazy Workout Fit
2023-03-07 18:40:00,"{'id': 35284122, 'body': 'Hi, sorry for your experience. You can find a variety of exercises to do in bed from the exercise section, and we are always updating more exercises for bed to offer to the corresponding people, so please stay tuned. We wish you to stay healthy!', 'modified': '2023-03-09T05:37:34Z'}","It said it was going to give me a seven day free trial first but then took my money as soon as I put my information in. It literally says you get a free trial first, I’m very frustrated and I’ve been trying to contact them for my money back and no one is helping me so do not trust this app the workouts aren’t even in bed",1,False,STOLE MY MONEY,janagorl,JustFit Lazy Workout Fit
2023-01-24 01:19:14,"{'id': 34530917, 'body': ""Dear user, so sorry. We offer a 7-day free trial to our annual subscription. You can manage and cancel your subscription on Settings of your iPhone or get a refund through Apple Support. If you have any questions, please email us at contact.justfit@enerjoy.life. We're glad to help you. We really appreciate you updating your updated review once you have been helped. Thanks for your understanding. It means a lot to us."", 'modified': '2023-01-28T09:43:27Z'}","They say it’s free but the only thing free is the 7 day trial period, after that you’re charged either per month or you can pay in a lump sum annual payment.  It looks like a great app but they should say it’s free if only the trial period is free when you give them a credit or debit card first",1,False,Click bait,ChrisW213,JustFit Lazy Workout Fit
2022-11-28 17:11:04,,"I have primary multiple sclerosis, so this is very difficult for me.. but I try to focus on my boxed breathing!",5,False,Stretching,nuliegh,JustFit Lazy Workout Fit
2022-03-15 13:44:02,,Getting back in to exercising and this is a great no cost option!  No subscription required!,5,False,Great free workouts,Stmatt209,JustFit Lazy Workout Fit
2022-11-04 04:31:57,,"Being charged a subscription fee upfront, before even trying out the app, turned me off instantly. I didn’t even bother to spend much time in the app because of this. I immediately cancelled my subscription and requested a refund through Apple support. Not a good first impression!!",1,False,“Free” trial?  I think not,EM602,JustFit Lazy Workout Fit
2022-09-25 23:50:04,,"Not what expected after viewing ad. Why ask my age, current fitness level, etc if “ my plan” is way more difficult for a beginner. 
Where’s the exercises shown in the ad? Those I’ve done at PT & I know they’re doable for me. 
And I can’t figure out how to cancel. Frustrating!",1,False,Not what I expected,Pamela Hill,JustFit Lazy Workout Fit
2022-06-18 16:29:26,,as soon as you open the app it blasts you with unrealistic pictures of supermodel type bodies? and it told me im obese when my doctor told me i was only a little overweight! im definitely NOT obese. It also tells me i can loose 20 lbs in a month which is extremely unrealistic and unhealthy. very disappointed,1,False,unrealistic and fat shaming,heathbar109,JustFit Lazy Workout Fit
2022-03-01 22:44:57,,It was just what I was looking for. A workout with no equipment required so far.,5,False,Just what I was looking for,**CEVA**,JustFit Lazy Workout Fit
2022-01-06 16:34:14,,"I promise you, you will definitely burning some calories! I’m sweating like I’ve been to an actual gym!",5,False,great!,P mula,JustFit Lazy Workout Fit
2022-02-27 21:22:02,"{'id': 28326100, 'body': ""\r\nHi! Thank you very much for your feedback! We are improving our background music service to help users be more energetic in their training. If you don't like the Default Music and want to change it, you can click on the Music icon on the playback page and choose to turn off the music or use Apple Music to play the music you like.\r In the next two days, we will provide more music choices. Then you can enjoy more various and energetic music. We hope you will like them! "", 'modified': '2022-03-02T06:16:54Z'}","Liked the workouts, but the same music is extremely annoying. Please, change the music in this app)))",3,False,Almost great,A13M1,JustFit Lazy Workout Fit
2023-10-29 18:41:37,,"This app is great it’s not to hard, but I do think that you should make it free!",5,False,Thanks,Ann Zann 12,JustFit Lazy Workout Fit
2023-10-28 17:45:26,,Hello I wish this was free for all ages under 18 if you could make that happen that would be great.,5,False,Hello,GamerGirl$$$$$$,JustFit Lazy Workout Fit
2023-10-23 02:42:49,"{'id': 39719191, 'body': 'Hi, thank you so much! It means the world to us ❤️ We will update our content and improve our app! Stay tuned! Looking forward and wish you keep fit.', 'modified': '2023-10-25T02:37:12Z'}",It a little hard but it works all 👍,5,False,This will help,Alal_8080,JustFit Lazy Workout Fit
2023-08-14 17:49:47,"{'id': 38312879, 'body': 'We are thankful for your kind words. We are thrilled that you are enjoying the game. Your encouragement makes all of our efforts worthwhile. Be sure to keep an eye out for upcoming updates. Wishing you all the best!', 'modified': '2023-08-16T01:23:45Z'}",I just lost 5 pounds and that’s so good thank you guys so much I’m gonna keep doing it and doing it,5,False,To the skinny people,Dianilen Yanes Beautiful,JustFit Lazy Workout Fit
2023-09-24 22:01:00,"{'id': 39162781, 'body': 'Hi! We’re sorry you feel this way. JustFit is free to download. And users can use some of the features and content. However, you do need a subscription to unlock all the features. Thanks for your understanding. ', 'modified': '2023-09-27T01:23:07Z'}",Ok I think it's fin but u have to pay and it's kinda dumb I would not get it if I new I had to pay,4,False,Why it's four stars not five,Saylish M.,JustFit Lazy Workout Fit
2023-09-18 15:13:23,"{'id': 39041834, 'body': ""Hey, thanks for your feedback! We're really sorry. Could you please email us the details through a screenshot or something? We'd like to look into it. Contact us through contact.justfit@enerjoy.life. Thank you SO MUCH!"", 'modified': '2023-09-21T02:13:35Z'}",I downloaded the app and then got rid of it because it charged me for the year plan and now my iPhone is locked down to where I can’t download or update anything until I pay for the plan which I did not authorize. Do not download this app!!!!!,1,False,Horrible app do not download,momofk&j22,JustFit Lazy Workout Fit
2023-06-08 17:01:21,,"Loved the music, instructions on proper posture, & visuals.  Everything is great.  It motivates me to do every day.  Thank you, I’ve found eureka.",5,False,Rite FIT,loca forever,JustFit Lazy Workout Fit
2023-06-12 23:16:25,"{'id': 37058744, 'body': 'Hi 1954mike, sorry for the unpleasant experience. You can change the physical limitations (including knees) and fitness level in the Plan Setting tab. Hope it helps! Looking forward and wish you keep fit.', 'modified': '2023-06-12T06:01:36Z'}","Almost all exercises were much to difficult even after I indicated what my limitations are. I did not expect such difficult and quick paced exercises. Very disappointed and a huge waste of money.

Not user friendly if u want to make changes.",1,True,Not tailored for me,1954mike,JustFit Lazy Workout Fit
2023-04-25 02:52:09,,"As a 75 year old retired PE teacher, I need to get back in shape.  I looked for a program that I felt is age appropriate. So far so good.",5,False,Good program,"dog lover, !!",JustFit Lazy Workout Fit
2023-05-02 00:12:33,"{'id': 36358737, 'body': 'Hi!  JustFit is free to download. And users can use some of the features and content. However, you do need a subscription to unlock all the features. Thanks for your understanding. ', 'modified': '2023-05-06T02:31:28Z'}",SERIOUSLY?? I did my three day workout and came for the fourth day and everything was paused I was starting to love this app!! Shouldn’t it be free so that people who need to lose weight can actually use something that’s not worth paying making them feel good!,1,False,3 day workout,Khloesmith,JustFit Lazy Workout Fit
2023-03-23 04:16:11,,I’m really enjoying the app so far but I was wondering if it’s possible to sinc the app on my iPhone with my iPad 🤷🏽‍♀️,5,False,Loving it so far!,Getting Stronger 💪🏽,JustFit Lazy Workout Fit
2023-04-07 13:50:09,,"I know it’s not normal, but working out in bed has really helped to kickstart my journey and get me moving. Thanks to the creators of this app. It is truly a blessing.",4,False,Kick started my journey,SinderViii,JustFit Lazy Workout Fit
2023-03-26 01:40:40,"{'id': 35625022, 'body': ""Dear user, so sorry. We offer a 7-day free trial to our annual subscription. You can manage and cancel your subscription on Settings of your iPhone or get a refund through Apple Support. If you have any questions, please email us at contact.justfit@enerjoy.life. We're glad to help you. We really appreciate you updating your updated review once you have been helped. Thanks for your understanding. It means a lot to us."", 'modified': '2023-03-28T04:14:51Z'}","Wanted an app for the elderly that was not too hard.  Fount this and thought it was great until I dug a little deeper.  Ad say free,  what a load of crap!!!!!  What a scam!!  Developers should be ashamed for their bait and switch tactics.  I will put this out on Facebook so everyone can see what scam artists you guys are!",1,False,Sooo disappointed!,Jake cal,JustFit Lazy Workout Fit
2023-03-21 23:35:28,,I just started a few minutes ago  so I haven’t seen the difference yet lol but I still love it,5,False,Love love LOVE,NADIAKAESI,JustFit Lazy Workout Fit
2022-02-23 00:39:33,,Day One and I already feel it starting to work,5,False,M,gdudgeewuid,JustFit Lazy Workout Fit
2023-03-10 07:46:33,"{'id': 35345831, 'body': 'Hi! We’re sorry you feel this way. JustFit is free to download. And users can use some oaf the features and content. However, you do need a subscription to unlock all the features. Thanks for your understanding. ', 'modified': '2023-03-13T06:26:44Z'}","I signed up for the 7 day free trial and my cc was immediately charged.  Usually during a free trial it’s to see if the app works for you and you’re charged after the trial period, not immediately.  Your description needs to be worded differently.",2,False,Misleading,ajusmcwife,JustFit Lazy Workout Fit
2023-02-20 13:05:50,,Little over whelmed for day one. Sooo out of shape can’t do what I used to do even 8 years ago.  Due to age I land shape I had to modify a lot.  But will keep on trucking along. Hoping for more stars later on.,3,False,Day one,Kskansas,JustFit Lazy Workout Fit
2022-10-26 23:55:44,,I like it but the fact that I’m the adds it says nothing about paying. It’s nice and all I got my dream body from it,4,False,My review,HJH 5077,JustFit Lazy Workout Fit
2021-11-18 00:06:18,,I love this but the thing is I r go ink I have to pay for it and I don’t wanna do that but other then that I love it,5,False,How much u love this,janader,JustFit Lazy Workout Fit
2023-09-18 23:56:26,"{'id': 39041885, 'body': 'Hi , we appreciate your wonderful and kind feedback and are so pleasant to hear that you love this app. Your compliment made all our efforts worthy. Keep an eye out for more features and content. Have an awesome day!', 'modified': '2023-09-21T02:15:21Z'}",It’s soo good that it made me a bit more skinny and it is amazing!!🤩you guys should definitely try it NOW!!😁😃🤩,5,False,Like,Kass1259463,JustFit Lazy Workout Fit
2023-11-08 16:14:20,"{'id': 40041440, 'body': 'Hi! We’re sorry you feel this way. We offer a 7-day free trial to users with “annual subscription” and a 3-day free trial for users without a subscription. JustFit is free to download, but you do need a subscription to unlock all the features. Thanks for your understanding. ', 'modified': '2023-11-10T01:25:11Z'}","At first, this app was great. But now, after the 3rd day… i’m on the fourth and it won’t allow me to do the daily workout because of the “special discount”. On the urge of deleting the app.",3,False,trial??,starbucks lover 2011,JustFit Lazy Workout Fit
2023-08-21 01:55:13,"{'id': 38466164, 'body': 'Thank you so much! It means the world to us. We will update our content and improve our app! Stay tuned! Looking forward and wish you keep fit.', 'modified': '2023-08-23T01:14:48Z'}",Is helping me a lot and I feel a lot more confident about myself,5,False,Amazing,bc did bc cvcv sav fccvv,JustFit Lazy Workout Fit
2023-08-22 13:09:05,"{'id': 38488861, 'body': 'Hi ! We’re sorry you feel this way. We offer a 7-day free trial to users with “annual subscription” and a 3-day free trial for users without a subscription. JustFit is free to download, but you do need a subscription to unlock all the features. Thanks for your understanding. ', 'modified': '2023-08-24T01:26:47Z'}",I really like the workouts when I’m able to get through all the ads!  I have missed 2 of the first 5 days because I couldn’t figure out how to get beyond the ads.,2,False,Circular ads,ShandyF,JustFit Lazy Workout Fit
2023-08-14 23:43:46,,This is a great app for people who want to get fit but are lazy! I love this app because it gives me confidence❤️,5,False,Great app for all!,mariaplay99,JustFit Lazy Workout Fit
2023-08-07 12:28:37,,I recommend definitely,5,False,Pretty nice it really helps,omg the best app ever yay,JustFit Lazy Workout Fit
2023-08-13 23:01:32,"{'id': 37791394, 'body': 'Hi Dr KB, sorry for the unpleasant experience. We are glad to help you but we are too busy with emails recently. We will reply to your email ASAP. Thanks for your understanding and feedback! Looking forward and wish you keep fit.', 'modified': '2023-07-20T07:05:41Z'}","I have waited weeks for a response for a request with only a promise from you. I have cancelled my subscription. I was so hoping to get the chair exercise series that you keep advertising through other apps, but after six weeks—nothing!",1,True,Worst Customer Service EVER!,Dr KB,JustFit Lazy Workout Fit
2023-08-13 00:48:04,"{'id': 38292593, 'body': 'Hi! We’re sorry you feel this way. JustFit is free to download. And users can use some of the features and content. However, you do need a subscription to unlock all the features. Thanks for your understanding. ', 'modified': '2023-08-15T01:11:33Z'}",The only thing I don’t like is that when you far they try and make you pay so yea,4,False,Rileey,Rileeythepo,JustFit Lazy Workout Fit
2023-08-03 13:30:40,"{'id': 38126869, 'body': 'Hi TriniNina, we are so touched by hearing such sincere and warm feedback and we so appreciate your love towards this app. You are definitely the balm for our souls. We will keep working hard in the hope of providing you better product. Have an amazing day!', 'modified': '2023-08-07T01:29:55Z'}",I am ready to get my life back in order and be healthy… thank you … xoxo,5,False,Life,TriniNina,JustFit Lazy Workout Fit
2023-06-20 17:27:34,,I can’t see anything when I try to join it was like freezing a lot so please fix this because I wanna work out and help myself and this is not working out.,2,False,Why I gave this a two star,Kay❤️💜💚🖤,JustFit Lazy Workout Fit
2023-06-30 22:23:52,,"Hi, if you are looking for a lazy workout like they show you then this is not the app for you. The very first exercise on day one was burpees. If you know what these are it means getting on all fours on the floor. Insane that they chose this maneuver for a lazy workout. Well, they got my 29 bucks and never replied to my email. Waste of my money.",1,False,Bogus,Torobabe,JustFit Lazy Workout Fit
2023-04-18 16:51:34,"{'id': 36061768, 'body': 'Hi Wacalipi! We’re sorry you feel this way. JustFit is free to download. And users can use some of the features and content. However, you do need a subscription to unlock all the features. Thanks for your understanding. ', 'modified': '2023-04-20T01:26:50Z'}","I thought this was going to be good for me at age 76 but on day 4 all I get is ads to pay, unable to access anything else. I am deleting. They don’t seem to really care about women’s fitness , just our money.",2,False,Day 4-pay day,Wacalipi,JustFit Lazy Workout Fit
2023-04-19 21:54:12,"{'id': 36113186, 'body': 'Hi Jla2011, sorry for the unpleasant experience. We are glad to help you but we are too busy with emails recently. We will reply to your email ASAP. Thanks for your understanding and feedback! Looking forward and wish you keep fit.', 'modified': '2023-04-23T03:19:05Z'}","I do 30 day workouts but the app won’t advance each day.  The app has been stuck in day 12 for 4 days.  Tried logging in and out, tried clearing the cache.  Nothing works.  Reached out to customer service and got nothing.",1,False,Doesn’t move forward,Jla2011,JustFit Lazy Workout Fit
2023-03-31 02:46:18,"{'id': 35763616, 'body': 'Hello there! We apologize for your dissatisfaction. JustFit can be downloaded for free and some of its features and content can be accessed without a subscription. However, to access all the features, a subscription is required. Thank you for your comprehension.', 'modified': '2023-04-04T10:39:47Z'}","Hello, I was wondering why can’t you guys make your fitness workouts for free?? It doesn’t make sense to me because I really enjoy this app… can you guys try to make the workout days longer or just make the workouts for free, thanks.",2,False,Prices,yafazz•oge,JustFit Lazy Workout Fit
2023-03-30 04:11:00,,"When I was working out, I felt like this was truly working. These are truly very good workouts.",5,False,Julius,jct hi u,JustFit Lazy Workout Fit
2023-03-08 14:57:54,"{'id': 35305327, 'body': 'Thank you so much! It means the world to us ❤️ We will update our content and improve our app! Stay tuned! Looking forward and wish you keep fit.', 'modified': '2023-03-10T05:40:39Z'}","You can do at home with no
Equipment",5,False,Good overall workouts,JJSummers,JustFit Lazy Workout Fit
