date,developerResponse,review,rating,isEdited,title,userName,App_Name
2022-10-22 18:58:44,"{'id': 32738041, 'body': 'Sorry for the unpleasant experience. Justfit can be used on multiple devices, but the progress is not synchronized. If you want to use it on multiple devices. Here are some steps: 1. Login on the new device with the Apple ID that you purchased JustFit with. 2. Click on ‘purchased’. 3. Find JustFit and download it. And we are developing this function. If you have any suggestions, please feel free to tell us. ', 'modified': '2022-10-24T02:16:28Z'}","I’ve just started and would like to be able to use on multiple devices. I travel so don’t always have the same device with me. I tried opening on a different iPad and it started asking me the same questions. Clearly, it does not share on all devices. How can I make this work?",2,False,How to Use on any Device,rozeg,JustFit Lazy Workout Fit
2022-06-16 21:33:28,,"I’ll admit i love the app!! It has given me results and it’s only been two days!! However, when I try to open the day 3 workout it’s asking me to pay i thought the plan was for 21 days and not just 3, and also why is day 3 workout the same as the rest of the days?",3,False,ONLY 3 DAYS!!?,nieceyray,JustFit Lazy Workout Fit
2023-08-22 09:12:32,"{'id': 38488846, 'body': 'Thank you so much! It means the world to us ❤️ We will update our content and improve our app! Stay tuned! Looking forward and wish you keep fit.', 'modified': '2023-08-24T01:26:10Z'}",I loved these workouts so much I did them twice everyday and I got some deals for 57% OFF thank you guys for getting me to my dream body I can finally have my summer dream body👍👍🩷🩷,5,False,The best ever,Dasia ⭐️,JustFit Lazy Workout Fit
2023-08-14 13:36:58,,"Even for free, it gives you a plan and the workout feels perfect, also it only costs a bit to buy the membership!",5,False,Wow,Awesome app get it now,JustFit Lazy Workout Fit
2023-08-16 02:28:22,"{'id': 38367493, 'body': 'Hi Bubbag! We’re sorry you feel this way. JustFit is free to download. And users can use some of the features and content. However, you do need a subscription to unlock all the features. Thanks for your understanding. ', 'modified': '2023-08-18T01:03:22Z'}","I was obsessed with the app until it never let me do workouts. After finishing 3 days of my weight loss journey, it just asked me to pay every month. It doesn’t give you much freedom anymore. You can still do the exercise but the rest of the stuff you can’t unless you pay.",2,False,Not the best weight loss app,Bubbag03,JustFit Lazy Workout Fit
2023-01-11 16:01:58,,I was unable to do any of the floor exercises due to nerve damage throughout my body. I did the other half just not as fast as a model I will keep trying. Thank you.,5,False,Day 1,Evvie 3,JustFit Lazy Workout Fit
2023-07-08 14:45:10,"{'id': 37566833, 'body': 'Hi MayskieMayhem! We’re sorry you feel this way. JustFit is free to download. And users can use some of the features and content. However, you do need a subscription to unlock all the features. Thanks for your understanding. ', 'modified': '2023-07-10T02:29:29Z'}","I tried to do my Day 4 workout, and it keeps popping up an ad for Just Fit Premium (which I’m not interested in at this time). I’m enjoying the workouts so far, but I’m frustrated and feeling as though I can’t continue unless I get behind a paywall",3,False,Concern after day 3,MayskieMayhem,JustFit Lazy Workout Fit
2023-06-30 02:04:02,,"The app itself is pretty good, but I signed up with the thought that there was a 7 day trial. I was a little annoyed to see that I was charged right away. Most apps give you a chance to try it out before charging. It’s frustrating when they don’t.",3,False,No free trial?,Señora E,JustFit Lazy Workout Fit
2023-05-15 21:48:51,"{'id': 36610064, 'body': 'Hi goodsgamestoplay! We’re sorry you feel this way. JustFit is free to download. And users can use some of the features and content. However, you do need a subscription to unlock all the features. Thanks for your understanding. ', 'modified': '2023-05-19T06:42:40Z'}",This app is ok based on letting me complete the set workouts for my goal but otherwise I tried to join the summer challenge and many other bed workouts but it wouldn’t let me without buying premium. Please fix this I really don’t want to pay for the workouts I want to complete,2,False,Won’t let me complete any workouts,goodsgamestoplay,JustFit Lazy Workout Fit
2023-02-21 15:36:26,"{'id': 35054188, 'body': 'Hi! We’re sorry you feel this way. JustFit is free to download. And users can use some of the features and content. However, you do need a subscription to unlock all the features. Thanks for your understanding. ', 'modified': '2023-02-24T11:51:16Z'}","I only downloaded this to give it a try for the free trial. Not only did I get billed for a full month, but the workout designed for me is absolutely useless. I put that I was pretty experienced in the whole beginning process with working out. I end up with a four minute workout. I was just trying to add something new to my routine and this was a huge waste of money for me.",1,False,Got billed for a trial!,FlightyBee,JustFit Lazy Workout Fit
2022-12-20 17:55:25,,This little workout or so … I thought pushed me to my limits and I really liked that so I’m going to keep this up every day with the apps help ofc !!,5,False,Better than I expected!!,Gossipgirltheorignal,JustFit Lazy Workout Fit
2021-12-07 18:51:53,,This is so wonderful. I really felt special after the walk out. I’ll recommend it not only for physical fitness but mental health as well,5,False,I really felt special after the walk out,nara🔥,JustFit Lazy Workout Fit
2023-10-03 04:05:39,"{'id': 39369646, 'body': 'Hi, we are so touched by hearing such sincere and warm feedback and we so appreciate your love towards our app. You are definitely the balm for our souls. We will keep working hard in the hope of providing you better product. Have an amazing day!', 'modified': '2023-10-07T01:54:21Z'}","Today is my first day of the workout routine. Not bad at all, it gives you rest timeouts a couple times. Feel pretty confident about this routine.",5,False,First Day Workout,mebergan,JustFit Lazy Workout Fit
2023-10-29 02:55:25,"{'id': 39834507, 'body': ""Hey, thanks for your feedback! We're really sorry. Could you please email us the details through a screenshot or something? We'd like to look into it. Contact us through contact.justfit@enerjoy.life. Thank you SO MUCH!"", 'modified': '2023-10-31T02:10:21Z'}","JustFit is great but there are minor issues. When I was starting a new day of training, it never let me start like the usual routine. Pls fix this because I really trust you guys. Overall, great app!",4,False,Great! Just a few problems,i like mind games,JustFit Lazy Workout Fit
2023-09-28 00:06:03,"{'id': 39369397, 'body': 'Hi, we appreciate your wonderful and kind feedback and are so pleasant to hear that you love this app. Your compliment made all our efforts worthy. Keep an eye out for more features and content. Have an awesome day!', 'modified': '2023-10-07T01:34:41Z'}",So far I’m loving this app mostly because I’m not paying for it and I’m doing workouts that are doing so well for my body type so I’m just loving this app sooooo much,5,False,I love this app,Addy1234!.,JustFit Lazy Workout Fit
2023-07-26 18:29:55,,It helps you get it helps you get fitness and I'm only eight given in a five star given in a five star review read my review Best reviewed you ever read,5,False,Just fit is a good game because,The lamp lights,JustFit Lazy Workout Fit
2023-07-25 18:52:46,"{'id': 37984800, 'body': 'Hi, we are moved to hear that you enjoy this game. We will keep working hard in the hope of providing you better gameplay experience. Thanks again and have a fantastic day!', 'modified': '2023-07-31T01:20:03Z'}",I really enjoy this app for only use ing it for the first time is really amazing u should try this app ur self it may not work for everyone but it works for me and I love that,5,False,Workout,tik tok 🔐,JustFit Lazy Workout Fit
2023-07-25 23:02:05,"{'id': 37946793, 'body': 'Hi Amy, it’s such an honor to hear this wonderful and kind review. You made our day! We are glad that this game brings you enjoyment and fun. Keep an eye out for more features and content. Have a great day and thanks for making ours. ', 'modified': '2023-07-28T01:19:37Z'}",School is about to start in a couple of weeks and I gained a couple of pounds and I want to lose weight before school starts and this is helping me but I’m only 11 and I can only use this for a week,4,False,Good but…,hi im Amy whats your name,JustFit Lazy Workout Fit
2023-06-13 21:10:58,,Great option but for a mom working out at home wish it was a little bit cheaper,5,False,Great wish it was cheaper,JessHolden_,JustFit Lazy Workout Fit
2023-07-10 13:37:10,"{'id': 37620930, 'body': 'Hi SV252! We’re sorry you feel this way. JustFit is free to download. And users can use some of the features and content. However, you do need a subscription to unlock all the features. Thanks for your understanding. ', 'modified': '2023-07-12T01:39:35Z'}","The first three days I was able to complete my work puts, but unfortunately I’m unable to proceed to day 4 of my workout and it’s not fair that you’re asking me to pay for the subscription?! I thought this was supposed to be a free workout app and not a paid subscription! Y’all should be ashamed of yourselves to make it unfair for us",1,False,Won’t be able to continue with day 4,SV252,JustFit Lazy Workout Fit
2023-03-20 00:27:50,"{'id': 35494371, 'body': 'Thank you so much! It means the world to us ❤️ We will update our content and improve our app! Stay tuned! Looking forward and wish you keep fit.', 'modified': '2023-03-21T03:12:13Z'}","It’s an amazing app that helps people grow better bodies I’m a kid with insecurities, so I don’t have enough money to pay, but I hope other people find happiness in this. Thank you.",5,False,Amazing,1111111112167,JustFit Lazy Workout Fit
2023-03-30 13:37:12,"{'id': 35755044, 'body': 'Hi, \rSorry for the unpleasant experience. You can change the physical limitations (including knees) and fitness level in the Plan Setting tab. Hope it helps! Looking forward and wish you keep fit.', 'modified': '2023-04-04T04:02:32Z'}",I have limitations with back and knees and I’m 66 years old of which I put in the questionnaire and exercises were posted that I physically could not do. I was looking for the lazy workout which were not offered. I’m guessing I would have to buy a package in order to get those but how would I know if they are suitable or will work without trying them.,1,False,App is confusing,Gealeani,JustFit Lazy Workout Fit
2023-03-05 15:55:51,"{'id': 35245538, 'body': 'Thank you so much! It means the world to us ❤️ We will update our content and improve our app! Stay tuned! Looking forward and wish you keep fit.', 'modified': '2023-03-07T06:18:27Z'}",Been doing this for a month and have lost 10+ pounds. I mix in a lot of stretching in addition to all of the workouts available here. Very pleased so far.,5,False,Loving this app,The_Peckster,JustFit Lazy Workout Fit
2023-02-03 00:19:49,"{'id': 34773946, 'body': 'Thanks for your feedback! Happy sweating！', 'modified': '2023-02-09T12:37:20Z'}",I am getting worn out and am really loosing weight! So far it has been 2 months and I already have lost 41 pounds!,5,False,To Anyone who is looking to lose weight or have a dream body,easy to fall asleep,JustFit Lazy Workout Fit
2023-01-13 16:54:37,,"Just getting started, and love that this is so easy to access…though definitely a challenge for me.  Thank you!!!",5,False,Getting started.,Laniui,JustFit Lazy Workout Fit
2023-01-28 18:22:09,"{'id': 34582042, 'body': 'Hi, sorry for the unpleasant experience. We are glad to help you but we are too busy with emails recently. We will reply to your email ASAP. The refund can only be handled through Apple Pay. You can sign in to report problem.apple.com to finish. If you have any problems, please feel free to tell us through contact.justfit@enerjoy.life, we will help you out!\r Looking forward and wish you keep fit.\n\n', 'modified': '2023-01-31T06:19:57Z'}","Charged my credit card, then cut off access to my account, and now keep sending me (on my same account) ads for over 1/2 the program I already paid for and don’t have access to. No response from customer support (or anyone at the company) despite multiple attempts through the app, and directly to the email noted below in this App Store ad.",1,False,Scam Alert!,Asa1971:-),JustFit Lazy Workout Fit
2023-01-04 21:16:06,,"Did the bed workout, was quick and not too strenuous, but got me huffing and puffing. I think I can do this for 10 min every day. Thanks for the help😃",5,False,Great for older person,joycette's girl,JustFit Lazy Workout Fit
2022-08-29 18:08:26,,"I really like the 10 minutes work out I’m a very busy person, I don’t have at lot of time to work out so this add it’s very helpful. Thanks just fit",5,False,Very helpful,vera soraya,JustFit Lazy Workout Fit
2022-10-01 23:35:54,,"This app claims I can lose 98 lbs in 83 days. (???)
They start with a brief health screening and ask about previous injuries. I decline jumping due to a recent torn meniscus.  Right out of the gate the workout includes jumping jacks. I signed up for beginning level. Holy cow!  There are exercises I couldn’t have done in my teens and twenties when I was uber athletic water skiing, biking, running and such. 

Not going to risk my health or injuries with this app.",1,False,Seriously just wrong,Nyla's iPad2,JustFit Lazy Workout Fit
2023-10-20 06:21:06,"{'id': 39719038, 'body': 'Hi, we are so touched by hearing such sincere and warm feedback and we so appreciate your love towards our app. You are definitely the balm for our souls. We will keep working hard in the hope of providing you better product. Have an amazing day!', 'modified': '2023-10-25T02:25:51Z'}","Good morning, 
    Pray all is well! It’s been a try Blessing starting this in the morning before I shower and say my prayers. You all continue to be Blessed. See you all again.",5,False,Blessed,BlezzedFavoredQueen,JustFit Lazy Workout Fit
2023-08-22 01:22:02,"{'id': 38488809, 'body': 'Hi, we are so touched by hearing such sincere and warm feedback and we so appreciate your love towards our app. You are definitely the balm for our souls. We will keep working hard in the hope of providing you better product. Have an amazing day!', 'modified': '2023-08-24T01:24:18Z'}","I may be a 12 year old, but I just did day one and I lost a pound. The look on my face was complete shock. This actually works please don’t hesitate to get this app.",5,False,This works no cap,harold the third one,JustFit Lazy Workout Fit
2023-04-10 19:19:31,,So far the experience is GOOD! Exercises are easy to do and explained well. The get to know you part was easy and well thought out. I’m excited!!,5,False,Just starting,Jody F 1973,JustFit Lazy Workout Fit
2023-08-08 01:24:10,"{'id': 38202227, 'body': 'Hi Princess leía, thank you for the feedback, and we’ll take your suggestion into consideration. We are always looking for new ways to continue improving. Please stay tuned!', 'modified': '2023-08-10T01:29:58Z'}","I put in the work out that I couldn’t do any jumping because I have knee problems back problems and neck problems. What does the program give me? Jumping jacks, lots and lots of bending. Exercises that go quickly from the floor to standing. The algorithm on this is not good yet. It’s not for seniors. It’s for young people. Or me when I was 20",2,False,Not for seniors!!!,Princess leía 667,JustFit Lazy Workout Fit
2023-06-09 19:41:23,,Do not get this app! It is a scam! I was extremely disappointed it was a scam!!! I had paid for a year and after 4 days of waiting it wouldn’t unlock! Kept doing the promotion and wouldn’t show me the exercises. I kept asking to have it changed but nothing was ever done! I tried the free trial and did really like the set up. I felt like I would have really used it too! :(,1,False,Just Fit Scam,Won’t give nickname,JustFit Lazy Workout Fit
2023-04-07 15:09:14,"{'id': 35860482, 'body': 'Thank you so much! It means the world to us ❤️ We will update our content and improve our app! Stay tuned! Looking forward and wish you keep fit.', 'modified': '2023-04-10T08:34:49Z'}",i am excited and motivated to start my Just Fit Personalized Program! Thank you for getting to know me better with your questionnaire.,5,False,starting!,Leihuku22,JustFit Lazy Workout Fit
2022-11-01 19:31:57,,"I am new to just fit, I spend a lot of my time running errands for my grand childreno am excited to be doing this for myself! I am ready to get started! Let’s do this!",5,False,Just got,hxhgchfufnfhkfkjehf,JustFit Lazy Workout Fit
2023-02-03 12:43:00,"{'id': 34692728, 'body': 'Thanks for your feedback. We have workouts for different parts according to your preference in “Workouts” and can click the button iconed as three horizontal lines in the upper right corner of “Plan Setting”, and you can change the fitness level. Hope it helps!\n\nAnd we are updating our content. We will consider your requirement because it is so useful and report it to our development team.\r If you have any suggestions, please feel free to tell us. Looking forward and wish you keep fit!', 'modified': '2023-02-06T06:59:53Z'}","I entered information to get a program not involving jumping or high impact exercises due to dr orders. Instead, the programs returned are full of jumping, running in place etc in spite of clear directions not to include those types of movements and disclosing ankle, knee, and wrist injuries, age, and fitness status. Why ask if the programs returned ignore my stated needs? I can’t use what has been sent.",1,False,Not for people with movement restrictions,Nella-Nerak,JustFit Lazy Workout Fit
2023-01-04 23:13:51,,They charge you for subscriptions before trial is over. They don’t answer emails. Calorie counts way off. You can’t edit steps so if you have a fitness watch other than apple it’s no good. Waste of money. Bed workout not worth it. Getting ready to delete even though I’ve been charged for 3 months .,2,False,Warning,sunnishine09,JustFit Lazy Workout Fit
2022-10-25 03:49:41,,"I am at the beginning stage and toning happy I was able to keep up! I felt so good to actually finish all routines for a chance thanks
See tomorrow night earlier though",5,False,Easy burn,resacip,JustFit Lazy Workout Fit
2022-03-04 00:52:21,,My 5 year old granddaughter and myself did this today it was great can’t wait for the next workout .,5,False,30 minute workout,shoegirl21,JustFit Lazy Workout Fit
2022-10-20 17:25:44,"{'id': 32740718, 'body': 'We are really so sorry for the unpleasant experience. Since JustFit has just launched, we were too busy to reply emails in time. To cancel your subscription, you need to do it before the next debit, or Apple Pay will automatically deduct the fee. Here are the steps to cancel your subscription on your iPhone: \r\n\r\n1. Open the ‘Settings’ of your iPhone (not the Settings of the app). \r\n\r\n2. Tap your name, then tap Subscriptions.* \r\n\r\n3. Tap the subscription that you want to manage. \r\n\r\n4. Choose a different subscription option, or tap Cancel Subscription. If you don’t see Cancel Subscription, it means that the subscription is already canceled and won’t renew. \r\n\r\n*If you don’t see “Subscriptions” in the Settings app, tap “iTunes & App Store” instead. Tap your Apple ID (which is usually your email address), then tap View Apple ID. Sign in, scroll down to Subscriptions, then tap Subscriptions. If you have cancelled your subscription and it was successful, you will receive an official email notice from Apple.  \r\n\r\nYou can also go to Settings, click on your account and open manage subscriptions, then you will see all your subscriptions, and if there is no JustFit, it means you have cancelled successfully. \r\n\r\nIf you have already paid and want a refund, you can contact Apple Pay for a refund. \r\n\r\n  \r\n\r\nHere are the steps: \r\n\r\n1. Sign in to reportaproblem.apple.com. \r\n\r\n2. Tap or click ""I\'d like to,"" then choose ""Request a refund.”  \r\n\r\n3. Choose the reason why you want a refund, then choose Next. \r\n\r\n4. Choose the JustFit, then choose Submit. If you were charged for a subscription that you no longer want, you can cancel the subscription. \r\n\r\nYour comments are quite important to us so we would really appreciate it if you could update your review if we could help you solve the problems. Once again, sorry for the inconvenience. ', 'modified': '2022-10-24T05:45:50Z'}","I have sent an email every day for five days straight, I accidentally signed up for a yearly subscription with a seven day free trial. There is nowhere in the app that lets you cancel. There is no where to manage your subscriptions. I am very frustrated. I wanted this but I did not want it for a year. I wanted to try it for a few months. I did not want to spend $70! This week!  😡😡😡?355,($8",1,False,No customer service!,uncfhjvfgjk,JustFit Lazy Workout Fit
2022-06-24 08:13:30,,"Thought this was going to help me with exercises for my body type, but a lot of them were just not with me in mind. If you are in shape it will probably work better for you. 
I did cancel it within hours of getting it. But I didn’t get a refund. Even though it said seven days trial.",2,False,Little disappointed,Swtgal62,JustFit Lazy Workout Fit
2023-10-12 00:51:36,"{'id': 39529467, 'body': 'Hi, we are so touched by hearing such sincere and warm feedback and we so appreciate your love towards our app. You are definitely the balm for our souls. We will keep working hard in the hope of providing you better product. Have an amazing day!', 'modified': '2023-10-16T06:16:31Z'}","Honestly, I think this is gonna work. A lot of these workouts are really good and I feel like you can accomplish a lot of stuff with this app",5,False,:),#emly-emi,JustFit Lazy Workout Fit
2023-09-21 01:47:56,"{'id': 39137155, 'body': 'Thank you so much! It means the world to us ❤️ We will update our content and improve our app! Stay tuned! Looking forward and wish you keep fit.', 'modified': '2023-09-26T01:10:37Z'}","Hello, I am 9 years of age i am currently very overweight but i’ve been seeing the app “JustFit” I did not think it was legit. I was shocked when it helped me i personally recommend 9/10 WOW.",5,False,really nice,OrdinaryK1d,JustFit Lazy Workout Fit
2023-09-11 19:40:53,"{'id': 38902701, 'body': 'Thank you so much! It means the world to us ❤️ We will update our content and improve our app! Stay tuned! Looking forward and wish you keep fit.', 'modified': '2023-09-14T01:15:58Z'}",The workout is easy to follow.  You’re not jumping from one exercise to the other.  You preview the following exercise to get ready for the transition.  I love it!!,5,False,Easy to follow,Gismile,JustFit Lazy Workout Fit
2023-08-05 17:30:12,,I love this app because you don’t need to pay for a good workout and it really helps me! I haven’t been this active in weeks!,5,False,Gets me going!,its_marleyinne,JustFit Lazy Workout Fit
2023-04-05 04:14:48,,I just started with this plan today is my day 1 and I’m excited to start at some point. It was Easy and at the same time very productive .,5,False,Myself,M£L B,JustFit Lazy Workout Fit
2023-03-19 02:39:01,"{'id': 35494402, 'body': 'Hello, sorry for the inconvenience. You can adjust the exercise time from the settings, and we will continue to improve this function to make the exercise time more accurate. Hope you keep following us and wish you good health!', 'modified': '2023-03-21T03:14:58Z'}",Trying to switch to a 15-20 minute duration doesn’t actually switch the plan. Many of the workouts are still in the 28-30 min range. It also doesn’t seem to take into account physical limitations to be filtered out. Will not be subscribing past the trial period.,2,False,Doesn’t change based on preferences,Emmers01,JustFit Lazy Workout Fit
2023-03-26 13:09:54,"{'id': 35625144, 'body': ""Dear user, so sorry. We offer a 7-day free trial to our annual subscription. You can manage and cancel your subscription on Settings of your iPhone or get a refund through Apple Support. If you have any questions, please email us at contact.justfit@enerjoy.life. We're glad to help you. We really appreciate you updating your updated review once you have been helped. Thanks for your understanding. It means a lot to us."", 'modified': '2023-03-28T04:23:39Z'}","I decided pretty quickly this was just not for me and cancelled my subscription on day 2 or 3. On day 4, my card was charged for the subscription. Now I have to dispute the charge. You can’t access the information with out a subscription, so you don’t know if it’s a good fit for your needs. But there was no 7-day free trial actually offered.",1,False,No 7-day free trial as offered.,kimmypooh2018,JustFit Lazy Workout Fit
