date,developerResponse,review,rating,isEdited,title,userName,App_Name
2023-05-04 15:21:34,"{'id': 36358625, 'body': ""Dear FreakNO, so sorry. We offer a 7-day free trial to our annual subscription. You can manage and cancel your subscription on Settings or get a refund through Apple Support. If you have any questions, please email us at contact.justfit@enerjoy.life. We're glad to help you. As for the workouts,we are always looking for new ways to continue improving. Thank you for your understanding. It means a lot to us."", 'modified': '2023-05-06T02:14:48Z'}","Do NOT download this app unless you want to be scammed into doing their mediocre workouts. They advertise a 7-day free trial but tried to charge me for a year THE DAY AFTER I signed up. I found the app outdated and the workouts quite lame to be honest, so I ended up deleting the app after two days and canceled my trial via my Subscriptions on my iPhone. THEN THIS APP HAD THE AUDACITY TO CHARGE ME AFTER I’d deleted it and canceled my subscription. Now going through my credit card company to dispute it and have to get a new card. I’m more than willing to pay full price for a great fitness app — THIS IS NOT IT!!!! BEWARE!",1,False,SKETCHY and mediocre AT BEST,FreakNO,JustFit Lazy Workout Fit
2023-11-08 00:41:12,"{'id': 40041378, 'body': 'Hi! We’re sorry you feel this way. JustFit is free to download. We offer a 7-day free trial to our “annual subscription” and there is no 7-day free trial for discounted annual subscriptions to our products. In addition, there is only a 3-day free trial for users without a subscription.', 'modified': '2023-11-10T01:20:54Z'}","I just wanted to stay in shape and make myself feel good in my skin, as someone who is young I can’t seem to find any apps to help me that don’t include a subscription fee, at first I thought I finally found one but on the 4th day I can’t get in. It was fun for three days I guess but I just wanted to feel good in my skin without having to pay just to be happy.",4,False,It was good but the paywall hit day 4,other dora,JustFit Lazy Workout Fit
2023-07-08 04:13:27,,"Actually, this app I don’t like it at all it keeps making you pay monthly monthly monthly and I keep pressing This is this app is not gonna work for me. I cannot do this app so I’m gonna delete this app and I’m going to get another app and I will no longer be in contact with this app and just let you know I will be waiting you a one. I’m surprised there’s no zero on here. Well, I accidentally clicked the one because I’m actually should. But no, thank you please do not text me back. bye I will go find another workout thing a better one actually thank you",1,False,Bad review,Ehdbzjd xj,JustFit Lazy Workout Fit
2023-06-08 16:36:52,,"Just started my first day as a beginner and it was pretty easy. I just wish there was a few more seconds between each set to get into position. My set was starting when I was going from being on my back to putting my back against the wall. Overall, I’m super excited.",5,False,Just getting started,DaniDolphins,JustFit Lazy Workout Fit
2023-03-22 18:52:08,"{'id': 35624965, 'body': 'orry for the unpleasant experience. You can change the fitness level in the Plan Setting tab. Hope it helps! There are many different types of fitness videos within JustFit, and we are constantly updating our fitness content. Please stay tuned! Looking forward and wish you keep fit.', 'modified': '2023-03-28T04:09:47Z'}","It’s a good app, and I enjoy using it, but it’s not beginner-level-friendly. Several of the workouts it wants me to do are relatively advanced and not for someone just starting. I got this app to help me lose weight, and I am having difficulty doing some of the workouts because I do not have the muscles or the skills to do them. Other than that, I like it.",4,False,Nice but not completely beginner friendly,Thethe2020,JustFit Lazy Workout Fit
2023-03-02 04:06:30,"{'id': 35220093, 'body': 'Hi! We’re sorry you feel this way. JustFit is free to download. And users can use some of the features and content. However, you do need a subscription to unlock all the features. Thanks for your understanding. ', 'modified': '2023-03-06T07:07:26Z'}",I started using this app to help me tone while avoiding injuries I have. Went great for the first 3 days! Day 4 came along and now I can’t access a single thing without an ad blocking me. If I click to exit the ad and try again the ad immediately pops back up and blocks me from doing anything. Really disappointed because this had to the potential to help me. I do not want to pay for a subscription and should t be force to just to use the app.,2,False,Started out great…don’t waste your time.,OakTrRoundtree,JustFit Lazy Workout Fit
2023-02-21 15:30:27,"{'id': 35054175, 'body': 'Sorry for the unpleasant experience. thanks for your feedback! Before starting each training session, there is  ""Measure Heart Rate"" buttons. When the heart presses fresh blood into the capillaries, there will be a slight change in brightness (depth of red color), and the heart rate can be calculated by monitoring the interval of this regular change with the camera.\r Looking forward and wish you keep fit!', 'modified': '2023-02-24T11:50:36Z'}",I’m giving the app 4 stars because it is a great app. I’m only on day 4 but I love it so far. The only issue I have is that when I try to get my heart rate it just doesn’t take it. I have to try it so many times until it finally gets it and when I do finally get it is would be inaccurate because I’ve been waiting too long. PLEASE find a better way to track the heart rate.,4,False,Great app but…,JJ3790,JustFit Lazy Workout Fit
2022-12-16 15:31:03,"{'id': 33755176, 'body': 'Sorry for the unpleasant experience. \rJustfit! is free to download, users can use some of the features and content. But you do need a subscription to unlock all the features and workouts. The first three days are free. We offer a 7-day free trial to our annual subscription. If you are not satisfied with something, you can cancel your subscription at any time during the trial period. Thanks for your understanding. ', 'modified': '2022-12-16T05:56:53Z'}","I downloaded this app thinking it was free. I was not surprised that is a premium part but I AM surprised that the free workout stopped working after only 4 days. It keeps looping me to purchase the premium package which I will not do. Very disappointed. You should be honest in the App Store and in the description.

UPDATE:  I received a response from the developers. They say the app is free to download and can be used free for THREE days. It should say that somewhere in the description either before or after you download. I lowered my review to 1 star. I feel like it’s clickbait",1,True,I thought this was free,Maddogg1110,JustFit Lazy Workout Fit
2022-06-11 13:13:07,,"I’m a little frustrated that the app offered a 7 day free trial but charged me the same day. I understand holds however, other similar apps do not charge until after you at least try the app out so the free trial is misleading or shall I say non existent because I was charged immediately, I canceled the same day and my money is still being held.  It is also very similar to many free workout apps and after viewing the exercises, I realized I do all of this already. I feel if they were misleading about the free trial they are misleading about results as well.",1,False,Disappointed,FREE TRIAL ???,JustFit Lazy Workout Fit
2023-08-08 00:22:30,"{'id': 38202194, 'body': 'Hi Justbeyoungg, thank you for your feedback and we are sorry for the displeasure you had with the app. We’ve been dedicated to improving our app and valuing your feelings very much. Any word of you could lead to a better app.', 'modified': '2023-08-10T01:26:08Z'}","As a person in recovery for an eating disorder, i was already wary of the questions i would be asked to begin - i wasn’t prepared to be disgusted by the questions though. 
the goal of working out can just be to have fun and enjoy it. the questions about goals were centered around changing my body and/or my weight instead of just because it could be fun? something new to try? then to have a BMI chart when BMI has been proven to be outdated, inaccurate and harmful. this entire app fuels the toxic diet culture. i hope whoever thought of this gets the day they deserve.",1,False,Harmful Questioning,Justbeyoungg_,JustFit Lazy Workout Fit
2023-06-27 16:08:59,,"I unsubscribed on what I thought was the last day of my trial and my account has been charged. I realized that at this time I wasn’t going to have the time to do this workout unfortunately and I’ve been out of town for work and I would like to k up what I need to do to get a refund. I apologize for this inconvenience. 
Thank you
Hilary Bennett",5,False,Unsubscribed,Bo Bennett,JustFit Lazy Workout Fit
2023-05-16 00:59:39,,"This app is an amazingggg app for me! But just one thing. I don’t know if anyone else has this problem but, once I got to I think day 3 or 4, it started to say that I HAD to pay this thing and it wouldn’t let me do the workout or measure my heart weight…I don’t know if this is just a bug or it it’s my phone but I have restarted my phone multiple times but I don’t know…",4,False,Amazing! But one problem..,Rae’Anna,JustFit Lazy Workout Fit
2023-10-07 16:25:15,"{'id': 39422265, 'body': 'Hi, sorry for the unpleasant experience. You can change the physical limitations (including knees) and fitness level in the Plan Setting tab. Hope it helps! Looking forward and wish you keep fit.', 'modified': '2023-10-10T06:14:50Z'}","I am disabled. I wanted a low impact workout that would have me moving. Seeing as the app only gives you one problem pain area should have been a clue. I had a injury and couldn’t start the program right away. When I went to load my info. I got worried. I have DDD in my neck and back. I’ve have had both knees replaced. Fibromyalgia and osteoarthritis. So, now that I’m out  a years worth of money and didn’t get to do one work out. I would NOT recommend this app to anyone with more than one medical issue. This is not the app I hoped it would be.",1,False,Buyer beware,SiQuE,JustFit Lazy Workout Fit
2023-03-23 13:45:12,,I just started today and there is already a change in my feeling of working out it’s like I want to do it the workouts aren’t hard hard but they are challenging enough to get the job done and it tells you when your goal will be reached I love this app it’s the best workout app I’ve downloaded and it’s free!!!,5,False,Great start,Briannaawsomerr,JustFit Lazy Workout Fit
2023-11-06 23:19:00,"{'id': 40018442, 'body': 'Hi, Reagan, thank you so much! It means the world to us ❤️ We will update our content and improve our app! Stay tuned! Looking forward and wish you keep fit.', 'modified': '2023-11-09T01:25:50Z'}",Ik it’s my first day but this app is awesome. I hope I get in fit just like it says. I believe that this app is awesome. I know I haven’t looked at the other reviews but it’s actually feels like I’m getting in fit. Then again it’s my first day but it seems cool. You should definitely try out and rate it five stars.,5,False,Five. Stars immediately.,Reagan Gutierrez,JustFit Lazy Workout Fit
2023-02-22 18:40:31,"{'id': 35054080, 'body': ""Dear user, so sorry. We offer a 7-day free trial to our annual subscription. You can manage and cancel your subscription on Settings of your iPhone or get a refund through Apple Support. If you have any questions, please email us at contact.justfit@enerjoy.life. We're glad to help you. We really appreciate you updating your updated review once you have been helped. Thanks for your understanding. It means a lot to us."", 'modified': '2023-02-24T11:46:28Z'}",I filled all the information in selected the 3 mo plan and thought I was getting a free 7 day trial. My card on file with apple was charged automatically for the 3 months.  I went into my apple subscriptions and cancel this right away.   I’m not paying for something I don’t even know if I’ll like!  It’s very deceiving and I don’t even want to use an app that doesn’t disclose all information right away. Why would their app be any different.  We there’s a $30+ lesson learned!  Don’t fall for this scam,2,False,Misleading on trial,Blueberrie20,JustFit Lazy Workout Fit
2023-10-24 05:07:16,"{'id': 39749626, 'body': 'Hi! We’re sorry you feel this way. JustFit is free to download. And users can use some of the features and content. However, you do need a subscription to unlock all the features. Thanks for your feedback, and we’ll consider your suggestion. We are always looking for new ways to continue improving. Please stay tuned!', 'modified': '2023-10-26T08:34:46Z'}","I would really love is that  it would be a bit cheaper or just not have to pay at all, because I downloaded  it because I didn’t wanna have to pay like hundreds of dollars and a membership, but otherwise ist a great app but I would like for it so I don’t have to pay to keep using the app. This app has been great but, I would like to see “some” improvement.",3,False,It’s ok but I would like to see more improvement,bvvhmgcgjf,JustFit Lazy Workout Fit
2023-02-16 02:23:50,"{'id': 34877769, 'body': 'Hi, \r\nSorry for the unpleasant experience. You can change the physical limitations (including arms) and fitness level in the Plan Setting tab. Hope it helps! Looking forward and wish you keep fit.', 'modified': '2023-02-15T07:31:08Z'}","I do limited workouts on the bed and day one had me doing plank jumps on the floor!?!? They did not give the option for injured shoulders or arms. Totally inappropriate program

Edit: quick response from the developers. Apparently there are settings that can be adjusted above what questions I answered to try the program. Be aware of this and do not expect the trial to do what you need. I never saw these settings but they are apparently there.",3,True,Not what was needed,janieheath,JustFit Lazy Workout Fit
2023-06-27 11:42:54,,"I had just started doing these workouts when I noticed that instead of getting the 7 day trial it charged me the first day! 

I REALLY want to give this ⭐️ ⭐️⭐️⭐️⭐️ because so far I LOVE the app and the exercises, however when reaching out, TWICE for clarification and help, all I got was how to get a refund and cancel. Please fix the 7 day trial error! Or take it off if you are no longer offering! I’m gonna use for the rest of the time and if I am pleased with no other issues, I’ll purchase. But don’t lie and say there is a free trial and then charge. Thanks",1,False,7 day trial,Blessedfe,JustFit Lazy Workout Fit
2023-09-09 02:57:21,"{'id': 38883103, 'body': 'Hi, we are so touched by hearing such sincere and warm feedback and we so appreciate your love towards our app. You are definitely the balm for our souls. We will keep working hard in the hope of providing you better product. Have an amazing day!', 'modified': '2023-09-13T01:47:03Z'}","It’s my first day of using this app and I’m already Loving it! I haven’t seen one add! Also I love how in between the workout there are 20 sec resting times! I also like how you can work out in bed, on a couch or on the floor! I’m going to update this when it’s sep 14th bc that’s when I’m supposed to be finished with working out!😎👍",5,False,Amazing🤩,3llie.belly❤️,JustFit Lazy Workout Fit
2023-01-25 17:19:40,,"Hello! 
Wow! I am a 65 year old woman with a very inactive life and these apps are way to much for
Me but this app!!!! Spectacular!! I actually did the whole thing…modified yes because I cannot get in my knees. But I still did the whole thing and amazed my self, so proud of myself and I feel
Exuberant!! And the app is FREE!! Thank you so much!!! Truly I love it!!",5,False,I can’t believe I can do this,Crickets Gram,JustFit Lazy Workout Fit
2023-06-01 21:06:26,"{'id': 36921318, 'body': 'Hi Flabbatha! Thank you very much for your feedback. Currently Justfit does not have these features. We take care of our user experience seriously. I have given your feedback to our development team. The developers are working on these features, so stay tuned!\r\n', 'modified': '2023-06-05T07:10:41Z'}","I just started my workout regimen today. I did it in the morning and wanted to repeat the same workout in the evening, but this app won’t allow you to go back. You can only move forward with the next workout. My philosophy is…if you pay for it, you should be allowed to use it the way you want. Other than that, it seems like it will be a fine tool for toning and weight loss.",3,False,"Not bad, but…",Flabbatha,JustFit Lazy Workout Fit
2023-02-17 17:52:12,"{'id': 34963680, 'body': 'Thanks for your feedback! We have recognized the issue and will continue optimizing it! Stay tuned for our new update and welcome to give us more feedback about the app We hope you’ll consider giving our app a higher rating. Thanks!', 'modified': '2023-02-20T08:25:51Z'}","I am older and thought this might be good for me with the differing variations of the workouts.
I do enjoy the workouts-but. I wish there was a verbal cue for doing the poses, stretchers, etc. I feel like I’m missing half the workout trying to figure what to do.
Also, the music is terrible and runs on a loop. So it appears as the workout is stuck when the loop of music ends and then just starts the same music over. Please fix this.",3,False,Great concept,Rhiannnon3,JustFit Lazy Workout Fit
2023-08-09 14:19:59,"{'id': 38226741, 'body': 'Hi Lorena Jane Lawlor, it’s such an honor to hear this wonderful and kind review. You made our day! We are glad that this game brings you enjoyment and fun. Keep an eye out for more features and content. Have a great day and thanks for making ours. ', 'modified': '2023-08-11T01:14:07Z'}","JustFit is an amazing app, I’m eleven playing soccer and very overweight but just fit made me drop 50 pounds in a year from 150 to 100! But I just wanted to say that on the adds it is saying that this app is free but it is charging me 30 dollars per month so yeah you should probably fix that and I rate this app and 4.7 out of 5",5,False,Just fit,Lorena Jane Lawlor,JustFit Lazy Workout Fit
2022-11-08 14:27:30,,"The description says it is free so I downloaded it. But after filling out all of the info and trying to begin, I had to commit to a payment plan that supposedly would go into effect after a 7 day (free) trial period.  First of all, if you have to pay EVER, it is NOT FREE.  Secondly, I am not signing up for anything without getting to actually try it first.  There was no info on how to cancel after the 7 days if I did not like it.  NOPE…not going there.  If you really want folks to TRY this, be HONEST in how you advertise.",2,False,Not Free,JodeeMc,JustFit Lazy Workout Fit
2023-02-19 15:00:54,"{'id': 34981590, 'body': 'Hi, sorry for the unpleasant experience. We are glad to help you but we are too busy with emails recently. We will reply to your email ASAP. As for the music, we have recognized the issue and will continue optimizing it! Stay tuned for our new update and welcome to give us more feedback about the app. We hope you’ll consider giving our app a higher rating. Thanks!', 'modified': '2023-02-21T03:14:57Z'}","Doesn’t mirror to all t.v.’s, the most uninspiring workout I have ever done in my life. I want my money back and there is no way to get a hold of anyone except by email and they have yet to return an email back. There is no music, no counting reps, nothing but beeps, the word rest and get ready. I don’t even feel the people demonstrating are always using good form. This is a scam. Useless! Do not purchase. It will not Taylor your routines to accommodate injuries or anything. I switched mine up to see and it was them same and not even safe for me to do. Save your money.",1,False,THE WORSE!!!,Merimose,JustFit Lazy Workout Fit
2023-01-17 05:41:41,,"If you’re here because of those ads where you can work out in bed, you won’t find anything like that in the app. The app isn’t the worst I’ve seen, but I accidentally subscribed for 3 months and only found it useful about a month. The app isn’t intelligent at all. It gives you a workout, with very little variation, and takes nothing else into account. You can’t even make substitutions or skip exercises you cannot do. Very repetitive workouts.",2,False,Not as advertised,Fizzgig74,JustFit Lazy Workout Fit
2023-08-21 18:33:16,"{'id': 38488682, 'body': 'Hi ! We’re sorry you feel this way. We offer a 7-day free trial to users with “annual subscription” and a 3-day free trial for users without a subscription. JustFit is free to download, but you do need a subscription to unlock all the features. Thanks for your understanding. ', 'modified': '2023-08-24T01:17:09Z'}",Hi I absolutely love this app but it is giving me some problems right now. I and moving on the day 4 but it wouldn’t let me start. If I clicked start training or measure heart a paying add would pop up for the full experience and a monthly pay of like 7.00 or something. I restarted the app but it still wouldn’t work. Idk if it’s a bug or glitch but it needs to be fixed. Very disappointed.,3,False,Going great until,hvhihbikbhubhjbilb,JustFit Lazy Workout Fit
2023-08-18 00:22:25,"{'id': 38413198, 'body': 'Hi ! We’re sorry you feel this way. We offer a 7-day free trial to users with “annual subscription” and a 3-day free trial for users without a subscription. JustFit is free to download, but you do need a subscription to unlock all the features. Thanks for your understanding. ', 'modified': '2023-08-21T01:39:58Z'}",I am on my 4 day and whenever I tap “Just start training “ it keeps popping up with the same add but in different versions and I can’t do my work out because it won’t let me. No matter how many times I press x it keeps popping up . I am literally crying rn because this was supposed to help me lose weight and I can’t do any thing 😭😭I think it’s a great app but some one pls help me to fix this issue,3,False,What is happening,peebodynutsackballs,JustFit Lazy Workout Fit
2023-06-21 07:25:14,,"Hello! I use JustFit and the app is exactly how they said I could! These workouts can allow you to sweat but make you feel good, it can make your very sweaty but the harder it gets, the faster you will loose weight. Also you can put easy but it will make your days longer to achieve your goal!",5,False,Good!,3mi1y <@:),JustFit Lazy Workout Fit
2023-08-08 16:30:55,"{'id': 38202243, 'body': 'Hi, we apologize that you did not enjoy the game as much due to this problem. We will make sure your feedback is forwarded to the related departments for review as it could help us improve as we develop it. Stay tuned for our future improvement. ', 'modified': '2023-08-10T01:32:03Z'}","They have an area that’s like “where do you have injuries” and it still gives me workouts that aggravate my injuries. I can barely put weight on my ankle, much less support my whole weight on it for some of these exercises. The “injuries” column does not matter in the slightest. I wouldn’t even mind if I was given a chair exercise for my daily challenge, but no.",4,False,A wee bit ableist,Addicted Gamer 5614,JustFit Lazy Workout Fit
2023-04-22 17:16:58,"{'id': 36123844, 'body': 'Hi Silverdragonsong, sorry for the unpleasant experience. We are glad to help you but we are too busy with emails recently. We will reply to your email ASAP. Thanks for your understanding and feedback! Looking forward and wish you keep fit.', 'modified': '2023-04-24T02:10:23Z'}","I paid for a 3 month subscription and have done the app for a week straight. The app won’t let me move forward past day 4 even though I paid. I’ve been trying the 28 day bed challenge. I tried emailing the developers but have received no response. I also tried to report a quality issue through Apple, doesn’t work. I then tried requesting a refund for the 3 month subscription I paid for (I’ve only had it one week) and it said it was not available and the app was free.",1,False,Bug - can’t contact developer,Silverdragonsong,JustFit Lazy Workout Fit
2022-12-09 02:30:39,,You make it very difficult to cancel you subscription. I replied to an email you sent me saying I did not want the program. Next thing I knew $74 was taken out of bank. On you information you said chat was available so I tried it. You sent me to just answer. I finally got a hold of apple and praying I get my money tommorow or I have no money for my meds.   I could not find a number to call to talk to someone.  No matter how many ways I searched. I think the program would have worked for me but seeing a pt,1,False,Just fit,cpejk,JustFit Lazy Workout Fit
2023-10-31 13:59:34,"{'id': 39879217, 'body': 'Hi! Thank you very much for your feedback. We have various workouts in “Workouts” where you can find the exercises you like. We take care of our user experience seriously. Our team is already working intensively to optimize the algorithm. Thank you for your understanding.', 'modified': '2023-11-02T01:05:45Z'}","In my opinion, this app is definitely not worth the money. I found that the presentations were a bit “low budget” and low energy. The volume and voices changed so much that it required repeated adjustments. The app says it tailors exercises around your injuries but that is not true. I input my wrist and knee injuries and the work outs consistently required being on my knees and putting weight on my wrists. So, I went back to Nike’s free app for my workouts.",2,False,Expensive But Better than Nothing,KLKarav,JustFit Lazy Workout Fit
