date,review,rating,isEdited,userName,title,developerResponse,App_Name
2022-11-20 19:32:43,"In general, I love this app because it makes it easy to book classes online. However, occasionally when I cancel a class in the future, it cancels for the current day instead. I talked to others at my studio who have also had this issue, so I know it’s not isolated. Would be great to prevent this glitch, if so then I’d give mindbody 5 stars",3,False,samplesizematters,"Great idea, execution has a few flaws",,Mindbody Fitness Salon Spa
2023-09-03 16:49:56,"I get sent in to this loop where I cannot log into my account or even make a new account on this app. I contacted customer service about this because I just want to log into my account on the app, and they sent me a response saying we can’t make changes to a business without contacting the business first and getting their approval. Who said anything about a business? Why is the support response worse than if I just went on chatGPT and asked?",1,False,answer9,Can’t log in - customer support a joke,,Mindbody Fitness Salon Spa
2018-05-02 02:59:37,Had been using this app for a long time to book classes at some local companies and explore new options. It worked pretty well but now with the “new” design is completely messed up! Hard to even search the available classes at the companies I use - why make something that worked well no longer user friendly? Too complicated a search protocol to navigate for a non techie who just wants to book an appointment!,2,False,Ccsonoma,What were you thinking?,"{'id': 3331783, 'body': ""Thanks for sharing your feedback. We're sorry to learn that you're having trouble finding the classes you love with our app and want to help! Please reach out to us via our in-app 'Chat with us' feature located on the Profile screen and we'd be happy to assist."", 'modified': '2018-05-02T16:27:33Z'}",Mindbody Fitness Salon Spa
2019-06-23 23:06:45,"Within 60 seconds you can book into your favorite class. With a bit more time, you can explore other interesting classes in your area. 

What could be improved on is for my favorite classes, when I don’t have anymore pass books, it’s a bit too easy to go with a single class pricing instead of buying another class book.",3,False,LancerKind,Great for booking class on your schedule,"{'id': 9356497, 'body': ""Hi there, thank you for your feedback, we'll ensure this is passed to the right team!"", 'modified': '2019-06-26T07:14:32Z'}",Mindbody Fitness Salon Spa
2022-01-24 02:18:56,"MINDBODY not only overcharges for its service to the wellness establishments you love, they’re also horrible at serving their customers.

I’ve been trying to book a class, but not only is it impossible manage the cards I currently have on file with mindbody, it’s also impossible to PAY WITH THEM. I have to enter an entirely new card to pay for my class. It’s ridiculous. 

They’ve essentially monopolized an industry, and then failed to provide adequate service to it.",1,False,Seakraken,"Poor app, poor support",,Mindbody Fitness Salon Spa
2021-08-20 00:08:49,"I had a 2 day pass to rock climbing and registered for one. When I check back later to use my 2nd day pass, it was gone and turned out MINDBODY used the 2nd day pass to reserve for the same exact session as my 1st day pass. Used the “contact us” and created a ticket, it states will respond back within 24 hours but it’s been almost 5 days and no response. My 2 day passes has already expired yesterday and was hoping to use it. 

Please respond!",1,False,Burgerval,Took away my 2 day pass for a 1 day session,,Mindbody Fitness Salon Spa
2019-05-07 08:09:38,"I hadn’t done yoga since I was in my teens & early 20’s. Now, in my 50’s, here I am doing Gentle Yoga with Quin. She has such a kind & gentle spirit. I believe she is just the person to help me achieve my goals: relaxation, mindfulness of my body and spirit, improved range of motion, strengthening of my muscles, & basic yoga terms/positioning. I really look forward to our sessions❤️",5,False,WT?!,Studio Stretch Shreveport,,Mindbody Fitness Salon Spa
2018-12-06 16:06:30,"My local Crossfit uses the app to book classes. The app makes it easy to find available classes and book. The app also has a feature that adds the class to your calendar. In addition, in case something comes up and I have to reschedule or cancel, it is very easy. 
Overall great app!",5,False,erombach,Great app!,"{'id': 6375066, 'body': ""We appreciate you taking the time to share your feedback. We're glad you use our app to book classes and add to your calendar. We hope you continue using it again in the future as well!"", 'modified': '2018-12-13T22:10:08Z'}",Mindbody Fitness Salon Spa
2018-02-03 17:51:27,I love using this app whether to check my schedule or to register for class. If I need to pay for additional classes well I can do it through the app as well. It offers variety of choices and businesses but as of now only use it to access various yoga studios.,5,False,Jeajud,Easy and convenient,"{'id': 2516193, 'body': 'Thank you for the positivity. We will always be here to support and expand your wellness journey!', 'modified': '2018-02-06T23:32:29Z'}",Mindbody Fitness Salon Spa
2020-10-14 19:36:51,"This app is so easy to use and it has a feature that allows you to automatically add your scheduled events to your phone’s calendar. I certainly appreciate the reminders too. 
I love it! ❤️ It’s perfect for those of us, that need the extra help to keep track of their busy schedule!",5,False,NiniO77,It’s so easy!!,"{'id': 18537499, 'body': 'Hi there, thank you so much for your review we really appreciate it! If you need anything feel free to reach out to us at app@mindbodyonline.com Thanks! ', 'modified': '2020-10-17T12:36:54Z'}",Mindbody Fitness Salon Spa
2022-04-22 04:23:37,"What I want this app to do is to search locally for what services are available to me from all the businesses which use the app in a given time slot.

If it has that capacity it’s not easy to figure it out.  What is easy to do is to search for a single service at a specific time at one business.  Why do I need the app for that?  Why would I not just call that business or use their website?

Very disappointing and very annoying.",1,False,nopedydopedy,Annoying and difficult to use,,Mindbody Fitness Salon Spa
2022-02-09 00:15:48,"This app is so incompatible with the fitness providers I patronize. Whenever I open it to
sign in to classes, it often will it not recognize my membership to certain businesses. Whenever I try to sign up for classes, I’m often redirected to use the app to do so where it becomes incompatible to sign up. Using a browser to sign up is the only practical way for me! 

I don’t understand the disconnect between the website and the app but it is huge and ridiculous.",1,False,forgetmindbody,Terrible App,,Mindbody Fitness Salon Spa
2019-04-09 11:07:25,I love using the Mind Body app to register for classes. It is also very convenient when I travel and can use it at fitness places in other locations. One improvement I would like to see is the ability to pay on the app in my home gym like I can in other locations.,5,False,AliceD5123,Mind Body is awesome,"{'id': 8139139, 'body': 'Thank you for taking the time to share your feedback. We are so glad you love using our app to register for classes at home and while traveling. Please stay tuned for future updates to our app that improve upon current payment capabilities. Thank you!', 'modified': '2019-04-09T19:14:25Z'}",Mindbody Fitness Salon Spa
2019-06-23 13:23:31,"I’ve been using this app for years and it never used to have issues. The past couple months/updates have been awful. The app constantly freezes and crashes. In order to do anything, it takes multiple tries. That can have real financial impacts if you’re trying to cancel a class and can’t get past the home screen. The development team said this last update would fix the bugs but it’s still freezing and crashing. These updates need to be tested.",1,True,exd123,Still too buggy,"{'id': 9012790, 'body': 'We apologize for the issues you are experiencing with loading times and are working on a fix. Please stay tuned for an update to the app that will address the issues you are currently experiencing!', 'modified': '2019-06-04T19:34:24Z'}",Mindbody Fitness Salon Spa
2018-04-25 14:18:11,"Easy to use, provides all the needed info in a pleasant user interface. When I want to schedule a yoga session, I open the app, click on the class I want at my preferred location, then click to add it to my calendar. 
Couldn’t be easier, whole process takes 30 seconds.",5,False,bella_bleu,Great app,"{'id': 3273220, 'body': ""Thank you for taking the time to share a rating! We're thrilled to learn that you find our app easy to use and can easily schedule your yoga classes in less than 30 seconds. We hope you'll continue to explore different classes and features!"", 'modified': '2018-04-26T16:27:12Z'}",Mindbody Fitness Salon Spa
2019-08-10 07:15:57,This app makes it so easy to schedule myself at two of my favorite studios. It’s way easier to check the schedule and book the classes from the app than it is to go to the website of either studio. Definitely worth it to download.,5,False,IvannaF89,So convenient,"{'id': 10163824, 'body': ""Hello there! Thank you for your feedback, our aims to connect the world to wellness, so to hear this we're so glad you're loving the app!"", 'modified': '2019-08-14T09:24:56Z'}",Mindbody Fitness Salon Spa
2018-04-05 15:18:24,"I don’t know how MBO has conned so many businesses into using it. It’s a terrible service that is bug-ridden and labyrinthine. They frequently have issues with crashing that make it impossible to see schedules, which I’m sure costs companies a lot of business, and it makes those companies (wrongly) look incompetent.

Furthermore, if you work somewhere that uses mbo, you’re basically screwed. The desktop platform becomes unusable and you’re stuck using the deeply hit or miss mobile app.

We should all just get rid of mind body.",1,False,concernedcitizen11,So terrible,"{'id': 3094402, 'body': 'Unfortunately, we had a temporary system outage on April 5th that we take very seriously, and we are sorry to hear that you had a negative experience. Full service was restored later that day, but if you are still experiencing issues, please chat with us using our in-app chat feature or at app@mindbodyonline.com.', 'modified': '2018-04-10T22:23:52Z'}",Mindbody Fitness Salon Spa
2020-07-06 14:19:45,"The classes and trainers at Pursuit are top notch. The variety in classes keeps it interesting while working all body parts! The trainers from Veronica, Christina and Erik are so knowledgeable and helpful they push you to do your very best! Just when I feel ready to quit they are right there encouraging you to make every minute count!",4,False,Michelke M,Hiit/Strength classes,"{'id': 16548967, 'body': 'Hi there, thank you for your review. Be sure to rate the class in your History so they get to see this lovely feedback! ', 'modified': '2020-07-11T06:23:19Z'}",Mindbody Fitness Salon Spa
2020-05-01 17:31:11,"Was so excited to be able to sign up for classes at my old studio where I used to live #corona virus. Nope. Deleted it. Use the web.

Update. They sent a message asking me to “reach out”. Clicked on the link. Went to a bunch of articles none of which answered the question. One said there was a filter for virtual classes under classes. Nope. I have always found this App frustrating but now that I am looking for virtual classes in different geographical areas it seems impossible to me",1,True,noodle561,Will not allow more than 50 miles away,"{'id': 15029248, 'body': ""Hi there, the app allows you to search anywhere in the world, the '50 miles' you're referring to is the distance in miles of that area you've selected. Please reach out so we can show you how to search outside your area. Thanks!"", 'modified': '2020-05-01T07:23:37Z'}",Mindbody Fitness Salon Spa
2019-12-24 14:39:01,"I’ve trying to use this app for my gym for over 7 months.  Rarely am I able to book or reschedule my classes via the app.  My class schedule is rarely available to review.  There’s no where to give feedback although I got an email telling to use the app to give feedback for a quicker response.  If it’s in the app, then the app is not user friendly. The typically it’s states try again later for your business schedule.  Yet it’s available on the web.  It’s a very frustrating app to use.",1,False,Blue4ever98,Rarely works properly,"{'id': 12593618, 'body': 'Hi there, we have a 24.7 Live Chat team at your disposal under Profile > Settings > Chat with us. We can discuss the issues and get you sorted. Thanks.', 'modified': '2019-12-26T10:36:17Z'}",Mindbody Fitness Salon Spa
2019-08-31 18:28:14,"People like this app because it’s easy to find and book last minute deals. But they have even less liability than Groupon or living social. They don’t monitor their offers or businesses in any way, meaning you can be screwed over entirely by a business owner and MINDBODY doesn’t care nor agree to any liability for a refund. This app is great until it’s not. Until someone doesn’t provide what they’ve offered and you’re left paying for something you didn’t get. I wish someone had warned me.",1,False,NikkisAddicted,Doesn’t protect purchases,"{'id': 10480038, 'body': 'Hi there, I am sorry to hear you had an issue. Please chat with us from the app, we can always reach out to the studio on your behalf. There are options available to you. You can find the chat feature in the app on the login and profile pages – in Settings in the upper right corner. The website is https://help.mindbody.io/ the chat icon is in the lower right corner. ', 'modified': '2019-09-02T19:57:09Z'}",Mindbody Fitness Salon Spa
2019-08-22 05:06:24,"I’ve used the MINDBODY app for years but recently, it crashes more than once when I’m attempting to schedule a class. The app will freeze/crash after I select a studio, after I select a class, while switching from day to day to see the available classes; pretty much any time I switch screens. Sometimes it will work fine but it inevitably crashes while I’m using it and this has been consistently happening for the last month.",2,False,Gabgdndlyjsvshfnrr,App Crashes,"{'id': 10298094, 'body': 'Hi there, thank you for your feedback. At your earliest convenience could you drop us a message under Profile > Settings > Chat with us. We can go through some troubleshooting and get to the bottom of your issues. Thanks in advance! ', 'modified': '2019-08-22T10:45:28Z'}",Mindbody Fitness Salon Spa
2019-06-01 16:08:52,"Useful to find and book workout classes with nice tech integration of FitBit and other fitness tracking devices. The only downside is there aren’t many businesses outside workout providers and would be nice to more massage, acupuncture and other wellness options.",5,False,paulewannacracker,Easy to find and book classes,,Mindbody Fitness Salon Spa
2019-07-28 18:49:45,"This app is continuously freezing, I have to open and close it multiple times to get it to work.  I am current on the updates, it is very frustrating to use.  I’ve just been using the individual apps of the locations I frequent because this app is so unreliable.  I do not have this issue with any of the other apps I use.  The app does not allow rating of a studio or fitness center, only individual classes, which is a big drawback.",2,False,DR0608,Glitchy,"{'id': 9902981, 'body': 'Hi there, thank you for your feedback! I am sorry to hear you are having issues with freezing. Please reach out to our support team. We are here to help you in all things app related. You can find the chat feature in the app on the login and profile pages. The website is https://help.mindbody.io/ the chat icon is in the lower right corner.', 'modified': '2019-07-29T16:18:37Z'}",Mindbody Fitness Salon Spa
2018-06-05 20:09:31,I use this app sometimes multiple times a day to schedule exercise classes and massages. I find it easy to use and extremely convenient. I also use it when traveling to find classes away from home and their schedules and addresses. I highly recommend this app.,5,False,satisfied customer in Santa Fe,MINDBODY connect,"{'id': 3745729, 'body': ""Thank you for taking the time to share a rating. We're glad you use our app multiple times a day to schedule your exercise classes and wellness services and especially enjoy it for scheduling classes while out of town. We hope you'll continue to use it in the future and explore our new updates and features."", 'modified': '2018-06-06T17:04:45Z'}",Mindbody Fitness Salon Spa
2018-05-09 21:03:27,"I have been using this app for a year and have absolutely loved it, until today. I can not find anything I need. NONE of my studios show up on my page. And I can not for the life of me navigate or do anything in the app like I did with ease before the update.",5,False,The Truth 💜,If it’s not broken DO NOT try to fix it.,"{'id': 3424880, 'body': ""Thanks for sharing your feedback. We're sorry you're having trouble finding the studios you love and we want to help! Please reach out to us via our in-app 'Chat with us' feature and we'd be happy to assist."", 'modified': '2018-05-10T17:25:07Z'}",Mindbody Fitness Salon Spa
2021-04-15 19:24:15,All the teachers are so wise and positive.  I have really good energy from the classes that I have taken.  I love the attitude of everyone and find the teachers super encouraging.  I have not been a member for very ing it when my trial runs out I will definitely make this permanent.,5,False,heidik1021,Love this place,,Mindbody Fitness Salon Spa
2023-09-15 15:46:29,This app is ok. I want to love it because so many businesses use it. I wish there was an Apple Pay option . When I want to book multiple classes at the same studio this is difficult. Improving the search feature so it is easier to find a specific studio instead of suggesting what the app thinks I would like.,3,False,vc014,Needs to upgrade,,Mindbody Fitness Salon Spa
2019-07-07 22:24:15,"Yoga classes in YOGA STATION (Hartsdale) offer the most wonderful experience for beginners and advanced yogis. The teachers are fantastic, the studio is spacious, clean and there are variety of classes at different times. The atmosphere is inviting, not intimidating (even for very beginner like me) and relaxing. Don’t be surprise if the owners Char and Ravi become your best friends right away! Love love love!!!",5,False,JustPolish,Yoga at Yoga Station,"{'id': 9574645, 'body': 'Hi! We are so glad you loved the studio and your class and the studio! Keep going and soon you will be a Yogi too.', 'modified': '2019-07-09T17:26:22Z'}",Mindbody Fitness Salon Spa
2018-02-18 07:13:28,I haven’t had any of the issues others have mentioned. I’ve used this app for at least 5 different places in three different states. When I travel I love to find a yoga studio to visit. This app makes it very easy to do that. I’ve gotten a lot of use out of it and really like it :),5,False,Aformo75,Great for traveling,"{'id': 2643966, 'body': 'Thanks for letting us help you expand your yoga practice to new studios, even when you are on the go!', 'modified': '2018-02-21T20:51:35Z'}",Mindbody Fitness Salon Spa
2019-01-02 01:39:25,"The calendar syncing function on this app is terrible. It constantly stops syncing so the classes don’t show up, and I have to manually go and turn off calendar sync and turn it back on in the settings to get them to show up, only to have them disappear again a few days later.

On the occasion when they do show up on my calendar, it always creates another blank “New Event” entry for the same time as the class that crashes the calendar app every time I try to delete it.",1,False,sweetl1,Calendar Sync Terrible,"{'id': 6645714, 'body': 'Thanks for sharing your feedback. We apologize for the issues you are currently experiencing with calendar syncing and want to help! Please reach out to us in our in-app chat so we can troubleshoot this for you.', 'modified': '2019-01-02T19:27:13Z'}",Mindbody Fitness Salon Spa
2018-06-07 23:43:13,I opened a Mindbody account in order to pay for appointments that I booked through the app.   After a month I then tried to close my account and was informed that this was not possible.  (!) The instructions suggested that I just delete the app from my phone! I wrote to customer service to request that they officially close my account and delete all info and this is what I got in response: “While processing your request it may be necessary for us to coordinate handling of the request with a third party. “,1,False,jeannebronwen,BEWARE! Personal Data Mining,"{'id': 3817596, 'body': 'Thanks for sharing your feedback. When an account is closed out, we need to handle it with the businesses you have booked classes or appointments from, which is why it may take longer for processing. Feel free to reach out at app@mindbodyonline.com if you have any additional questions!', 'modified': '2018-06-13T00:31:43Z'}",Mindbody Fitness Salon Spa
2018-02-17 16:28:27,Gets the job done. Suggested improvements: Would like to view a list of all upcoming classes from all studios in an area. Also see a full daily schedule for each studio (instead of just one class at a time and swiping to view next one).,5,False,carlfranzen,Works well and I love the color scheme,"{'id': 2643905, 'body': 'Fantastic suggestions and thank you for sharing your enthusiasm for the app!', 'modified': '2018-02-21T20:38:17Z'}",Mindbody Fitness Salon Spa
2021-06-25 22:43:46,"I had an issue booking classes at my studio and contacted MINDBODY for assistance.

MINDBODY contacted me within 24 hours and resolved the issue.  After resolving, they followed up to ensure I was taken care of a d able to schedule on line via the App.

Incredible Support!!! Thank you!!",5,False,Mae's Mom,Amazing support Team!,,Mindbody Fitness Salon Spa
2022-01-20 03:08:30,There are some issues with the app like on the Home Screen the search is clashing with the status bar on iOS. The profile page you can’t access the star hand icon or settings because the drawer has a weird header that covers it. There could be some more feature updates as well!,3,False,Angelatechwiz,This app can use some work,,Mindbody Fitness Salon Spa
2020-11-14 21:39:20,I love using the MINDBODY App for scheduling my weekly gym classes!  It’s easy and convenient and they can also add reminders to your calendar. The MINDBODY App is very user friendly...just tap the class you’re interested in taking and you are immediately signed up. I would recommend the MINDBODY App to all my friends and family!,5,False,Stampin Up,MINDBODY App,"{'id': 19260370, 'body': 'We really appreciate your feedback and 5 star review thank you so much! ', 'modified': '2020-11-21T14:20:49Z'}",Mindbody Fitness Salon Spa
2019-08-01 11:38:43,"I know early morning class is not her most favorite time of day but she always comes to class energetic when most times we are not! She makes the class so fun singing, dancing around and making silly jokes to get us through the burn in our muscles and keep us coming back for more!",5,False,klederman,"Kelly, Kelly, Kelly","{'id': 9965739, 'body': 'Hi there! We are so glad you love the class and the instructor! ', 'modified': '2019-08-01T23:41:34Z'}",Mindbody Fitness Salon Spa
2019-08-05 16:09:06,"Loved this app for years, discovered great places with it, especially while traveling. I don’t know what’s going on with it now: the last 2-3 updates have been super buggy. App keeps freezing. Can’t handle it’s own idiot unnecessary pop ups after a booking. It’s really annoying and I have to force quit every time I use it just to reload an application or schedule.",3,True,Ignatz8,Location services stuck,"{'id': 6324095, 'body': ""We're sorry to learn that location services are not working for you and want to help. On your iPhone, if you navigate to Settings and tap 'MINDBODY', you can choose to enable location while using the app. If you have any additional questions about this please reach out to us in our in-app chat."", 'modified': '2018-12-10T17:49:51Z'}",Mindbody Fitness Salon Spa
2018-09-07 12:29:00,It works great but the only things that needs some work on is make it easier to synchronize to my Fitbit and I can change my email address from my old one that I do not check much these days to my new one that I check all the time. Otherwise it works great.,5,False,Bex Libby,It works great but.....,,Mindbody Fitness Salon Spa
2020-10-03 15:00:49,"So glad I discovered Ohana Moon yoga studio. Gretta, the owner, is an amazing woman. Her and all of her instructors are professional, fun, helpful, and just plain awesome!I recently brought a girlfriend with me, and she immediately joined the studio as well. The studio is clean, well organized, and the boutique has lots of fun clothes. Keep up the good work ladies",5,False,Saluti Winery,Tina Rossi,"{'id': 18474147, 'body': 'Hi there, be sure to leave the studio a review under History so they get to see this lovely feedback! Thanks', 'modified': '2020-10-14T10:02:50Z'}",Mindbody Fitness Salon Spa
2021-06-14 12:33:37,"The website has classes and services sorted into tabs by categories. The app could really benefit from this functionality. Currently, users have to scroll through the whole list of everything that a gym offers with very limited sort and filter options. Such a time consuming process!",3,False,Heregoes24,Needs Work,,Mindbody Fitness Salon Spa
