date,review,rating,isEdited,userName,title,developerResponse,App_Name
2021-04-07 14:35:12,"I can’t express what this gym means to me.  My friend Mia introduced me to body heat about a year and a half ago and I fell in love with their cycling classes, then their yoga classes then the boot camp classes.  Every session is amazing thanks to the knowledgeable and motivated teachers they have.  

High energy and very spiritually fulfilling.  I can’t count how many times I’ve gone to Liz’s yoga classes and have been brought to tears by the end because she so effortlessly brings us into our own expressions.  Pings classes will have you crackin up and holding poses all at the same time.  

I could seriously write a book on how amazing every individual there is, if your debating against any other gyms, stop now this is the one, worth every single penny and then some.  The manager also always has a warm welcoming smile on when she’s in studio, she’s even taught a few classes which I think is awesome.  Thank you body heat for being such a light at the end of the tunnel in not just my fitness, but life’s journey.",5,False,Missashleyrene,Body heat saved me,,Mindbody Fitness Salon Spa
2023-09-13 02:19:40,"Frustrating app- so many bugs/non user friendly designs. You rarely get a response to emails and if you do, it’s often to contact the studio (for example, my cc wasn’t going through so they told me to contact my studio but it was an app issue not a problem with the studio- my studio finally deleted my account and had me resign up and then it worked). 
I originally put my birth name in but changed it to my nickname. I started attending a new studio, and they see my updated name. However, my original studio still sees my birth name. 
They don’t tell you how many classes you have left so if you have a package, you have to count on your own. It also doesn’t tell you your expiration date if you have a monthly package. You can’t sign up for texts in the app. I originally got them but stopped bc it was annoying to get 10 texts right away letting me know that I had just registered for an open class at the beginning of each month. However, now I don’t get a text when I get into a waitlisted class. There should be an option to only get texts when you get into a waitlisted class or if a class in cancelled. 
They also don’t allow for discounts. My studio offers a teacher discount, but I have to ask them anytime I need to change my number of classes, instead of doing it through the app.
My instructors also complain about it- I wish my studios would get another scheduling app.",2,False,Tess1082,Frustrating,,Mindbody Fitness Salon Spa
2021-04-29 00:40:23,"The app looks great and is easy to use. Registering for classes at my gym was easy. I don’t know how it functions for other gyms. I downloaded it hoping that logging in my 3 children into Burn Boot Camp child-watch would be easier than trying to use the non-mobile web browser from my phone. Unfortunately, I’ll still have to do the annoying process of zooming in and out on the browser. I have to go through that same process four times to get us each logged in. Because in the app you can only press the “book” button once it  leaves my two other children unable to attend. 
There needs to be a drop down menu so a number can be chosen. Same with the web browser. It doesn’t bother me that I have to zoom in and out. The biggest issue is I have to go through an annoying process 4 times, every single day. I’m a busy mom I don’t have time to sit and mess with that.
I think the real issue is that the developer didn’t develop the app to be used in the way my gym intended for child care sign up to function. It would be nice if the two of them could figure it out though. I know a lot of gyms have child care. Surely this is a function that all gyms, using the app would benefit from.",3,False,Hyedjksa,A Pointless And Useless Download,,Mindbody Fitness Salon Spa
2018-08-27 18:35:49,"needs improvement in some major areas. 1 - it should tell me what facilities the studio has. Shower? Towels? Keypad lockers? Or bring my own lock? 2 - app should have 3-4 photos of every studio. Mandatory photos supplied by studio should be the fitness room and the facilities (locker room, showers etc). A lot of studios in nyc have grimy, small and terrible shower setups. People need to see the shower facilities in advance.  3 - when I move to the map view, you show me every business on the app. You should show me ONLY what is in my filters. For example a yoga class between 6-8 am. Don’t show me hair salons when I’m looking for fitness. Then I can use the map to pick one in a location that allows me to get to work by 9 am 

Think about it this way... I’m booking a fitness class for tomorrow morning before work. I live in Brooklyn and my office is in midtown manhattan. I need a class at 7am, with shower and towel facilities, close to my home or office, or anywhere that is close to 6th Avenue (my train runs on 6th ave). Does your app allow me to easily find the right class?   No it does not. Allow me to filter on your map view. It’s very simple, every other app can do it. 

I used to use class pass and their interface was much easier to use.  I’m happy to pay full price for fitness classes, but you need to make them easier to find.",2,False,uhygdws12,Not user friendly,"{'id': 6449831, 'body': 'Thanks for sharing your feedback. As of version 5.5, we now show the amenities that different studios near you have on the studio detail page!', 'modified': '2018-12-18T23:23:53Z'}",Mindbody Fitness Salon Spa
2019-06-06 17:48:27,"The yoga studio I go to signed up with this app to show their schedules and allow students to sign up for classes on on their mobile devices. It’s supposed to link up to their system so that when you login into the app with the email you gave them at the front desk, the app will recognize it and pull your payment data so you can sign up for classes based on your subscription or how many classes you prepaid for. Unfortunately, the app doesn’t recognize my email address, so all I can do is view the schedule. When I try to register for a class, it always asks for my credit card so I can pay for that class individually instead of taking it out of the number I already prepaid for.

They told me when I downloaded it that other people were having trouble with it (not sure why they stay with the app if it’s not working as expected...), so I e-mailed app support for help. The person who helped me just said to make sure the emails aren’t going to my “junk” folder, which is not the case and is irrelevant to the problem anyway—I shouldn’t get an email until after I’ve successfully signed up for the class.

I’m hoping the yoga studio gets this straightened out because the app seems like it would be nice if it worked.",1,False,Vkng90,Can’t sign up for classes,"{'id': 9062881, 'body': ""We're sorry to hear you're having trouble linking your account and want to help! Please reach out to us in our in-app chat so we can resolve this for you."", 'modified': '2019-06-07T17:13:07Z'}",Mindbody Fitness Salon Spa
2019-06-05 22:59:47,"I have been in search for a studio that offers flexible hours & classes of different levels from novice to expert. I am a true novice and I knew after 5 days into an introductory offer, I found a home.  The instructors are professional, and their knowledge of the body, mind and spiritual connections are second to none. They weave the breathing techniques, instructional poses and the physiology simultaneously.  
     So far I experienced 3 different instructors.  Margo in particular reads a quote and paces her direction in a clear, articulate calming voice and in a way thats not intimidating.  She encourages us  and pushes our limits at the same time.  Proudly I have had 21 classes and no 2 have been remotely the same. Any concerns or anxiety that you bring to the class are left at the door.  I guarantee that your body, mind and spirit are significantly relaxed and improved before you exit the studio.  Cannot wait for my next class.
Sincerely
Jean Marie",5,False,yoga jean,Red Sun Yoga,,Mindbody Fitness Salon Spa
2020-04-23 00:07:55,"The app will sometimes send a notification about a unique class.  That’s great but good luck finding the class.  When you click on the notification it just takes you to the main app page not the class/event that you had a notification about.  The search function is really poor, made even worse in the covid-19 era where you have to know a city.  For example I just got a notification about a core40 class in Costa Rica.  Good luck finding that using the search function which is marginal at best for finding classes in a new area when you are traveling during a normal situation.

The app works well to book classes where you have a pass.  Occasionally your classes disappear from your calendar but opening the app will put them back.  Sometimes you get two events for booked classes in your calendar for no reason.

A downside of being a long time user is that any classes you have taken at now closed studios get removed from “your activity” so it’s hard to keep a goal when they arbitrarily remove classes from the counter.",3,False,Tdennis007,"Decent app, needs work","{'id': 14904443, 'body': ""Thank you for your detailed feedback. We'll make sure the developers receive this. If you're ever struggling with the Search feature please reach out to us anytime via the live chat service or email app@mindbodyonline.com Thanks again! "", 'modified': '2020-04-25T11:28:41Z'}",Mindbody Fitness Salon Spa
2022-11-27 06:21:04,"I am a Glow Sauna member and am ready to end my membership due to the fact that I haven’t been able to book a reservation through MINDBODY for months.  And when I send a note about an issue, it takes MINDBODY weeks if not months to respond, and then it’s generally to tell me it’s not their problem.
  
The current issue is that the cabin calendar dates never populate, much less show what times are available to select, ending with the message “oops, something went wrong.”  (And of course I have deleted and reloaded the app multiple times).

I also have an automatic monthly subscription to another business that previously used MINDBODY but switched to a different platform given all of the issues/customer complaints they experienced.  The owner relayed they couldn’t be happier with their decision to switch.  So….the message to other business owners is that despite their pitch MINDBODY is not a strong platform, their customer service is non-existent, they are costing you money through dropped subscriptions, and there are other options out there to better service your business needs.",1,False,sophchanel,Falls Way Below Expectations,,Mindbody Fitness Salon Spa
2019-10-15 13:44:35,"Great to see options and all the times available. 

Well now that I’m more aware and have been to my first session, I will down grade my review. The options and time available are great, but I don’t really like the fact that the workers in there do not look or ask to help people at all. I felt uncomfortable and judged anytime I had a question. And thus with the work out, there was one or more areas to ask questions. So if I am injured and need a different way to preform there’s no time or space to ask because there was no workers walking around to see with the customers. And there was no time to ask questions. I also had work right after, this needed a shower and bathroom to get ready after my earliest morning workout, and the business does not offer that, so I had to go all the way home to do that and was speeding, driving to work. I feel as if the company would do better if it improved on all these areas. I will try to go again to see if I feel different, but this is my first take on my experience.",3,False,bdzmdj,Fine to try,"{'id': 11272952, 'body': 'I am sorry the class was not up to your needs. Make sure you review the class from the app so the studio is aware of your feedback!', 'modified': '2019-10-16T03:00:09Z'}",Mindbody Fitness Salon Spa
2019-04-21 11:51:58,"My body mind so damaged from a violent assault and this app lets me know the closest classes to focus on healing!  Thank you!  Great app!  I found East River Pilates through discount promo via this app and it turns out ER Pilates exceptional w/ Australian physical therapists that also do private classes too. When I started w/ ER via promo I had bad posture, terrible pains in my body -- I still have the pain but now I can move my left arm better, get out of bed and chairs better... I have to keep working hard to support my joins w/ torn tendons etc... strengthen weak muscle groups from trauma but East River has given me knowledge and support. 

I would never have tried East River Pilates without this app and those cool promos they were on and the great way it's so easy to find classes. Thanks and gratitude!

For the worst in customer service Google Dr Fagelman assault.",5,False,Suzannah Troy,Excellent,,Mindbody Fitness Salon Spa
2020-01-28 18:45:05,"The app does pretty much every single thing I could ask of an exploratory fitness app. I love that any class I add gets automatically added to my calendar, makes keeping fitness a regular thing very easy!
I do have some places of improvement now that I’ve been using it for close to two years now and in different states in the US. As different studios have different membership programs and websites to which you can purchase classes, those things do not always reflect in the MINDBODY app. Additionally, duplicates of class packs I’ve purchased often show up in my account making me think I was double charged (I never actually have been) or had an extra class to use when I didn’t. In the reverse, I have bought memberships and classes via my studios website that do not show up in the MINDBODY app. 

Like I said, as a beginner to the app it’s perfect, but as a regular there a few places for improvements",4,False,Surracha,80% the perfect app,"{'id': 13289021, 'body': ""Hi there, thank you for your feedback we really appreciate it. Can you chat in to us via the 'Chat with us' option in the app so we can discuss the second part of your review as we believe we'll be able to help with that! Thank you again."", 'modified': '2020-02-04T13:56:55Z'}",Mindbody Fitness Salon Spa
2019-05-10 23:31:49,"I had  been “doing” yoga for 20 years—grabbing classes, watching videos, reading books here and there. But when I approached SPY with the commitment to deepen my practice, I found the perfect place for me to grow. Every teacher at SPY is outstanding—knowledgeable and present—and is skilled at leading classes with participants from every level. I love the community that the SPY teacher’s have  created. Everyone is welcome. The Baptiste Approach is accessible and only requires we yogis be a YES to whatever we need during our practice on the mat. I never thought I could do Hot Yoga. Now I can’t imagine living a week without it. I can’t recommend SPY enough. There is something for everyone. And if you’re looking to “BE” more, than “do” more SPY is the place for you. Namaste.",5,False,mcchackett,Excellent teachers. Classes for Every Level. Great sense of belonging.,,Mindbody Fitness Salon Spa
2018-06-19 22:29:57,"The app over all is very good and makes scheduling classes quite simple and seamless generally.  Also, so many studios use it, so you can maintain one account and one app across many studios and locations which is great.

Only suggestion—I wish it were integrated to the apple health app.  This could be voluntary, as some may not want their data shared.  However, given that the apple app tracks my other activity automatically including my steps, I would like to be able to reference it for a fuller picture of my activity including my yoga classes booked through mind body.  Perhaps it’s not, but I assume this could be a simple update, given that your mind body schedule can already sync with the apple calendar.",5,False,whatnicknamesareleftavailable,Would love it to sync with apple health app,"{'id': 3914413, 'body': ""Thank you for taking the time to share your feedback! We're glad you enjoy our app for scheduling classes and find it easy to maintain all your studios and locations in one app. Stay tuned for future updates that will include an integration with apple health!"", 'modified': '2018-06-20T17:48:34Z'}",Mindbody Fitness Salon Spa
2022-06-16 02:37:25,"The app is great for finding and booking classes but the profile management capabilities lack the option to manage payment methods. I have an expired credit card it is always defaulting to and I have to manually choose the active card each time I book a class. 
For the section showing the “passes” that have been purchased, instead of just showing the type of pass purchased, it lists every single possible class to which the pass could apply. So if you buy a 10 class card that expires after 3 month, the passes section will list every possible class you could apply that to - that could be hundreds of classes. If you have passes at multiple studios, it’s very difficult to use the section to see what is remaining at a particular studio.",3,False,keeppickingnicknames,Limits to Managing Profile and Viewing Passes,,Mindbody Fitness Salon Spa
2020-08-05 22:44:16,"Pre-CoVID I purchased a class pass for a local yoga studio. The classes worked prior to pandemic. I was told I would be able to use the passes after the pandemic and the studio extended the expiration date. I tried to use them to purchase the same class as I had prior to COVID. Received error and contacted customer service. Suddenly, the classes I purchased are not “compatible” ?? How is that possible? I am registering for the exact classes as I purchased the passes for. Asked for my money back after no resolution or assistance. Was basically told to bug off because they could only work with the studio. They wouldn’t even look into my account and could only assist through screen shots I sent and gave me general/possible answers. They put literally zero effort to help me. The app works, two stars for that. Negative three for wasting my money and poor customer service.",1,False,Heatherly_hb,Purchased Class Pass that would not work. Customer service offered no solution,"{'id': 17157376, 'body': ""Hi there, sorry you've had a bad experience, it sounds like the business have changes the pass settings if you're no longer to book the usual pass. In terms of being able to refund on the businesses behalf, we don't have the jurisdiction as the businesses using our platform are their own entity so you must liaise directly with the studio you purchased with if you'd like a refund. Thank you."", 'modified': '2020-08-08T13:23:21Z'}",Mindbody Fitness Salon Spa
2019-09-02 22:32:15,"Ultra Body Sculpt is amazing! The staff makes me feel like I can achieve any goals while on my weight loss journey. They’ve provided me the knowledge base that I think is imperative to not only losing weight but a healthier lifestyle, by keeping the information simple. I’ve only had two sessions and I have seen immediate results each time. Mind you, my results are not just evidence of the machine that is used but they are a combination of following the plan that was set for me and the 90 minute treatments. Prior to learning about this treatment I was considering a tummy tuck, but to be honest I wouldn’t dare to do something so evasive that would require months to fully recover knowing the ultrasonic lipo is available and at a more affordable rate.",5,False,Expressions81,The BEST!!!,"{'id': 10488677, 'body': ""Hi there, we're so happy to see your feedback for a business that uses our software. Be sure to go into your Schedule and under your previous classes to give feedback there so the business can see this too! Thanks."", 'modified': '2019-09-03T08:20:31Z'}",Mindbody Fitness Salon Spa
2018-04-23 21:39:02,"I am coming back to update my review. I had a ton of trouble with the app and came to review out of frustration. The creator did reply mentioning they had some trouble that day but all was fixed now. And yes I can log in now, and all seems ok, BUT I am still having an issue when changing days.

I was just in my gyms schedule trying to switch days to see the different classes and it got stuck on the one schedule. Like I was on April 23rd and went to view classes for the week and when I hit the 24th 25th etc the calendar did not change, it kept the data for the 23rd. It has happened to me many times. I have to close down the app and restart. But once it kept doing it over and over so I gave up. 

Hopefully the developer can find out why it is doing this to me. I have an iPhone 6plus with latest IOS.",3,False,LuvF1,Now App won’t open,"{'id': 3261444, 'body': ""Thanks for taking the time to share a review. We're sorry to hear the schedule functionality isn't working properly for you. Please reach out to us via our in-app chat feature so we can help you with this."", 'modified': '2018-04-25T23:31:22Z'}",Mindbody Fitness Salon Spa
2019-04-12 14:43:11,"I found myself blaming the hot yoga business that required me to download and waste my time trying to use this frustrating app rather than the app itself. I mean WHY would a business put their prospective clients through a time wasting process that doesn’t work when they could list their schedule on their website? I could have been done with this thirty minutes ago, instead, I’m ticked off and writing this review AND I’ve lost faith in whoever runs the yoga business I was thinking of joining because 1) they wasted my time 2) they obviously have not done their homework to see if the app actually works especially for a new client. I tried several searches in my town for this particular yoga business and found only one other class for a different company on only TWO days during the week when I know they offer classes constantly. It’s a bad sign that they would choose to make clients use this.",1,False,The Working Poor,"Horrible, frustrating","{'id': 8227850, 'body': 'We are sorry to learn you are experiencing issues searching and scheduling available classes in our app. Please reach out to us in our in-app chat or at app@mindbodyonline.com so we may help resolve these issues!', 'modified': '2019-04-15T21:11:33Z'}",Mindbody Fitness Salon Spa
2021-06-21 02:22:21,"I recently became a member at a pool that uses MINDBODY, which makes scheduling lane time and personal training sessions a breeze. I then used the app to discover a masters swim team to join, along with amazing spas and massage therapists for when I feel like pampering myself. The best part is that I can easily keep track of all of my daily appointments by exporting them automatically to my phone calendar- I usually have about 4 sessions scheduled a day so this makes organizing around my work schedule a breeze. 

This is by far the most-used app on my phone and looking forward to my next new obsession that I find through the app!",5,False,damianXdisaster,OBSESSED WITH MINDBODY!!,,Mindbody Fitness Salon Spa
2018-04-30 15:59:04,"Update: it appears that 5.0.2 has fixed my calendar syncing issues. Here is the original review just in case others find it useful. 

Thankfully the 5.0.1 update fixed the issue where it was impossible to get past the intro screen. Now I am having an issue with adding classes to the calendar. I use the application to book a squash court and once it is added to my calendar, I change the title so I know who I am playing. Now, even though I am adding to the calendar for an individual time, the application replaces my changed appointments with the defaults for all of the sessions booked with the app. Going back ot the old version for now, hopefully Mindbody with fix it.",4,False,Nick Beadman,Fixed: Calender syncing issue,"{'id': 3318801, 'body': ""We're glad to learn we were able to fix the issues you were experiencing. We take our customer's feedback very seriously and we are happy to read our team was able to solve this right away for you!"", 'modified': '2018-05-01T20:45:35Z'}",Mindbody Fitness Salon Spa
2021-06-05 13:35:25,"This app is do easy to use, and useful!! Love it! I’ve really gotten into yoga and it’s become such a huge part of my life. The MINDBODY App makes it so easy for me to enjoy my favorite new “hobby” — way of life? I’ve never not been able to do what I wanted to do, and do it easily! It’s totally intuitive to use, and you can do everything!!: browse schedules, research types of classes, read reviews, book and buy classes, cancel easily if necessary, purchase and use passes, packs, and packages — even research your visit history and what classes and teachers you’ve had. It’s all a smooth, seamless experience. Remarkable! Thanks!",5,True,Methere58,Great app!!!,"{'id': 12655145, 'body': 'Thank you very much for your 5-star review!!!', 'modified': '2019-12-30T22:47:09Z'}",Mindbody Fitness Salon Spa
