date,review,rating,isEdited,userName,title,developerResponse,App_Name
2022-02-04 21:28:16,"If I were a business owner relying on this app for my clients to book appointments, I’d be furious. It’s completely unreliable. It’s functional 2 out of 10 times, at best. I can never use this app to book appointments or locate other gyms if in a new area.",1,False,BPros,Constantly Crashing,,Mindbody Fitness Salon Spa
2021-11-28 10:30:45,This has been my go-to app for years.  It is the threshold that keeps me in shape! ❤️🤗✌🏻,5,False,DiDiSavoie,Easy & Reliable,,Mindbody Fitness Salon Spa
2021-01-18 16:20:35,Great way to schedule a class that is quick and easy!!,5,False,PB & DB,Time saver!,,Mindbody Fitness Salon Spa
2020-04-16 16:15:57,This app works very well for booking my yoga classes. No bugs and very easy to set up and use.,5,False,seashorepal,Easy to Use,"{'id': 14838417, 'body': ""Thanks for your review. We're glad you like it!"", 'modified': '2020-04-22T12:16:06Z'}",Mindbody Fitness Salon Spa
2020-01-01 23:15:55,Pretty easy to use.  Updates your calendar.  Very functional.,5,False,Ryan C. R,Works well!,"{'id': 12682284, 'body': 'Thank you so much for the review!', 'modified': '2020-01-02T08:30:28Z'}",Mindbody Fitness Salon Spa
2019-09-13 11:34:14,"I love this app, but since the most recent update, I’ve had issues with calendar syncing. I had to turn off calendar syncing because it adds the class I signed up for, then it adds multiple New Event and I’m unable to delete them. I hope this is fixed soon.",1,False,ct6868,App update glitch,"{'id': 10711554, 'body': 'Hi there, I am sorry to hear you are having issues with the calendar events duplicating. We have put out a new version of the app. So update the app and chat with us if that does not resolve your calendar issues. You can find the chat feature in the app on the login and profile pages – in Settings in the upper right corner. The website is https://help.mindbody.io/ the chat icon is in the lower right corner.', 'modified': '2019-09-16T22:09:18Z'}",Mindbody Fitness Salon Spa
2019-07-15 01:06:24,I love how I can book my classes online and also add it to my personal calendar !,5,False,Meek129,Convenient,"{'id': 9692273, 'body': 'Hi! Thank you for the kind words! We are so glad the app is making your life easier!', 'modified': '2019-07-16T18:32:44Z'}",Mindbody Fitness Salon Spa
2019-08-15 15:32:58,BEWARE before you download this appI cannot believe the difficulties I have had trying to access my account with this app. The runaround has been absolutely ridiculous. No tech-support and they keep blaming the business owner who knows that they are lying to me. This is an awful app with awful support. Don’t use it!,1,False,Carribean Amphibean,Customer,"{'id': 10242955, 'body': 'Hi there, I am sorry to hear that your experience with the app and our support have been less then perfect. Please chat with us from the app and request a Supervisor. She will be able to get to the bottom of your issue. You can find the chat with us option on the log in and profile pages.', 'modified': '2019-08-19T17:49:50Z'}",Mindbody Fitness Salon Spa
2019-05-16 16:44:33,Super easy to use and convenient! I love that my card info gets saved for quick purchasing.,5,False,CrystalG11,I love the MINDBODY App!!!,,Mindbody Fitness Salon Spa
2019-06-24 22:20:36,"I’ve used the app for years and generally like it a lot, but it’s gotten nearly unusable with frozen screens, dozens of calendar items for every class booked, and slowness that’s sent me back to the web version. Newest update of 6.24 didn’t fix things.",1,False,reviews1234568936,Super buggy with latest updates,"{'id': 9356134, 'body': ""Hi there, we're glad to hear you've been using the app for years! We are addressing the issues currently with the development team and we should have a fix out soon for these minor issues. Thank you."", 'modified': '2019-06-26T07:02:01Z'}",Mindbody Fitness Salon Spa
2019-05-29 15:24:09,"This app used to work really well. I took it off my phone last year because the gym I went to didn’t use it. When I put it back on recently, I haven’t been able to log in at all even after multiple upgrades and downloads.",1,False,BrittLevinson,Almost never works,"{'id': 9012755, 'body': ""We're sorry to learn you're experiencing issues logging in and want to help! Please email us at app@mindbodyonline.com so we can help you out with this."", 'modified': '2019-06-04T19:32:40Z'}",Mindbody Fitness Salon Spa
2019-05-20 17:29:46,"The calendar sync on my iCal was great but now it adds ghost entries “new event”. I booked a class today and the app made 8 appointments, 7 of which were “new event” that I can’t open or delete.  One was correct.",3,False,bethsouthloop,5stars except calendar sync,"{'id': 8782861, 'body': 'We apologize for the issues you are experiencing using our app and are working on a fix. Please stay tuned for an update to the app that will address the calendar issues you are currently experiencing!', 'modified': '2019-05-21T17:39:24Z'}",Mindbody Fitness Salon Spa
2019-03-23 14:45:33,"Works well, simplifies class sign up.",5,False,hdgehe,The ‘easy button’ for exercise,"{'id': 7897867, 'body': ""Thanks for taking the time to share your feedback. We're glad you find that it works well and simplifies class sign ups!"", 'modified': '2019-03-25T16:51:40Z'}",Mindbody Fitness Salon Spa
2019-04-30 18:10:17,"So laggy, I can’t properly book anything. Also, the classes in a studio are shown out of timely order, and when I pick one I only get to book a completely different class. Unusable.",1,False,freweynee,Not sure what happened since the last few updates,"{'id': 8465108, 'body': 'We are sorry to learn you are experiencing issues booking classes. Please reach out to us in our in-app chat so we can help you out with this.', 'modified': '2019-05-01T18:45:49Z'}",Mindbody Fitness Salon Spa
2019-01-30 20:16:48,Love this app. Keeps my workouts organized because I go to many studios and synchs with my calendar,5,False,rattiekelly,Lifesaver,"{'id': 7155863, 'body': ""Thanks for taking the time to share your feedback. We're glad you like it to keep your studios organized and that it syncs with your calendar. We hope you continue using it in the future as well."", 'modified': '2019-02-04T19:59:18Z'}",Mindbody Fitness Salon Spa
2018-03-10 14:31:34,I use this app to book my yoga classes and massages. I have not had any issues. I use this app daily.,5,False,sa782136,Easy to use,"{'id': 3107084, 'body': ""Thank you for the feedback! We're so glad to hear you use this app daily to book the activities you love!"", 'modified': '2018-04-11T22:39:40Z'}",Mindbody Fitness Salon Spa
2018-05-16 12:24:26,Great app to find local yoga studios especially when traveling.  I wish it connected with my iwatch though.,4,False,sonyataye,Simple and easy to use,"{'id': 3505719, 'body': 'Thanks for sharing a review! We plan to offer Apple Watch integration in the future — stay tuned!', 'modified': '2018-05-17T19:32:16Z'}",Mindbody Fitness Salon Spa
2018-05-04 11:00:44,I have used and enjoyed this app for years. This update is tragic. Font is too small to see on my phone and it appears they have deleted the iPad version. I was out of town and looking for a yoga class. It only listed a handful of the classes available with my filters. Please bring it back to its former glory.,1,False,atnvsvjkvbf,Ugh!,"{'id': 3386594, 'body': ""Thanks for sharing your feedback. We're sorry to learn you're having trouble viewing certain items on the app — stay tuned for future updates that address the font size issues. If you need assistance finding classes on the app please reach out to us via our in-app chat and we'd be happy to assist!"", 'modified': '2018-05-07T20:20:33Z'}",Mindbody Fitness Salon Spa
2018-01-22 04:03:20,Great app! I would like a bit more detailed description of the classes but other than that it’s great!,5,False,Bruinsfan21,Love the app!,"{'id': 2405135, 'body': 'Thank you for the enthusiasm! We appreciate all ideas that come our way!', 'modified': '2018-01-25T17:58:22Z'}",Mindbody Fitness Salon Spa
2022-01-29 13:44:45,They are easy to book!,5,False,redvines5,Classes,,Mindbody Fitness Salon Spa
2023-03-07 04:27:20,"Had hard time logging in through Facebook before, now I can log in, but it shows there’s nothing available. No classes or businesses even though there should be.",1,False,bugsfortheapp,No business or classes shown,,Mindbody Fitness Salon Spa
2022-06-18 18:07:55,Every time I schedule my workout time it asks me how I heard about the class. I already answered this question. Why do you have to ask me every single time?  It’s the same class. I already answered you!  This is so annoying!,1,False,Wheres3g,Annoying app,,Mindbody Fitness Salon Spa
2021-10-15 23:14:28,Please please please try out yin and restorative with Rachel! My hips feel so open and so much better afterwards!,5,False,Nederland676,Rachel Rocks!!!!,,Mindbody Fitness Salon Spa
2021-12-07 22:41:29,"It is not easy to see how many class do I left. 
Payment and appointment are easy, I can’t get to know of that.",3,False,허어~,Please make easy how many class I left.,,Mindbody Fitness Salon Spa
2021-10-05 00:14:33,Easy to use and adds event to my calendar.,5,False,Ms. Pacific,Love the “add to calendar” feature,,Mindbody Fitness Salon Spa
2021-08-15 16:32:23,Very easy to use works with anyone’s schedule.,5,False,clusterstuck,Easy,,Mindbody Fitness Salon Spa
2021-08-07 14:07:55,I love the simple layout and how easy it is to use.,5,False,KristyHB,Excellent app for scheduling and exploring fitness classes.,,Mindbody Fitness Salon Spa
2021-04-11 15:01:16,"Loriel and Claudia are wonderful, kind, and caring. Sad I will go back north may1. I doubt I will find such wonderful instructors up there. They really are on their game.",5,False,J. Scaff,Great place to go to,,Mindbody Fitness Salon Spa
2020-12-12 17:00:41,Love how I can book and track my work outs,5,False,Vbcxf,Easy and fun app!,"{'id': 19869253, 'body': ""We're glad you like it thanks for your review!"", 'modified': '2020-12-19T13:36:52Z'}",Mindbody Fitness Salon Spa
2020-10-20 13:36:07,It’s very convenient and easy using this app to schedule my new yoga classes.,5,False,Richard k FL,Great app to schedule yoga workouts,"{'id': 18678087, 'body': 'Thank you for your feedback! We really appreciate it ', 'modified': '2020-10-24T13:06:07Z'}",Mindbody Fitness Salon Spa
2020-08-05 11:18:37,Jamie is a master at Thai body work. It has helped with my flexibility and overall well being.,5,False,Lols500,Thai body work,"{'id': 17157339, 'body': 'Hi there, be sure to rate the business within your Schedule > History so they get to see this lovely review too!\r\n', 'modified': '2020-08-08T13:17:50Z'}",Mindbody Fitness Salon Spa
2020-09-01 17:03:02,"This app consistently asks me to enable push notifications and allow location access. Stop it. I declined multiple times, please stop trying to force notifications.",2,False,Bromanct,Stop asking me for push notifications,"{'id': 17707063, 'body': 'Thank you for your feedback!', 'modified': '2020-09-05T12:36:35Z'}",Mindbody Fitness Salon Spa
2020-08-31 01:30:08,Latest update is terrible. App keeps crashing after opening as soon as I try to look at ANYTHING. I’ve deleted and reinstalled multiple times and turned my phone on and off as well. Please put a new version out to fix this!,1,False,Calibababa77,Constantly crashing,"{'id': 17706992, 'body': 'Hi there, this issues now resolved please update to the latest version! Thank you for your patience.\r\n', 'modified': '2020-09-05T12:31:00Z'}",Mindbody Fitness Salon Spa
2020-03-25 01:17:40,Ohana wellness and fitness in Shelby Twp cares... they offer the best online workouts to keep us all motivated during this social distancing !!!! They really care about their clients !!!,5,False,Mobile User1984,#ohanaonline rocks !,"{'id': 14237153, 'body': 'Thanks for your review! Be sure to rate your class history so the studios get to see this great feedback too.', 'modified': '2020-03-25T11:16:16Z'}",Mindbody Fitness Salon Spa
2020-02-19 01:42:36,I hate when I have to miss a workout.,5,False,crazey girl,Excited to go to workout,"{'id': 13602154, 'body': 'So great to see the app helps you stay motivated, thank you for your review! ', 'modified': '2020-02-20T10:22:48Z'}",Mindbody Fitness Salon Spa
2019-12-30 16:21:14,I’m always on this app trying to get my work out classes booked. It works awesome!,5,False,E R I C A LYNNE,Easy to use and works great!,"{'id': 12655152, 'body': 'Glad you like it! :)', 'modified': '2019-12-30T22:48:01Z'}",Mindbody Fitness Salon Spa
2019-06-09 05:23:22,I have a couple of favorites and it is easy to schedule my sessions with them.,5,False,thokeller51,Very handy app,,Mindbody Fitness Salon Spa
2019-10-29 21:31:01,Not user friendly. Good intentions but does not come together well. I constantly have issues with the app. Try searching a specific studio or class and the search results NEVER make any sense. This app needs major updating.,2,False,13NK13yoga,MBO needs a lot of help,"{'id': 11550161, 'body': 'Thanks for your feedback, if you continue to experience problems searching for studios, drop a message over to our 24/7 Live Chat team so they can assist you!', 'modified': '2019-10-30T08:42:42Z'}",Mindbody Fitness Salon Spa
2018-08-19 00:57:03,This app is so easy use even a luddite (look that up in your Funk & Wagnalls) like myself can easily navigate it.,5,False,DCBArlington,So easy,"{'id': 4737256, 'body': ""We appreciate you taking the time to share your feedback. We're glad you find our app easy to use and enjoy booking classes with us!"", 'modified': '2018-08-20T16:42:49Z'}",Mindbody Fitness Salon Spa
2019-05-24 12:05:37,"Zero stars. Latest update caused the app not to function. A bug fix was available 1-2 days later and still does not work. Screen just freezes when trying to look at classes, then app shuts down all together. Come on, really?",1,False,nuts1177,Does not work anymore!,"{'id': 8904875, 'body': 'We apologize for the issues you are experiencing with loading times and are working on a fix. Please stay tuned for an update to the app that will address the issues you are currently experiencing!', 'modified': '2019-05-28T18:57:16Z'}",Mindbody Fitness Salon Spa
2018-07-01 12:28:21,The MINDBODY App offers a very convenient way of finding and signing up for classes. I really find it useful when traveling!,5,False,Sriyogig,MINDBODY App,"{'id': 4062965, 'body': ""Thanks for taking the time to share your feedback! We're glad you love our app for finding and booking fitness classes while traveling. We hope you continue to utilize the new features and updates as well."", 'modified': '2018-07-02T21:44:43Z'}",Mindbody Fitness Salon Spa
2018-07-10 10:50:23,"The most recent update completed changed the layout and it is a disaster. Completely unintuitive and difficult to navigate. Additionally, it doesn’t load smoothly and often times won’t load at all. The older version was simpler. Please consider a revision!!!!",1,False,Harrinch,New update layout is terrible,"{'id': 4201738, 'body': ""Thanks for sharing your feedback with us. We're sorry to learn you're having trouble loading the app and want to help. Please reach out to our team at app@mindbodyonline.com so we can troubleshoot this for you."", 'modified': '2018-07-12T02:49:15Z'}",Mindbody Fitness Salon Spa
2018-02-21 01:47:19,The app is easy to use and I have never had a problem scheduling.,5,False,pookiebaby,Excellent,"{'id': 2750893, 'body': 'Thank you for your feedback and cheers to booking your best year yet!', 'modified': '2018-03-05T23:35:51Z'}",Mindbody Fitness Salon Spa
2018-04-18 15:05:35,"The app won’t let me past the four “what’s new” screens. Whenever I push the “Done” button (once or a dozen times), it doesn’t do anything. It doesn’t take me into the main screen. The app WAS convenient until the most recent update. Please fix this. Thank you.",1,False,Enroby Alk,Latest upgrade renders app unusable,"{'id': 3204644, 'body': 'We were able to fix this issue so you can now get past the intro screens. Sorry, again for the inconvenience. If you have any additional questions, please reach out to us via our in-app chat.', 'modified': '2018-04-20T16:04:46Z'}",Mindbody Fitness Salon Spa
2017-11-01 09:32:54,"It used to be a very nice app but now all my information has gone. All my passes, history and schedule has all been wipe out. Developer please fix this issue! It really make things inconvenient now. Even if I have bought my new passes but it won’t show in the app. PLEASE FIX",1,False,proudpdy,All information gone,,Mindbody Fitness Salon Spa
2023-08-21 15:59:49,The app closes almost everytime I open it and it’s really annoying. Can’t find any classes says searching not available and I have wifi and data fine.,1,False,viv2x,Keeps closing and searching not available,,Mindbody Fitness Salon Spa
2022-03-08 00:15:34,It's so easy to use and helps me keep track of all of my classes!,5,False,lolachai,Love this app,,Mindbody Fitness Salon Spa
2022-12-11 14:40:29,I signed up on the website. Then I downloaded the app. Some of the information I provided didn’t sync over. It’s almost 2023 and we have apps and websites that don’t work together. Invest in your technology and fix it asap.,1,False,Play On 04,Website/App not sync,,Mindbody Fitness Salon Spa
2021-03-04 20:43:02,Works the way it should. Enjoy it my equipment for my early morning workout,5,True,Oceancookie1,This is modern day fitness scheduling,"{'id': 13910941, 'body': 'Thank you for your review! ', 'modified': '2020-03-07T14:03:16Z'}",Mindbody Fitness Salon Spa
2021-04-25 19:21:19,I’ve never had an app I’ve had to delete and reinstall as frequently as this one to work properly. I keep my phone software updated as well as the app itself but every 2 weeks I have to delete and reinstall.,1,True,Dis121,Terrible,"{'id': 20282944, 'body': ""Hi there, so sorry to hear this, this doesn't sound right. Please reach out to support@mindbodyonline.com so we can assist you in some steps that may help you with these issues. Thank you. "", 'modified': '2021-01-09T12:07:12Z'}",Mindbody Fitness Salon Spa
2020-11-18 21:28:31,Makes it super simple to look at calendars of favorite studios and book a class. This lowers the psychological barrier to entry to exercising.,5,False,conradtmaxwell,Frequent Tasks are Fast,"{'id': 19260529, 'body': 'Thank you for your feedback we really appreciate it! ', 'modified': '2020-11-21T14:32:02Z'}",Mindbody Fitness Salon Spa
2021-01-07 19:24:07,Setting appointments should be easier and more accessible.,4,False,oneinthenati,Setting appointment should be more easily accessible,"{'id': 20283038, 'body': ""Thank you for your feedback, please provide us with more detail by tapping 'Contact us' at within the app. Thanks again! "", 'modified': '2021-01-09T12:20:46Z'}",Mindbody Fitness Salon Spa
2020-10-29 05:37:01,Ease of use and informative,5,False,DatdudeB,This App is everything you need it to be,"{'id': 18807998, 'body': ""Thanks for your review we're glad you like it! "", 'modified': '2020-10-30T13:49:25Z'}",Mindbody Fitness Salon Spa
2019-11-26 18:11:43,So easy to book all my workout studios through one app! So glad I found this app,5,False,JessOHNJ,Love it!,"{'id': 12081652, 'body': 'Thank you for your lovely review! ', 'modified': '2019-11-27T10:19:14Z'}",Mindbody Fitness Salon Spa
2019-04-18 13:04:34,This app is great- it allows me to stay informed & create my own schedule,5,False,Lou’s,I wish more facilities used this!!!!,,Mindbody Fitness Salon Spa
2019-11-01 16:43:33,I’m happy to be back on a schedule involving people I like to work out with on Thursday. I missed Dawns health bits n information on things   Glad to be back,4,False,The sankt,Missing you TRX,"{'id': 11609123, 'body': 'Hi there, be sure to go into your Profile > History and review the classes you attended so the business see these reviews too! Thanks.', 'modified': '2019-11-02T08:52:52Z'}",Mindbody Fitness Salon Spa
2019-08-25 22:36:02,"I tried favoriting a business and a staff member by clicking on the heart, but it's not working. Tried restarting the app, same issue. Booking works well though.",3,False,Buzzkill718,Some features not working,"{'id': 10358936, 'body': 'Hi there, I am sorry you had an issue making your teacher a favorite. Please reach out to us in chat. You can find the chat feature on the login and profile pages.', 'modified': '2019-08-26T14:31:33Z'}",Mindbody Fitness Salon Spa
2019-05-01 11:31:54,"I haven’t really had too many issues previously with this app, it’s not perfect but it’s always worked. That being said the newest update has made it unusable, it’s so slow and glitchy that I can barely add classes or look up the schedule.",1,False,kiwilori,Horrible recent update,"{'id': 8577036, 'body': 'We are sorry to learn you are experiencing issues with the latest update. Please reach out to us at app@mindbodyonline.com so we can help resolve these issues!', 'modified': '2019-05-08T17:12:57Z'}",Mindbody Fitness Salon Spa
2019-04-14 14:33:57,"This app is phenomenal. It’s easy to use, incredibly convenient and makes it so easy for me to refer to at any time! Thank you, I love it❤️",5,False,Harley66girl,Love MindBody,,Mindbody Fitness Salon Spa
2019-02-10 17:33:23,Also has a ton of options/vendors,5,False,2Beagles2Humans,"Simple, easy to use","{'id': 7718348, 'body': ""Thanks for taking the time to share your feedback. We're glad you love our app and continue using it in the future!"", 'modified': '2019-03-13T20:15:59Z'}",Mindbody Fitness Salon Spa
2019-01-15 17:03:55,So easy to sign up for my classes & I don’t have to log out!,5,False,Mac3230,Quick & Easy,"{'id': 6870405, 'body': ""Thanks for taking the time to share your feedback! We're glad you can easily sign up for your classes and don't have to log out. We hope you continue booking classes on our app in the future!"", 'modified': '2019-01-16T18:27:12Z'}",Mindbody Fitness Salon Spa
2018-06-01 17:34:15,This App includes my favorite Pilates and fitness studios and is very easy to use. You can see schedules and book your sessions all on one app!,5,False,pamdpaul,MINDBODY,"{'id': 3715170, 'body': ""Thank you for taking the time to share a rating! We're glad our app includes your favorite Pilates studios, and you find it very easy to use. We hope you'll continue to explore our updates and new features!"", 'modified': '2018-06-04T16:45:07Z'}",Mindbody Fitness Salon Spa
2018-09-05 00:37:49,"The app is amazing when it’s working.  I’ve had to delete and reload it several times to get it working every few days.  I’m not sure if I’m the only one experiencing this.

I have not been able to logon on this app now for several days.  Very frustrating.",1,False,Gardenia19,Issues with app,"{'id': 4955823, 'body': 'Thanks for taking the time to share your feedback.We apologize for the inconvenience regarding opening our app. If you upgrade to the latest version of our app this issue will be resolved. Please reach out to us at app@mindbodyonline.com if you are still experiencing any problems.', 'modified': '2018-09-06T01:48:08Z'}",Mindbody Fitness Salon Spa
2022-03-03 16:05:35,"Paige did an awesome Power class today. Beautiful voice, music and personality.",5,False,Fit ti Go,Very Intentional,,Mindbody Fitness Salon Spa
2023-04-15 12:30:39,It stops downloading at about 60%. It is not a memory issue as I don’t have this problem with other apps. Without having the app installed I cannot put myself on the waitlist for some of my favorite fitness classes. It really annoys me!,1,False,steffie188,App does not install,,Mindbody Fitness Salon Spa
2022-07-14 13:29:33,"The later versions are much more likely to forget that I have a pass, so that it’s easy to mistakenly pay the single-class price.",2,False,TonyMuhplaah,Never seems to improve,,Mindbody Fitness Salon Spa
2021-09-20 13:52:42,Quick and easy,5,False,Lynskin,Easy to use,,Mindbody Fitness Salon Spa
2021-05-25 13:13:14,Love this place everyone is so nice and encouraging!!! Trainers and staff are amazing! I highly recommend this place,5,False,mntr_vero,Love this place,,Mindbody Fitness Salon Spa
2020-02-07 16:52:12,"Can find, book, and pay with ease.",5,False,Pete7117,Easy to use!,"{'id': 13423232, 'body': 'Thanks for your 5 star review! ', 'modified': '2020-02-11T15:39:18Z'}",Mindbody Fitness Salon Spa
2020-07-30 11:57:13,I love this app and use it every day but the last two weeks have been abysmal! First the login problem others mentioned and now that it logs me in (no Touch ID) it doesn’t have any data stored on it 😭. Please please fix it ASAP!,2,False,Boleign,Needs a fix!,"{'id': 17015511, 'body': 'Hi there, we did receive reports regarding 7.1.0 force logging users out when closing out of the app. Our developers have released a fix for this 7.1.2 however please when updating to 7.1.2, uninstall the app and manually reinstall it or it may continue to still happen due to the tokens not refreshing. Thank you for your patience whilst we got this resolved!\r\n', 'modified': '2020-08-01T08:32:32Z'}",Mindbody Fitness Salon Spa
2019-04-25 15:21:40,"The staff and environment of EDGE are nurturing and u pretentious. Great early morning classes. I’ve participated in two 6 week challenges and have achieved weight loss, muscle, strength and energy!",5,False,madrabb,I love EDGE❤️,,Mindbody Fitness Salon Spa
