date,review,rating,isEdited,userName,title,developerResponse,App_Name
2020-09-19 10:10:10,"This app is great when it works, but every 2-3 days it won’t allow me to book times. It shows “call” rather than “book” at the time that the appointments open. I can see others booking classes at that time, because it changes from “call” to “waitlist”, without allowing the “book” option.",2,False,AR374857,Glitchy,"{'id': 18472132, 'body': 'Hi there, please reach out to the app support team to look into this further for you, you can reach them at app@mindbodyonline.com Thank you. ', 'modified': '2020-10-14T08:58:24Z'}",Mindbody Fitness Salon Spa
2019-08-11 17:26:11,I love being able to schedule appointments online and add them straight to my calendar. Makes life easy and keeps me organized!,5,False,OSUspirit,Makes life easier,"{'id': 10152746, 'body': 'Hi there! Thank you for the kind words! We are so glad you are loving the app! ', 'modified': '2019-08-13T17:35:15Z'}",Mindbody Fitness Salon Spa
2019-07-23 11:21:17,"Would like to start and end on time, most students have to be somewhere, have to rely on timely classes, have to be able to trust the clock.",5,False,andrewmc3,Timely,"{'id': 9813124, 'body': 'Hi Andrew, Thank you for the review and the suggestion! I will submit it to our Development Team. Have a great week!', 'modified': '2019-07-23T21:05:57Z'}",Mindbody Fitness Salon Spa
2019-01-10 04:02:04,Really like the app! one thing that would be nice is a price filter! and allow you to see the price for all classes before you click the class.,5,False,djdierkydierk,pretty good,"{'id': 6870435, 'body': ""Thanks for taking the time to share your feedback. We're glad you like the app and that you can see the price for classes before you click into the class! We hope you continue using it in the future as well."", 'modified': '2019-01-16T18:32:36Z'}",Mindbody Fitness Salon Spa
2019-04-02 18:54:40,"When switching between days in the calendar trying to look at classes at my gym it gets real buggy. It'll show no classes for a day when I know there should be, and if I close the appa and reopen it sometimes it'll load the classes, till I try switching to another day then it'll maybe show no classes again or classes for the wrong day. Basically makes the app useless",1,False,Dipseydoodle,Buggy af,"{'id': 8138298, 'body': 'Thank you for your feedback. We apologize for the trouble you are experiencing with the calendar feature. Please reach out to us in our in-app chat so we may help resolve this issue for you!', 'modified': '2019-04-09T18:06:00Z'}",Mindbody Fitness Salon Spa
2018-11-17 17:04:41,Fast and Easy! I can see all my class passes for each studio and all my gym’s class schedules. The online booking feature and ability to add to my calendar is great!,5,False,Ambermomof3,all my gyms are in one spot!,"{'id': 6014685, 'body': ""Thank you for taking the time to share your feedback. We're glad you find our app fast and easy to use and love that you can see all your studio passes in one place. We hope you continue booking with us in the future!"", 'modified': '2018-11-19T21:35:54Z'}",Mindbody Fitness Salon Spa
2018-04-23 17:43:18,Easy to navigate and quick to tell me the information that I really need… When’s the next class. Hoping for an Apple Watch app sometime soon :-),5,False,LAMBeta,Very Convenient!,"{'id': 3248177, 'body': 'Thanks for sharing your feedback with us! We’re thrilled you find our app easy to navigate and quick to get you to information. We hope you’ll continue to use our app to help you explore the world of health and wellness!', 'modified': '2018-04-24T23:22:57Z'}",Mindbody Fitness Salon Spa
2018-09-12 17:39:58,"Will delete the app after writing this. I previously wrote a bad review saying that this app is only built for women. They responded that the app was made gender neutral. That’s a lie. Anyone using the app can see it’s for women. To prove my point, I get a promotional email from them say with a title “Work that wellness, girl. 💅”. That’s exactly how it appeared in my mailbox. I guess the staff at your company are bunch of morons, most likely women. Deleting the app goodbye.",1,True,Viperheadman,This female oriented app is getting on my nerves,"{'id': 4280599, 'body': 'Thank you for leaving your feedback — we designed our app to be gender neutral and we care about delivering a set of business offerings that people from all backgrounds will enjoy and benefit from. If you have any activities in particular you would like to see us list in our app, please reach out to us in our in-app chat.', 'modified': '2018-07-18T01:00:50Z'}",Mindbody Fitness Salon Spa
2018-05-23 01:23:33,"I have waited for days to be able to sign up for an account. It keeps saying something happened try in a few. No way to contact mind body, tried to uninstall, cleared history, etc but nothing. I’m sure MINDBODY is losing people plenty of money. I will be sure to ask next time I sign up for a gym. Can’t even schedule a class at two different gyms to try them! Smfh GARBAGE!!!!",1,False,brittany619,Not worth joining a gym that uses this  app,"{'id': 3585580, 'body': ""We're sorry to hear you're experiencing this issue and we'd like to look into it. Please reach out to us at app@mindbodyonline.com so our team can help you out with this."", 'modified': '2018-05-24T18:43:38Z'}",Mindbody Fitness Salon Spa
2017-11-14 15:17:10,"I love this app. Everything I search for is now in one location, I can easily book, cancel, schedule and even post about appointments and classes. The color scheme isn’t overbearing.",5,False,pattycakeee13,A,,Mindbody Fitness Salon Spa
2021-08-12 20:36:39,I love mindbody. It is the easiest way to sign up for a class and gives me lots of options on the same platform.,5,False,B3Catherine,So easy,,Mindbody Fitness Salon Spa
2022-06-10 18:21:05,"There’s always a problem, always. The passwords don’t sync, the account doesn’t link with the pass, i always have to double check and get signed in manually by teaches. What’s the purpose if this app if it’s always broken? It always glitches. I get an email to reset my password, I do it and then it tells me my account doesn’t exist 🤦🏻‍♀️",1,False,io.themoon,Absolut nightmare,,Mindbody Fitness Salon Spa
2021-12-18 12:56:11,"The one and only thing I can rely on with this app is the fact that it will crash. 60% of the time when I go online to book a class, the site doesn’t allow me to book. Unfortunately, several of the studios I workout in use this app for booking. The studios don’t like it either.",1,True,ggwtw16,Site crashes too often,"{'id': 9367694, 'body': ""We certainly want to look into this for you as this doesn't sound right, please select 'Chat with us' under Profile and someone in our Live Chat team can support you."", 'modified': '2019-06-26T17:03:24Z'}",Mindbody Fitness Salon Spa
2021-07-14 01:24:24,Great way to explore fitness and wellness options in a city!!! I learned about so many places and had the opportunity to book in real time!!,5,False,HB@80,Awesome ap!!,,Mindbody Fitness Salon Spa
2021-03-18 03:01:35,"Hello Jean Marie, I just wanted to take a second here and thank you sincerely for your lovely review because like you I was looking for some unique yoga classes with great teachers and your review just says it all love and happiness, 💎 Emily",5,False,JessicaBunny ,"Thank You, Jean Marie: Your Review !",,Mindbody Fitness Salon Spa
2021-02-23 19:22:28,Fitness 30 Cheshire is truly the best training place. Marvin and the other trainers are the best. The fitness studio is airy and neat. I have been going to the classes there since last June. Love the trainings!,5,True,Wei_2020,Best fitness training place,"{'id': 21240548, 'body': 'Thank you for your review! Be sure to leave the studio a review within the History of your mindbody app Classes / Appointments so they get to see this too! ', 'modified': '2021-02-23T14:13:28Z'}",Mindbody Fitness Salon Spa
2021-02-09 15:15:47,"I love having MINDBODY on my phone. I’m able to book my classes well in advance. If I need to cancel , it is also a snap to do. I also love how MINDBODY sends emails reminding me of up coming classes! All in all, I love MINDBODY!",5,False,ktravers56,Love it!,"{'id': 21033216, 'body': ""Thank you so much for your positive words! We're loving connecting you to the world of wellness!"", 'modified': '2021-02-13T12:44:43Z'}",Mindbody Fitness Salon Spa
2021-02-05 20:34:21,"I love coming to the Core Pilate studio at the provenance location, everyone is so awesome and sweet but don’t let their sweet personality full you because they are tough, and yet I’ll look forward for the next one.",5,False,C100654,For the love of Pilates💕,"{'id': 21033151, 'body': ""Thank you for your review, be sure to leave the studio a review within your History they'll love to see this too."", 'modified': '2021-02-13T12:38:58Z'}",Mindbody Fitness Salon Spa
2020-01-07 13:58:07,"I have never try Pilates before and now I can’t live without Pilates anymore. The classes are amazing! All the teachers are super professionals and extremely friendly! Thank you Lucia, Katia and Makayla for being so awesome!!",5,False,Fabiola Catania,I love it!,"{'id': 12804240, 'body': 'Thank you so much for your review! Make sure you go to the app and leave a review for you studio and instructor too!', 'modified': '2020-01-09T00:17:45Z'}",Mindbody Fitness Salon Spa
2020-08-26 16:34:55,But does not integrate with my gym account that uses MINDBODY for booking classes (is the passwords are different and do not carry over) so now I have 2 separate passwords one to sign on through the app and one to book classes through a gym that uses mindbody system.. doesn’t make much sense.,3,False,GM112234,Much better,"{'id': 17572661, 'body': ""Hi there,\n\nThe mindbody app and the desktop version are separate logins but you can sync your app account to your online account please email app@mindbodyonline.com so we can get this sorted for you. The app pulls your online logins into it and because you may go to more than one business your online logins are separate to the app that is universal and this is why they're separate. Hope this helps!"", 'modified': '2020-08-29T11:32:08Z'}",Mindbody Fitness Salon Spa
2020-07-24 11:04:34,"The 7.1.2 IOS update now can’t find the studio schedule to sign up for a class, either in the app or connecting through the studio. Fortunately I had not updated my IPad and was able to sign up for class that way. Please fix!",3,False,caseybright,New update can’t access studio schedule,"{'id': 16864640, 'body': ""Hi there, if you could send over a screenshot of the error you're seeing in your iPhone to app@mindbodyonline.com we can assist you.\n\nThanks!"", 'modified': '2020-07-25T13:26:04Z'}",Mindbody Fitness Salon Spa
2019-09-10 00:10:49,"I love being able to reserve classes using this app. Also, extremely helpful when looking for a class when out of town.",5,False,EnTailot,Soooo Easy!,"{'id': 10612120, 'body': ""Thank you for your feedback, we're glad you find the app easy to use!"", 'modified': '2019-09-10T12:33:22Z'}",Mindbody Fitness Salon Spa
2019-12-26 13:02:46,I would have given this app 5 stars until maybe a month ago. Now it works briefly and then logs me out and won't let me log in again. I have to uninstall to get it working again. Please fix that!! It's a super useful app when I can get in.,3,False,noncarbonated,Suddenly stopped working,"{'id': 12611974, 'body': ""Hi there, can you drop us a message under Profile > Chat with us and we'll certainly take a look into this for you. Thank you! "", 'modified': '2019-12-27T11:17:31Z'}",Mindbody Fitness Salon Spa
2019-05-11 15:03:21,The update messed up my app and now I can’t book new classes and only shows the same schedule everyday with the same bookings,5,False,MikkMag,Update,"{'id': 8688086, 'body': 'We are sorry to learn you are experiencing issues booking classes. Please reach out to us in our in-app chat so we can assist you with these issues!', 'modified': '2019-05-15T17:06:19Z'}",Mindbody Fitness Salon Spa
2019-05-17 14:06:09,"Update: some of problems have been fixed. At least I can see my appointments & favorites again 

Had to delete it after
Last update. Nothing worked and all my history & favorites were gone. Get it right next time",3,True,Oh really??,Bad update,"{'id': 8688048, 'body': ""We are sorry to learn you have experienced issues while using our app. Please reach out to us at app@mindbodyonline.com so we can address the issues you're currently experiencing."", 'modified': '2019-05-15T17:02:51Z'}",Mindbody Fitness Salon Spa
2019-05-07 18:10:11,"I find the layout of this app easy to understand. The old way of signing up for classes at my gym was tedious. This is a click. Plus, you can leave reviews on classes.",5,False,tivyb,Great app,,Mindbody Fitness Salon Spa
2019-01-09 17:42:35,I have already referred a ton of friends to the MINDBODY app who don’t have a set gym pass but love to try new workouts. It’s easy to find different classes and even beauty or wellness related appointments.,5,False,pattersonb09,Easy to Use & Schedule,"{'id': 6870457, 'body': ""Thanks for taking the time to share your feedback. We're glad you were referred to by a lot of friends to our app and love trying new workouts. We hope you continue using it in the future as well!"", 'modified': '2019-01-16T18:37:15Z'}",Mindbody Fitness Salon Spa
2019-03-11 12:15:30,"Cons:

1 Does not have Apple Pay. Even New Jersey transit has Apple Pay.

2 Map filter does not work. Always show me all the available facilities, gym, beauty, hair salons, when I just want to narrow down to workouts. 

3 Does not have a good UX flow. When you get into class schedule. Trying to book a class it does not show you all the possible prices available. And many time I have to go back the forth.

Pros:

It is nice to shop around and see all the available option and have the flexibility to experience different workouts.",3,False,xjing76,Its okay. Got room to improve.,"{'id': 7898613, 'body': ""Thanks for sharing your feedback. We're glad you enjoy our app's ability to show different types of workouts. We do not currently offer Apple Pay, but stay tuned for future changes to the app that will expand on our different types of available payment methods. We're sorry to learn you're having trouble with our map filter and our UX flow. Please reach out to us in our in-app chat so we can learn more details about the issues you're experiencing."", 'modified': '2019-03-25T18:01:34Z'}",Mindbody Fitness Salon Spa
2018-08-28 21:32:03,I’m traveling cross country and find this to be a great app to use for finding the services I want wherever I’m at - from haircuts to workouts to massages. I even booked a trapeze  class in Kalamazoo!,5,False,Jane Goldberg,A great tool during travel,"{'id': 4863623, 'body': ""Thanks for taking the time to share your feedback! We're glad you love our app while traveling and finding services, even for booking a trapeze class in Kalamazoo! We hope you continue using our app to schedule classes and services in the future!"", 'modified': '2018-08-29T21:15:53Z'}",Mindbody Fitness Salon Spa
2018-10-17 17:00:05,"I wish this had the option to synch with an Apple Watch; I see it has the option for Fitbit. As far as booking classes, I like the calendar layout and it’s simple to book a class!",4,False,elise dieterich,Works well for booking classes,,Mindbody Fitness Salon Spa
2018-09-03 01:05:41,I love the MINDBODY app (even was one of the original ambassadors) but this weekend the app has been buggy- it keeps quitting every time I open it. To the point I can’t even click on my schedule or class options before it closes. Please send the next update to fix!!,3,False,Beefolay,App keeps quitting,"{'id': 4955828, 'body': 'Thanks for taking the time to share your feedback.We apologize for the inconvenience regarding opening our app. If you upgrade to the latest version of our app this issue will be resolved. Please reach out to us at app@mindbodyonline.com if you are still experiencing any problems.', 'modified': '2018-09-06T01:48:31Z'}",Mindbody Fitness Salon Spa
2018-02-28 17:33:03,The Mind Body app is easy to use and I’m more likely to book an appointment using the app than if I need to call in to schedule. I use the app to reserve my spot at yoga and to schedule a massage.,5,False,MDCamp83,Convenient & Easy,"{'id': 2770093, 'body': 'Thank you for sharing your experience. Cheers to you for staying committed to wellness!', 'modified': '2018-03-07T18:22:52Z'}",Mindbody Fitness Salon Spa
2021-12-21 13:41:03,MINDBODY allows me to easily sort between my gyms and decide which classes fit best into my schedule each day. I use it daily !,5,False,EM531987,Combines all my favorite places !,,Mindbody Fitness Salon Spa
2017-09-28 13:28:30,"I have used this app on and off for years. More than any other app I can think of, this one can’t seem to stay logged in. (Not counting apps with intentionally limited access like banking apps.) Yet again, this morning it’s logged me out. I wish my gym would use something else so I wouldn’t have to keep fixing this.",2,False,Wyvern5,Keeps logging me out,,Mindbody Fitness Salon Spa
2022-08-05 17:30:41,Ever since a recent upgrade I can’t do anything in this app. When I try to book I get a message saying that it’s a virtual class(it’s not) and then app crashes. It’s not showing my passes that I bought. I have done every single troubleshooting tip. The gym instructor showed me that I have my passes but I don’t. NOTHING IS WORKING! I emailed MINDBODY and crickets…. Absolutely no reply!,1,False,KMB2006,App is no longer working!,,Mindbody Fitness Salon Spa
2022-02-28 03:54:25,Love that I can find different fitness opportunities in my area. I wish I could search for virtual classes easier instead of it only being tied a specific location.,4,False,mcbarb,Great App,,Mindbody Fitness Salon Spa
2020-04-12 21:54:05,"Easy to use to book classes and see schedules.
Difficult to near impossible to see businesses that are outside of the 50 mile choice.  Please broaden that in this time of everything going virtually.",4,False,jennlpwilliams,Almost perfect,"{'id': 14707954, 'body': ""Hi there, thanks for the feedback. We'll ensure it's passed to the right team."", 'modified': '2020-04-16T12:24:57Z'}",Mindbody Fitness Salon Spa
2020-09-23 13:58:39,With the update to the app I can no longer see my class history. This is important to me and has negatively impacted my experience using the app. Other workout apps that I have allow me to view my class history,3,False,D_Turtle,Can’t see class history?,"{'id': 18472837, 'body': 'Hi there, please update and resend the verification email to pull through your history. Thanks! ', 'modified': '2020-10-14T09:21:58Z'}",Mindbody Fitness Salon Spa
2019-07-31 14:21:04,Love the app.   There have been 2 times where I clearly made reservations for Spin class.  Went to Spin and on their end it showed I had signed up for boot camp?,5,False,Pleased in Louisville,Class reservations,"{'id': 9946378, 'body': 'Hi there! Glad you love the app! Please chat with us from the app, any time you have issues with classes or bookings. You can find the chat feature in the app on the login and profile pages. The website is https://help.mindbody.io/ the chat icon is in the lower right corner.\n', 'modified': '2019-07-31T18:56:35Z'}",Mindbody Fitness Salon Spa
2019-04-10 02:16:45,The app is so handy! I can see the schedule for the week and choose which class I want to attend. The best part is if something comes up I can cancel out.,5,False,AthleticNStyle,Simple and Easy,"{'id': 8157760, 'body': 'Thank you for taking the time to share your feedback! We are so glad you love using our app to schedule weekly classes! We hope you continue to use it in the future as well!', 'modified': '2019-04-10T19:11:43Z'}",Mindbody Fitness Salon Spa
2019-06-16 02:33:26,"Very easy to use app. But...

1. I wish I could link my account with my friend to see what classes they have signed up for

2. I wish I could add straight to my google calendar but the apps don’t directly link",4,False,Tiak11,Great but some comments,"{'id': 9275109, 'body': 'We are glad you like the app. There is a Share feature that will let you share with your friends. There is also a way to link to the google calendar. Reach out to our support team from the app. You can find the chat feature in the app on the login and profile pages.', 'modified': '2019-06-20T23:25:08Z'}",Mindbody Fitness Salon Spa
2019-06-06 16:01:01,"I like the app however, there were changes made to the app that prevented me from seeing how many more passes that I had available. Please tell me how I can find that information (how to locate the number of passes available).",4,False,Dr. Cynthia El,Dr. El,"{'id': 9840489, 'body': ""Hello there! If you tap Profile > Passes you'll see the name of the pass, how long is left until it expires and finally the sessions available / left to use. Thanks!"", 'modified': '2019-07-25T08:58:38Z'}",Mindbody Fitness Salon Spa
2018-10-23 10:27:26,Super easy to use and like that I don't have to go to various other apps to book my appointment or workouts. Most of the places I go are found in this app.,5,False,kirstenaires,Convenient,"{'id': 5712462, 'body': ""Thanks for taking the time to share your feedback! We're glad you find our app super easy to use and that you don't have to go to various sites to book all your appointments and workouts. We hope you continue using it in the future as well!"", 'modified': '2018-10-29T17:00:29Z'}",Mindbody Fitness Salon Spa
2018-09-05 13:46:02,I love this app. I love being able to add my reservations to my phone calendar. So many of my regular services have adopted mind body and it makes life so much easier.,5,False,Dart Lover,Convenient and great,"{'id': 4969884, 'body': ""Thanks for taking the time to share your feedback! We're glad you love our app for adding reservations to your calendar. We're glad that many of your regular services use MINDBODY, and we hope to continue to make your life easier in the future!"", 'modified': '2018-09-06T23:24:15Z'}",Mindbody Fitness Salon Spa
2018-04-20 10:39:21,"I enjoy the app because it is so convenient to use, makes it easy to find places and special deals. I’m sure small businesses are happy too! :)",5,False,Viviancik D,A good consolidation of choices!,"{'id': 3248207, 'body': ""We appreciate you taking the time to share a rating. We're glad you find our app easy and convenient to use. We hope you'll continue to use it to explore fitness deals and classes near you!"", 'modified': '2018-04-24T23:27:55Z'}",Mindbody Fitness Salon Spa
2020-10-12 14:22:52,"This app is very easy to use and has all my favorite studios to choose from. Easily book, modify or cancel classes at any time.",5,False,AliSchaid,So easy!,"{'id': 18475321, 'body': 'Thank you so much for your review! We really appreciate it! ', 'modified': '2020-10-14T10:58:28Z'}",Mindbody Fitness Salon Spa
2022-01-02 13:19:26,"updated the app multiple times but still having issue with the class pass part; cant see how many passes I have left and the app is lagging
thank you",3,False,Dnhajaxnd,Please fix the class pass part,,Mindbody Fitness Salon Spa
2020-01-04 15:32:32,"Love using this app on my phone.  Will you make it compatible for the Apple Watch soon? Would love to check the schedules on my watch also. Otherwise, it’s a great app!",5,False,Cool girl!!!!!,Apple Watch,"{'id': 12804290, 'body': 'Glad you like it! :) Our devlopment team is always working on new integrations.', 'modified': '2020-01-09T00:23:36Z'}",Mindbody Fitness Salon Spa
2020-02-05 05:03:08,I have used MINDBODY for years. The app works great but the old website does not seem to sync with the app. Could be my studios website and not MINDBODY causing the problem.,4,False,Profmsf,Great app - website connection problematic,"{'id': 13422992, 'body': ""Hi there, we can get you sorted, tap 'Chat with us' in the app and we'll help you sync. Thanks for the review!"", 'modified': '2020-02-11T15:23:31Z'}",Mindbody Fitness Salon Spa
2019-05-31 16:20:42,The MindBody app is very easy to use! You can conveniently sync it to your Google/phone calendar so you never forget about your wellness commitments. Highly recommend using this app.,5,False,KittyCat103,Love It!,,Mindbody Fitness Salon Spa
2019-05-30 02:52:22,"Love how easy it is to schedule, pay, cancel and add to calendar. They’ve thought of all the things that matter to people on-the-go!!",5,False,CeeCeeTee,User-friendly,,Mindbody Fitness Salon Spa
2019-04-21 21:40:05,I wished every fitness studio was required to use MINDBODY.. it is the best collective app. I love using it when I travel to see what’s available in the area. Super user-friendly and I love how it stays logged in all ways.,5,False,kodiakcarin,Best app!,,Mindbody Fitness Salon Spa
2019-05-08 22:19:32,I’ve had ongoing issues with my account being confused with someone else with the same name. Her classes appear on my schedule and vice versa. Trying to go to contact is on the recent update went nowhere. App is very unstable. I am having to close it and reopen several times to book a class. Takes forever. It’s horrible. Someone please invent something better.,1,False,erinmargo,Fails frequently,"{'id': 8688052, 'body': 'We are sorry to learn you have experienced difficulties booking classes on our app. Please reach out to us at app@mindbodyonline.com so we can learn more about the problems you are experiencing!', 'modified': '2019-05-15T17:03:10Z'}",Mindbody Fitness Salon Spa
