rating,flair_sentiment,date,developerResponse,review,isEdited,title,userName,App_Name,has_leaderboard,has_challenges,has_points,has_badges,has_feedback,has_social,has_tracking,has_goals,has_narrative,has_collab,word_count,Element type,Mentions
2,neg,2022-07-28 15:00:432020-02-08 16:51:102021-11-27 01:31:582020-05-21 23:40:382020-08-24 18:43:542020-06-25 06:15:562023-06-30 06:17:082020-09-15 20:41:562020-09-24 00:51:492021-08-29 21:18:572020-04-21 00:21:312023-09-05 04:57:452023-04-25 05:02:112021-03-22 06:00:082023-08-27 21:09:562021-01-03 19:18:442020-09-15 16:12:012020-08-29 14:57:232023-02-03 23:55:092020-07-09 21:40:442020-09-10 12:26:552023-04-23 20:32:432020-03-21 15:55:532020-08-25 20:36:14,"{'id': 31179150, 'body': ""Hello!\n\nThe Calorie Tracker tools are easy to use and always have something to offer. If you are not sure about the community records connected to your possible food logs, please search for a green checkmark that confirms that this position has been checked by the professional and the calories\\macroelements per weight are correct.\n\nWe are using Apple Health Toolkit to provide our users with the correct tracking for their Steps, Weight, Activity timers, etc. Giving permission to Read and Write data allows BetterMe to synchronize with your Health app and other apps connected to it.\n\nEvery Heath checkmark is connected to each other, and that's why marking only one does not do the job in the case of BetterMe. The data simply can't be transferred from BetterMe to Health and vise-versa if you will not mark all the permissions.\n\nAlso, BetterMe can synchronize with FitBit and related apps. We will be happy to help you with that synchronization.\n\nThe Chapters function is only a small, motivational, and quite a new tool that has been created for additional stimulation and help to every user willing to read those chapters. The doze of the information which users receive every day is quite limited to make sure every word will be read with proper attention and thoughts. Of course, this is nothing new nowadays, and everyone can find something similar on the web. Still, we made this tool unique and helpful for everyone willing to follow the recommendations.\n\nWe highly recommend you check the Workouts out. We are doing our best to adapt them for every category of users.\nUPD: Please reach us at gethelp@betterme.world, and we will do our best to fix the problem."", 'modified': '2022-07-30T07:28:51Z'}{'id': 18079078, 'body': ""Hello! We are sorry to hear that you have formed a negative opinion about our application. We do have brand options from the beginning and we are ready to help you find them. We would like to provide you with more information and give you a piece of advice, please email us at gethelp@betterme.tips. Please, make a note you'd like to comment on your review. Thank you for choosing our app and for inspiring us to become better. Have an awesome day! Regards, Team BetterMe"", 'modified': '2020-09-24T14:48:42Z'}{'id': 26514564, 'body': ""Dear Sharchen! \nWe really feel sorry for your BetterMe experience. Instead, the app has been designed and launched to easily track your daily workouts progress and weight, monitor calories and water intakes, count activities, and many more! It's a pity you haven't found the Calorie tracker useful as it offers a few options to log foods. For example, go to the Plan tab and tap the Add Food option; then choose a mealtime and hit Add Food and proceed with logging your meals.  \nYet, at the moment, our barcode database is limited, and some meals can be barely found. But we are constantly working on improving it. We hope you understand it's a time-consuming process and I do appreciate your patience. \nAs to the 7-day-trial, there are different license types of various prices and conditions of use; hence, many of them do include that trial week but it depends. It's necessary to carefully read the subscription terms upfront.\nFeel free to get back to us at gethelp@betterme.tips in case you have any other questions or requests. Best Regards, Team BetterMe"", 'modified': '2021-11-28T12:20:38Z'}{'id': 15488569, 'body': ""Hello, thank you for reaching out to us and sharing your suggestions, we will see what we can do about it! Thank you for joining the BetterMe community, we hope you'll stay tuned for updates. Please feel free to contact us at support@betterme.tips if you have any further questions. Kind regards, Team BetterMe"", 'modified': '2020-05-22T09:40:06Z'}{'id': 17509486, 'body': 'Hello! We are sorry to hear that BetterMe did not live up your expectations. We appreciate your feedback. It will help us grow and improve our service to make our app suitable and accessible for a wider number of users. Kind regards, Team BetterMe', 'modified': '2020-08-26T09:26:38Z'}{'id': 16231385, 'body': 'Hi there! We do apologize for the whole inconvenience. Please reach us at support@betterme.tips\xa0and our team wil do their best to help you fix the issue. In the meantime, you can press the ""Restore Purchases"" button. Looking forward to your reply. Kind regards, Team BetterMe', 'modified': '2020-06-26T07:04:59Z'}{'id': 37486801, 'body': 'Hello! We take full responsibility for your experience and hope you accept our apology. There are two ways we can proceed. You can reach out to us with a request at gethelp@betterme.world, or, alternatively, if you have already contacted us via email, please send us a 7-digit code from the auto-reply here. Kind regards, Team BetterMe', 'modified': '2023-07-05T13:49:17Z'}{'id': 17937343, 'body': 'Tak for din feedback! Vi er meget skuffede over at høre om din oplevelse. Dette kommer ikke nogen steder i nærheden af vores servicestandarder. Send os en e-mail på support@betterme.tips, da vi gerne vil diskutere denne sag nærmere. Vi håber, du når ud, når vi tager dine input med seriøs overvejelse. Vi håber, du har en dejlig dag, og vi ser frem til at høre fra dig.', 'modified': '2020-09-17T15:20:35Z'}{'id': 18116638, 'body': 'Hello, Mitch! Thank you for reaching out to us. We would be glad if you texted us at gethelp@betterme.tips for further assistance. Kind regards, team BetterMe', 'modified': '2020-09-26T16:01:03Z'}{'id': 24818306, 'body': 'Hello! Thank you for sharing your story. First of all, let us congratulate you on the awesome result so far, we are so proud of you! On the other hand, we are terribly sad to see you have decided to quit using the app. We understand your frustration though. The new features are constantly tested and added according to the most frequent and popular requests from our users, however, we realize that not every customer may enjoy changes. We will pass this information further to our team and consider the option to remove the new stuff from the account. Yet, all the changes need time, and we would appreciate it if you stayed with us and gave us this time. The decision is yours, in the meantime, please let us discuss the case in further detail. You can contact our team at gethelp@betterme.tips. We will be glad to see an email from you, so looking forward to it. Once again, good job! 💪 All the best, team BetterMe', 'modified': '2021-08-31T06:10:45Z'}{'id': 14817532, 'body': 'Hello!\nThank you for your feedback, we appreciate it!\nWe are currently working on updating the app.\nIf you have any additional questions or you would like to suggest anything else - you are welcome to contact our support team at support@betterme.tips', 'modified': '2020-04-21T14:47:23Z'}{'id': 38878907, 'body': ""Hello! Thank you for your extended feedback as well as for reporting the issue with workouts. Our team is always at your service. We would like to check all details from our side and understand why it's happening. We have contacted you from our side. And if you can't find our email, you can reach us from your side at gethelp@betterme.world. Kind regards, team BetterMe"", 'modified': '2023-09-12T18:28:53Z'}{'id': 36182640, 'body': 'Hello! Thank you for your feedback. We would really like to help you. Please, contact us at gethelp@betterme.world when you have time. We will do everything to improve the whole situation and share any required pieces of advice on app usage. Kind regards, team BetterMe', 'modified': '2023-04-26T11:42:35Z'}{'id': 21817392, 'body': 'Hello! Thank you for your detailed review and for letting us know about the problem. If you have put the certain food to avoid, you should see the meal plan without it. We are terribly sorry for this inconvenience, and we would kindly ask you to contact us at gethelp@betterme.tips so we could check your profile and see what might be wrong. And thank you for the useful suggestion! Looking forward to your message. Kind Regards, Team BetterMe', 'modified': '2021-03-23T12:06:42Z'}{'id': 38751612, 'body': ""Hello, and thanks for the feedback! That's a real pity to know about your experience. We are always working on app improvements! And we'd be happy to know the details regarding your concern with the challenge. Please contact us at gethelp@betterme.world. Best Regards, Team BetterMe"", 'modified': '2023-09-06T07:23:10Z'}{'id': 20187066, 'body': 'Hello! We appreciate your detailed feedback. We would be happy if you could provide us with the 6-digit number of the email you have received in the auto-reply. This way we will locate your messages and get back to you shortly. Kind regards, Team BetterMe', 'modified': '2021-01-05T09:21:10Z'}{'id': 17921751, 'body': 'Hello, we would like to extend to you with our most sincere apologies regarding your review. We have a high standard of quality for handling our customer requests and your inquiry should never have been an exception. We would greatly appreciate the opportunity to discuss this further with you. Please contact us at support@betterme.tips and we will be happy to help you out!', 'modified': '2020-09-17T02:41:48Z'}{'id': 17600990, 'body': 'Hello! We appreciate your detailed feedback. We would be happy if you could text us at support@betterme.tips. Our team will gladly give you a few tips on app usage. Do not hesitate to reach us. Kind regards, Team BetterMe', 'modified': '2020-08-31T09:56:47Z'}{'id': 34681143, 'body': 'Hello! We apologize that you have faced such obstacles. Let us please check your profile and see whether everything is set up properly. We would be glad to fix the whole confusion. Looking forward to your reply at gethelp@betterme.world. Kind regards, team BetterMe', 'modified': '2023-02-05T12:32:30Z'}{'id': 16528506, 'body': 'Hello! We appreciate your detailed feedback. Please contact us at support@betterme.tips. Our team will be glad to provide you with a few tips of app usage. Kind regards, Team BetterMe', 'modified': '2020-07-10T08:56:32Z'}{'id': 17835644, 'body': 'Hi, we are sorry to see you have formed a negative opinion about our app!  We would be grateful if you dropped us a line at support@betterme.tips and told us about the cause of your dissatisfaction. We will look into it and see what we can do to help and how we can improve! \nKind regards, Team BetterMe', 'modified': '2020-09-12T05:26:49Z'}{'id': 36157687, 'body': ""Hello! We invest a lot in the development and support of BetterMe, that's why we can't make it free, unfortunately. We are sorry to hear that you have formed such a negative opinion based on the pre-sale step. Please contact us at gethelp@betterme.world, and we will see what we can do for you. Kind regards, team BetterMe"", 'modified': '2023-04-25T09:11:36Z'}{'id': 14213133, 'body': 'Hello!\nWe apologize for the confusion.\nPlease write to support@betterme.tips, mention that you have written this review and we will surely think of something we can do for you. \nLooking forward to your reply!', 'modified': '2020-03-24T11:39:25Z'}{'id': 17533115, 'body': ""Hello! Thank you for the feedback! Unfortunately, it's impossible to restore the old version and your previous records. We have been working really hard to collect all users' feedbacks and features requests. We did our best to implement new ideas to ensure the best possible app user experience. If you have any questions regarding new tools please feel free to email us to support@betterme.tips, we will be happy to assist. Our team hopes you'll give the app another chance! Kind regards, BetterMe"", 'modified': '2020-08-27T08:39:40Z'}","However, for a pay-for app, it is lousy. The food recording is ridiculous-good luck finding what you are looking for in the measurement that is reasonable. Many different measurements seem to have been done by a completely inept person/machine, having 5 different measurements that all say the same calories. Then, you HAVE to give access to every part of your health on apple in order for it to track your steps or to even log your weight? I don’t use apple health and don’t want to share my information with it. I can understand the steps but allowing just the step tracking to share does not work at all, it still requires you to share everything. What is the point of having separate sections if yo can’t allow one section. These issues render half of the app unuseable, add to the fact it doesn’t sync with Fitbit, and I def wouldn’t recommend this app for anyone unless you are only looking to read the little quips which are nice but so far are all information you can get free online in weight loss articles, just broken down in smaller bites. The water tracker is nice, and I haven’t tried the workouts yet since I use another app for those that is easing me into them.
The daily log in award thing doesn’t even work correctly.  For 3 days it told me I was at “day 5” and then I updated the app and it sent me back to 1.  
And despite what the response to my negative review says, it does not sync with Fitbit.  There is not even an option.Though the idea of this app is exactly what I want, the follow through on it has been awful. For starters, the food logging system is just pitiful, you all dont have the brand options that other apps do, and it makes it very hard to accuratley track my meals. Tracking my meals has been made significantly harder too because you all use a slider for the calories. The slider does not work as it should, because it moves as soon as you lift your finger. And even when you do get it to stay where you’ve put it, the slider locks in on what appear to be very arbitrary numbers, meaning that you can’t EVER get an accurate reflection of your calorie intake. I would also argue that this slider feature would make this app impossible to use for people with any sort of disability that limits their dexterity, and for individuals with poor eyesight or diseases that cause their extremities to shake. 

I have sent the above information directly to the contact listed in-app, and I would like to say that if the developers changed these two things (the slider, and the sub-par food database), as well as the lack of reasonably priced/attainable ingredients in their in-app recipes I would be willing to give the app another try and probably rate it 5 stars, but until then I’ve got a year long subscription to an app that I can’t use properly.I’ve used several health apps over the years and  thought I’d give this one a try after seeing an ad. I was prepared to potentially waste $40 if it wasn’t as good as it appeared. Aaaand…  It’s not. I found the process to track food cumbersome. The barcode scan didn’t work on a single food I tried and many foods weren’t found in the database at all, so I had to manually enter the macros. No ability I could find to copy a meal, so I had to go through the same annoying process of entering each component of my breakfast every morning. After Day 3 of that, I’d had enough. Other features, such as weight and exercise tracking, were difficult to navigate to and set up. Nothing user friendly at all about this app. $40 blown. That they don’t offer a 7-day trial should tell you something. 

There are far better options out there, so I’d suggest googling “best health and fitness app” and reading a few articles to find one. That’s what I did and found a far superior option for about the same investment. 

Oh, and I find the responses BetterMe gives to critical reviews here annoying. Don’t blame the reviewer, folks; make a better app.While I want this app to be great it is not. It looks pleasing to the eye but the ease of use is poor. The calorie tracking is off, they offer you recipes with the option to press “log” but pressing that does nothing. You still have to manually log in the meal. It’s very frustrating. I like the fitness training portion of it but it’s not guided by voice or ANYTHING. so you have to stare at your screen to see when the time is up and you move on to the next exercise .rearing your neck around to check the time is counterproductive. Plus you have to manually press next through a lot of the warmups . So basically you kind a need to hold your phone or have it so close because you need to touch it to proceed. I’m super disappointed . I paid 60$ so I’m using the app but most def using Lifesum app for my food calculator. If they could make the fitness portion guided, and update the food tracker to reflect the content that they put into the app logging wise it would make this app much better and user friendly. The exercises are good and I do feel like I’m getting a good workout. Also the recipes are good too.I’m torn between at 2 or 3 star rating. I purchased 3 months worth of this app and would not recommend paying for it. The first week I used the app I liked it a lot but as I realized some of my expectations of myself did not fit with what I was actually capable of doing I found I was not able to adjust my plan. I could edit my profile but my plan stayed the same and this discouraged my desire to continue using the app and keeping up with streaks. 
I also found it frustrating that i paid to use the app and then also was expected to pay to participate in challenges. 
I loved the menu and diversity of meals suggested but the pictures don’t match the recipe and the recipes are so basic that they were hard to figure out exact how to cook something. Also, once again, I was unable to change the way it had set up my plan so that it fit what I actually needed. I also was unable to save or find meals that I had made and wanted to make a second time.
I like the idea of the app but it definitely needs some work.I haven’t been using this app for too long so I don’t think I’ve seen all flaws if there are any. But I think it’s great, I love the quizzes to give on nutrition and exercising. There is one thing, the tracker to see how many steps you take is great. Although I’m not sure if it’s tracking when I’m driving as well. I don’t know if it knows when you’re going too fast and that you’re not walking, but if it doesn’t I wish you could turn off the tracker temporarily or be able to edit the number. But besides that this app is great. 
Edit: Like I said this app is great but then apparently I’ve been using premium features I guess? I don’t know but all I know is that I’ve been tracking my calories, water in take, doing quizzes and getting my steps in. Then I open the app today on home screen and it said get premium and it won’t let me access the home page. So I can’t use anything without paying and I’m not paying so I guess I’ll just delete the app.I’ll start from the beginning ….. I saw the ads on FB and read a lot of positive reviews, so I went ahead and downloaded the app and sighed up for 3 months to start. 

At first, everything seems to work great, great motivational articles, user friendly calorie trackers, vast selection of workout options. Until day 15, I opened the app and realized all my previous logs were gone! I closed the app and reopened, and made sure I was signed in, still there was nothing… I double checked my online account, it showed my previous two week workout time records, but nothing else… I reported the issue, a week has passed, no one even got back to me.

In the meantime, I didn’t want to loose the exercise momentum, so I started from day 1 again, but adding a few other routines through the app’s large pool of workout sessions. However, today I realized, after a long sweaty full cardio session, that the app did not log my workout minutes… (yes I was following the session found in the app). I went ahead and tried to manually log them in, the app would not let me (tried countless times)

I personally value the tracking feature in a workout app more than anything else. As an exercise newbie, I rely on looking at the progress to keep me motivated, but unfortunately I cannot trust this app to do even that….There are nice features in this app from the targeted fitness, reminders for water intake, timers for fasting, and calorie tracking.
Water intake, steps, weight tracking are all available in the health app so nice it’s in one space but not novel. 

The exercises aren’t daunting or coming with mega changes to the schedule to be a turn off. 

However, I initially got the app for the meal planning and recipe suggestions. It was (WAS) good, if not great, with a list of all items in the recipes planned for the week, low cal yummy choices picked from a list so I could avoid foods I don’t eat and the ability to switch options at meal time (if day you planned to eat soup but would rather have chicken.). 

BUT the developer decided the variety, options, shopping lists and substitutions were not necessary anymore. I feel like I’m in a box and have no purpose for the app. In trying to change habits and for the two weeks I had the “old” app with the flexible meal plan, I was making progress but the new plan keeps offering fish- which I don’t eat with no options so I’m now standing in front of the fridge trying to decide what to make. There are no longer options, substitutions, or planning tools. Good luck if you don’t have the odd single serving ingredients on hand, because you are not going to be able to use this app.I’ve only had the app for a day, but I’m extremely disappointed with the food tracking and step tracker. I tried scanning a riced cauliflower dish and a Healthy Choice meal, neither of which was a known barcode. When items did scan, it wasn’t scanned to the serving size. Lots of guesswork to figure out the ounces in an egg or slice of reduced fat cheese! I’m not sure how much time I’m willing to invest just to ensure my calories are accurate on this app when I have another app that has such a vast database my local grocery store deli items in it. Maybe this app assumes everyone has a food scale?  
Also not impressed that step tracking and exercise tracking isn’t done by using a fitness watch. I certainly don’t carry my phone with me 100% of the day and ended up over 3K steps short of what my watch tracked.I loved this app for the workouts, calorie counting, and measurement tracking. I actually lost 27 pounds using these features. I hate that they have now added mental health and meditation features to my Home Screen and daily checklist which they will not let me remove. Those kinds of features are not why I got this app and they should be optional. I have stated this in several ways and they added more instead of giving me a way to remove them from my personal program. I fully understand that those things are needed and wanted by some but they should be added to your daily program by choice, not put on your checklist without an option to remove. I have canceled my subscription and will be deleting the app.This app has the potential of being great, the workouts are amazing but everything else is below average when compared to other apps. Tracking your meals is ridiculously difficult, I ate a chicken cutlet wedge today for lunch but you cannot find exactly that, or the Caesar salad I ate it doesn’t show simple options. I don’t like using my phone for workouts so I use the mirror options to my TV but this app doesn’t allow this option or at least it doesn’t work. Also, there’s no voice that tells you what’s going on in the video so when you’re doing your 30 second workout you constantly have to lift/turn your head to check the time, sometimes I would still be doing the workout and the app had moved on to the next one without notice. Disappointed.The workout offers and all the calorie tracking and everything is great, has amazing useful potential but it’s so laggy and buggy.
I have a brand new phone, updated all the way, on good wifi but it freezes up at almost every command.
Start workout-says I can use full screen mode, I try to x out, doesn’t respond, press it a few times, no response, finally turn screen rotation on, turn phone, video starts over 4 times on itself like it was finally responding to the clicks prior but it’s stuck on the downloading workout screen.
Try to log calories, type in food, click option, doesn’t respond, wait awhile, nothing, click option again, no response, then it responds over a minute later, lagging opening and closing the last command.
Exiting and retuning to app sometimes gets it working but that shouldn’t have to be done everytime. 
I paid for a workout plan I can’t use it on such a buggy app.So many great things all in one place - love the concept.
My current focus is tracking calories. It’s kind of a mess. I could handle the annoying redundancy of the different options, for a bit. Then noticed that my calories were different each time I logged in, something was resetting my calories on food already entered. So tedious. 
Additionally. I bought it for the wall Pilates work out that were advertised on social media…only to find out there were very few actual workouts of that kind. A little bummed.This works well if you are just tracking your own info, but they don’t have an option in the meal plan to avoid certain things. I cannot eat most seafoods and even though I put it in, seafood is almost daily in the meals. You can’t track your measurements besides weight. They have normal workouts free, but every single challenge costs a couple bucks. If you eat a food that isn’t on their list you have to reinput it every single time you eat it because it doesn’t save. 
This app works, but there are better onesI would not suggest buying this app for any help with nutrition . I bought the 28 day challenge and the calories that app suggested ve their coach recommended were really far apart when I reached out to coach and let her know what I ve been eating she suggested the calories were a lot .. and they took so long replying to your queries that after a certain point you loose interest. 
The 2 stars are for tracking they have great trackers and their database cover all foods including Indian meals which most of the apps don’t doI have been using this app for 2 months. It is great regarding the exercise and tracking your meals. However, I choose my meal plan by mistake while trying to navigate the app the first time I tried to use it then I tried to change it I could not. I tried to communicate with the developers many times through the chat option but no response since last month. I hope with this review I would get my answer!!!!!I wanted to like this app, the exercises were well organized. However the meals generated are way to out there, the menu it makes has you buying so many random ingredients. There should be a way to have it batch foods together so you can reuse ingredients weekly. But the killer that made me hate this was the search engine for tracking meals has no database practically. It only lets you enter food in ounces and can’t calculate calories for anything. I’m just sticking with my old meal tracking app. The subscription for this is too expensive.I’m finding that this app is not easy to use with  the barcode scanner and tracking food. No matter what the serving size is on the package, the app scans the serving size as 3.53 ounces. It can’t be changed! How the heck am I supposed to figure out how much 2 tablespoons of pancake syrup is to be? And that’s not the first food I’ve brought up that I’m having the same trouble on. The more I fiddle with this the more I regret my subscription.
The positive is that it’s easy to track water, steps and exercise. Please add size options for food.Started the free trial 3 days ago. On day two, the reading suggested I try their meal plans at a low price of $15 for the first month. 

I’m in it to win it, so I accepted… only to find out I already had access to the meal plan with my free trial??? And I’m not wowed by it. 

Requested refund twice. Haven’t heard back.

I also lost all my “progress/tracking” from my first day. All calories, water, steps, exercise—gone. Tried logging in online in hopes my progress was saved there—no. 

I want this app to save me time. Not take more time away with these irritations.

Concerned of wasting my time logging meals and water and exercises again if it’s all going to disappear. The app is attached to my email. It should save.

2 stars because I do enjoy the exercises.I am generally enjoying the layout of this app and the way I see my daily plan. The food logging needs major improvement. Why are ounces the only serving size for so many foods? I’m doing a ton of guessing because I can’t choose tsp or Tbl. Also, tracking water is part of my daily plan, but when I select it I’m asked to pay extra to get it? Lame when I’ve already purchased a 12 week package.For the price paid the macro tracking and calorie tracking should be much better than it is. The app doesn’t allow you to change the weight scale (grams, ounces etc) or select other options to track food.  Not a good app for tracking diet. Also, there are tons of other apps that don’t require additional purchases to access workouts. I would not buy again and do not recommend this app for purchase.I had the app, I got rid of it. I don’t need all the meal and calorie tracking. I don’t need a plan or program. I just wanted the wall Pilates exercises and you can’t get that with paying money for a bunch of junk I don’t need. Make those basic exercises their own app or free or a flat not exorbitant amount and use this whole app for people who want more or want a subscription!i was loving the app until it told me i could no longer use the daily water-tracking and meal tracking. it said i HAD to pay for the premium to get those which is absolutely ridiculous. uninstalling because that’s what i wanted it for. other then that i liked the workouts even though they were very easy and the meal and water tracking was great until i could no longer use itI’ve had this app for a few months at this point and I was really liking it, because I used it mainly for workouts (food tracking isn’t worth it). 
I think it just updated or something because it’s arranged in a much more complicated way and I can’t even tell what workouts are in what plan or which ones I’ve done already ! 

It was pretty much fine before : (",0,"Maybe 3 stars if it were free.Great idea, poor executionMeh. Not worth itDisappointingThe more I use it the less I like itIt was okay but now it’s notIf you want accountability, this app is not it…Good til it changedNot worth the purchaseDisappointed with changesGood idea but...What is wrong with this app?Lots of potentialHonestly, there are better apps2Not to easy to contact or chat with the developersNot worth itNot easy to track foodSo Far, A Time/Money WasterFood logging is cumbersome, why pay extra for water tracking?Could be much betterJust a simple free exercise program pleaseWhyUnfortunate update",MomwithlittlepeopleVeroFromMOSharchen NorbuBlongirl220Songifjoy89Brianna8362728RR.C 2005Ran3000Mitch Wimmdancing4duckyJesus GualarioAnwar ChowLindzMKtinkerbelle1998Samu 0987654321HalsultanTeetsie1985Flowergirl63dhKahKahhT3reeseV00D00796glendalemomGianna DiPiazzaMatilde Steck,BetterMe Health CoachingBetterMe Health CoachingBetterMe Health CoachingBetterMe Health CoachingBetterMe Health CoachingBetterMe Health CoachingBetterMe Health CoachingBetterMe Health CoachingBetterMe Health CoachingBetterMe Health CoachingBetterMe Health CoachingBetterMe Health CoachingBetterMe Health CoachingBetterMe Health CoachingBetterMe Health CoachingBetterMe Health CoachingBetterMe Health CoachingBetterMe Health CoachingBetterMe Health CoachingBetterMe Health CoachingBetterMe Health CoachingBetterMe Health CoachingBetterMe Health CoachingBetterMe Health Coaching,0,1,0,0,0,1,24,0,0,0,3487,has_tracking,74
