rating,flair_sentiment,date,developerResponse,review,isEdited,title,userName,App_Name,has_leaderboard,has_challenges,has_points,has_badges,has_feedback,has_social,has_tracking,has_goals,has_narrative,has_collab,word_count,Element type,Mentions
3,neg,2023-08-12 12:24:382023-11-13 17:54:172023-01-22 21:59:23,"{'id': 38374860, 'body': ""Hello, and thanks for the feedback! That's a real pity to know about your experience. You may always manage your daily training in accordance with your current needs. So please go to your Profile and change your focus zones there. Also, ensure to stay logged in to the app with your correct credentials to see your personalized plan. Otherwise, it can show you another one not quite suitable to your initial requests. For more assistance, please reach us at gethelp@betterme.world. \nUPD: We still cannot find your email request with details. Have you lately sent it to the BetterMe team by email? Our squad is here to always help you. Best Regards, Team BetterMe"", 'modified': '2023-08-18T08:11:05Z'}{'id': 34452239, 'body': 'Hello!\nThank you for your feedback! We genuinely appreciate you taking the time to post it, and we will be happy to be of your service.\nThe application is user-friendly, and all tools are intuitive in their usage. Still, we have plenty to say when it comes to all the app functions, and we will be glad to assist you with any information, guides, recommendations, or answers to your questions.\nPlease reach us at any time via gethelp@betterme.world, and we will not let you down!\nKind regards, Team BetterMe', 'modified': '2023-01-24T08:48:53Z'}","Workouts are mostly great. It helps to hear and follow along without having to stare at the phone for what’s next and when to transition; however, there are a lot of errors. The app should allow for quick feedback by workout because it’s weird when you are doing a completely different exercise based on audio than is demonstrated on video, or you do the same exercise multiple times on the right as instructed thinking you’ll come back to left and never do, etc.  Also I purchased the 30-day toned tummy challenge for $4.99…has no narration that explains the move and no transition warning, so unless you are staring at the phone, you cannot follow along with ease.  Haven’t seen enough at home fitness that caters to the use of just hand weights. Many at home workouts refer to equipment needed like machines (or two) in a gym. Have to click on each workout to see what I can do with the equipment I have at home.  I tried to use it for food tracking but felt like other apps had better functionality.  Also responsiveness to questions is the worst I’ve seen. Then when they finally respond, you’ve moved on to something else. At this point, I could use great workouts and device connectivity to other popular apps.Where are used the app to schedule workouts and put it on a family shared calendar. But it did not put it on my person. So I got a message from my sister Who lives in another state, Asking me what it was. but when I look on my calendar, it’s not there at all. So there’s some kind of glitch to be worked out with the Calendar scheduling aspect of the app. I’ve only used it one time so I don’t have any other feedback right now.I am not good with working with these things, my phone is smarter than me and I don’t know what I’m doing so you can’t really use my Feedback. Is there somewhere that tells me how to use this if there is I haven’t found it and this is new for me so I am just starting a, I purchased the subscription two or three maybe four days ago and I’m just now really looking at it.",0,Workouts mostly great but service is badWrong CalendarFeedback,TIK96CRYSTALM00NShell46!,BetterMe Health CoachingBetterMe Health CoachingBetterMe Health Coaching,0,0,0,0,3,0,1,0,0,0,382,has_feedback,21
5,neg,2020-08-27 17:02:28,"{'id': 17575878, 'body': ""Hello, thank you very much for your feedback. We are sure you'll achieve your fitness goals with the help of the BetterMe app! Have an awesome day - Team BetterMe"", 'modified': '2020-08-29T19:40:38Z'}","It was really troublesome for me to work out regularly for a very long time. I work extra 20 hours or even more every week, it was really difficult to fit a full-blown training session into my daily schedule. It became the least important priority, and I regularly skipped training instead of regularly exercising. This app was a game-changer for me. There is no way I don’t have 15 minutes to train every morning. Plus, the workouts continuously change so I don’t get bored. I usually like to go at my own pace, and it seems to me that the system in the app motivates you to push harder, but it is not a problem at all. I measure my changes each week, and I can say that I got much leaner than I was a month ago! It is actually much easier to extend your sessions once you get used to the short ones. I think my friends don’t want to hear me talking about this app any more as I do so much, but it really is that good. Try this app, you will be surprised how easily it fits into your routine! I guarantee you won’t regret the dollar spent!",0,An App for those lacking time,Jenni Foster,BetterMe Health Coaching,0,0,0,0,1,0,0,0,0,0,203,has_feedback,21
1,neg,2023-08-05 23:31:402023-10-25 16:13:312023-08-01 15:52:172019-09-02 14:32:472018-01-04 03:22:412018-04-09 03:40:452019-05-12 20:14:522018-04-09 05:19:402018-05-12 16:37:462018-11-29 13:58:112023-10-03 23:39:59,"{'id': 38157169, 'body': 'Hello! We apologize for the inconvenience. Please be kindly informed that we have found your request - please check your Inbox for details. We will be looking forward to receiving your reply in order to assist you further. Kind Regards, Team BetterMe', 'modified': '2023-08-08T03:36:54Z'}{'id': 39778152, 'body': ""Hello. Thank you for reporting this case and providing us with detailed experience. Let's try to check your profile and understand what has gone wrong. Please get in touch with us at gethelp@betterme.world, and our team will check all details for you. Kind regards, team BetterMe"", 'modified': '2023-10-27T12:40:07Z'}{'id': 38072357, 'body': 'Hello. Thank you for leaving your comment. We did not intend to cause any inconvenience to you. So, if you still have not received any direct reply from us, please, contact us directly at gethelp@betterme.world. This way, we will find all your previous requests and get back to you with a reply soon. Kind regards, team BetterMe', 'modified': '2023-08-03T09:52:59Z'}{'id': 10327723, 'body': 'Hello, We are sorry for your unsatisfactory experience with BetterMe app. \nOur support email is support@betterme.tips  \nBest regards, Team BetterMe', 'modified': '2019-08-24T04:37:29Z'}{'id': 2275263, 'body': 'Hello!\n\nWe apologize for any issues you experienced while using our app.\n\nBe Well!\n\nBetterMe Team', 'modified': '2018-01-11T18:44:01Z'}{'id': 3081312, 'body': 'Hello,\nPlease accept our apologies, we were experiencing some technical troubles. If you’re having any difficulties with running the app, please close it and then re-open it.\nWe will make sure this doesn’t happen again.\nThank you for your patience and support!\nBest regards,\nTeam BetterMe', 'modified': '2018-04-09T21:37:05Z'}{'id': 8641461, 'body': ""Hello,\nWe are very sorry for the inconveniences, as well as for the delayed reply. However, our users are informed that in case of choosing certain subscription types, the funds are deducted all at once. \nPlease note that subscriptions are cancelled through iTunes/Apple account settings, not through the BetterMe app. And here is the link to Apple's billing (refund/unsubscribe) requests: https://support.apple.com/billing.\nBest regards,\nTeam BetterMe"", 'modified': '2019-05-13T10:54:20Z'}{'id': 3081291, 'body': 'Hello,\nWe were experiencing some technical troubles. If you’re experiencing any difficulties with running the app, please close it and then re-open it.\nWe are very sorry for the inconveniences and will make sure this doesn’t happen again.\nIf you’d still like to discontinue your subscription, please follow this link https://support.apple.com/en-us/HT202039 and find all the information on managing the subscriptions billed through Apple.\nIf you would like to request a refund through Apple, please find more info via the following link: https://www.imore.com/how-to-get-refund-itunes-app-store.\nWe hope that this  information is helpful!\nBest regards,\nTeam BetterMe', 'modified': '2018-04-09T21:33:35Z'}{'id': 3115173, 'body': 'Hello, Please accept our apologies, we had some technical troubles. Things should work properly now. If you’re having any difficulties with running the app, please close it and then re-open it. We are sorry for the inconveniences and will make sure this doesn’t happen again. Thank you for your patience and understanding! Best regards, Team BetterMe', 'modified': '2018-04-12T13:40:27Z'}{'id': 6184217, 'body': ""Hello,\nPlease try re-installing the app and/or checking that the app version has been updated. Things should be working properly now.\nWe are sorry for the inconvenience, and we thank you for your patience and understanding!\nWe hope you'll enjoy working out with our app.\nBest regards,\nTeam BetterMe"", 'modified': '2018-11-30T16:25:59Z'}{'id': 39346057, 'body': ""Hello! There is no technical possibility to charge the account if the subscription is canceled. Still, we can see how frustrating it must have been for you. We do our best to satisfy our clients' needs! Would you kindly reply to this review with the 7-digit number of your e-mail? We will try to fix it straight away! Will be waiting for your reply! Kind Regards, Team BetterMe"", 'modified': '2023-10-05T18:18:19Z'}","After trying the trial out for a few weeks I actually enjoyed the exercises offered. The meal plans were stupid. Nothing else was useful to me. Any additional workouts were pay only to access. 
I didn’t use it for the past few weeks due to crazy work schedule and yesterday I was hit with a $50 charge for subscription fee. No warning at all my trial was ending. A simple email received after they already took my money was ridiculous. And heaven forbid you actually want customer service to give a crap. They have been fighting to keep my money even though it was only hours after they took it that I tried to cancel the service. They offered to give me six months free then offered me half my money back! I want all my money back and I don’t want their service if this is how they treat people! Go read comments on their social media! I wish I had read it before I tried their app. Sleazy business practices! I’m going to keep raising awareness about this issue until they give my money back! Shame on you guys for doing this to people! We’re all trying to better our health and your just stressing us out!I was scrolling on social media and I came across an ad for this. It made it seem like you can do all of this on your own terms and log on your own time. I had paid for one month. When I finally had time that week I went to the app and I was forced to go to a chat with a private trainer.. I wouldn’t mind if it was just a chat you had whenever you had questions or they occasionally checked in on you, but for my experience, I had to go through the chat first. Once I had dealt with that, I had to log what I ate before I could go to the workouts. I hadn’t eaten much and from what I remember didn’t have much to log. By the time I dealt with that (along with multitasking other things) I didn’t have time for it. This happened a few times. I just decided it wasn’t worth it so I canceled my subscription and got rid of the app. Guess they remembered my card cause I got charged for another monthly subscription and I can’t log in on the app. So if you’re like me and you have no time, and don’t want to have to talk to a trainer before the workouts then don’t get it. Y’all do you though. This is just my experienceI joined better me based on an ad on social media showing a 28 day wall Pilates challenge. App on sale, money back satisfaction guaranteed. Once the app was downloaded I was participating in a 28 day summer body challenge. I reached out to customer service explaining the mistake. I did get a response that my program has been adjusted. When I logged back in I was participating in a Wall Pilates for seniors program. So I reached out again. NO RESPONSE. Tried again a few days later. NO RESPONSE. Sent a separate complaint that I’m not getting any response. NO RESPONSE! I canceled the subscription immediately and requested my money back. And shockingly I have received NO RESPONSE!!I wasn’t even able to try out the app due to a glitch of some sort. After entering my weight/height/etc., I received an error message requesting me to check my internet connection. All apps on my phone worked, so I proceeded to restart the app, restart my phone, and delete and re-download the app. Nothing worked, I received the same error message every time. There is no FAQ or easy to access team to reach out to in order to help fix this issue. I actually had to dig around a bit to find the app help team to contact.
*Update*
No response via email. After app update, the same problem persists. For an app that collects money weekly, I would expect better.I loved the three day trial. But that was it! I decided to go ahead and pay the $10 to try the rest of the month and it keeps giving me a message saying ""lost connection"" when all of my other apps work perfectly fine. The day that I start giving them my money the app crashes. Go figure.

I did figure out how to unsubscribe (no thanks to the directions they give) 
** you will have to go under 'settings' >>'iTunes and app store' and click on your Apple ID. There you can manage your subscriptions and get rid of it forever!!!!!Ok, I was EXTREMELY excited about the app when I downloaded it only two days ago. I completed my first workout yesterday and it was fantastic. I go in today to complete day two and I keep getting the Lost Connection error and it will not open one program, as this constantly keeps popping up. There is absolutely nothing wrong with my WiFi nor my cellular data and all of my apps are functioning properly, excite this one. I am very disappointed and now very happy that I did not purchase the program.The subscription selection screen is grossly misleading on this app. They tell you you can pay $2.75 weekly or $29 monthly, so I selected the weekly option. However, they make is grotesquely unclear that they are going to, in fact, bill you $119 in one lump sum. I contacted the developer twice via the “contact us” (LOL) page on their website AND I sent them a DM on their social media pages requesting a refund and  I GOT ZERO RESPONSE. This subscription selection method is broken and a scam looking to rip people off. (PLUS YOU CAN FIND ALL THESE WORKOUTS FOR FREE ONLINE. SAVE YOUR MONEY AND JUST USE GOOGLE/YOUTUBE)I was not able to connect to Facebook not see any on the content in the site. It keeps saying that can’t find internet connection and not able to get my Facebook info for profile. The apps also tells you that you can have the option to create a profile but that option is nowhere to be found. I believe in paying to experience the full features but it just not worthy when I’m not able to use this app after 1 hr of trying. Requesting a refund for this.Update: The developer response was
“Hello, Please accept our apologies, we had some technical troubles. Things should work properly now. If you’re having any difficulties with running the app, please close it and then re-open it. We are sorry for the inconveniences and will make sure this doesn’t happen again. Thank you for your patience and understanding! Best regards, Team BetterMe""

I’ve received this response a month after I bought this. Thank you for confirming why I’m not subscribing for your app again.

——————————————

WHATS WRONG WITH YOUR APP?!?! I can’t get past day 4 because it’s says no network connection? I had to reinstall twice and start over twice and all three times I can’t even through a week of workouts? I paid money for an app to not work?I signed up for the free trial before I invest that kind of money. The workout screen said I had no internet connection, even though I did. The food page said to make an individual profile it took me to the profile page where I had already filled out my profile. It wouldn’t let me save my profile other than to connect to my Facebook which it also said it couldn’t connect to. I’m glad I didn’t spend the money upfront. Wasted so much time trying to get it to work.BEWARE.  Even if you cancel the subscription in apple, they continue charging your credit card.  Additionally, customer service completely ignores you.  Having to cancel credit card to get rid of these guys.  Apple, you should do something about this app!!  I will continue to write this review on every social media and ad I find you advertising on.",2,Don’t use!!!Don’t getTotal rip off!! Don’t use!Broken App *updated*Terrible!Frustrated/Constant Connection ErrorSubscription SCAMHorrible experienceI’m sure the exercises would work well if the app workedCouldn’t do anythingContinues charging credit card even when cancelled,LoraLeeArtistOnly_HannahNO RESPONSE!!!bellyfyderFrustratedmexKitaWatmissshelleybeeJessPaganJcjsknxvlathem45$#@,BetterMe Health CoachingBetterMe Health CoachingBetterMe Health CoachingBetterMe Health CoachingBetterMe Health CoachingBetterMe Health CoachingBetterMe Health CoachingBetterMe Health CoachingBetterMe Health CoachingBetterMe Health CoachingBetterMe Health Coaching,0,0,0,0,0,11,0,0,0,0,1360,has_social,24
2,neg,2023-08-04 19:55:532022-12-06 12:00:172023-04-25 05:02:112023-08-02 00:57:122023-07-02 15:53:262018-04-11 23:29:46,"{'id': 38152539, 'body': 'Hello! We take full responsibility for your experience and hope you accept our apology, we have lots of customer requests at the moment. There are two ways we can proceed. You can reach out to us with a request at gethelp@betterme.world, or, alternatively, if you have already contacted us via email, please send us a 7-digit code from the auto-reply here. Kind regards, Team BetterMe', 'modified': '2023-08-07T20:58:54Z'}{'id': 33592422, 'body': 'Hello! We appreciate your detailed feedback on our workouts. We would be happy if you could email us at gethelp@betterme.world. Our team will gladly give you a few tips on app usage. Do not hesitate to reach us. Kind regards, team BetterMe', 'modified': '2022-12-07T15:47:07Z'}{'id': 36182640, 'body': 'Hello! Thank you for your feedback. We would really like to help you. Please, contact us at gethelp@betterme.world when you have time. We will do everything to improve the whole situation and share any required pieces of advice on app usage. Kind regards, team BetterMe', 'modified': '2023-04-26T11:42:35Z'}{'id': 38073805, 'body': ""Hello. We appreciate you sharing your concerns. We'd like to explain how the app works and how you can follow your plan to keep fit and achieve your goals. Please, contact us at gethelp@betterme.world, and our team will get back to you with advice soon. Kind regards, team BetterMe"", 'modified': '2023-08-03T10:57:16Z'}{'id': 37486984, 'body': ""Hi! We have created a plan based on your preferences, goals, and parameters, both current and desired ones. The 'Training' tab has a library of many different workouts you may want to try as alternatives. Please, reach us at gethelp@betterme.world. We will gladly share the detailed steps on how to use the app to its full potential. Kind regards, team BetterMe"", 'modified': '2023-07-05T13:55:33Z'}{'id': 3115111, 'body': 'Hello, if you’re having any difficulties with running the app, please close it and then re-open it. We are sorry for the inconveniences as we had some technical issues. Thank you for your patience and understanding! Best regards, Team BetterMe', 'modified': '2018-04-12T13:35:56Z'}","OK so the customer service number one is nonexistent they sent you emails that they received your email however, it’s automated. There is a coach that chat with you but their automated. There’s no connection with anyone there. I’ve asked for a refund however they have been nonresponsive I did follow through with everything I needed to do within the program. Because I truly truly believed in the app. However, fasting requires a little bit more information. I should’ve done my research, so yes, that is my fault. However, now they are not standing up to their promise of refunding you if things did not work. I hate leaving negative reviews because in reality you don’t know who’s telling the truth or not. But I have the proof and I have receipts. I will post this on social media. With the receipts, the emails and the interaction that I’ve had with the coach. And allow everyone to be the judge. I have not received a response yet. Very sad and disappointBeing a movement teacher I’m always looking for new ways to continue my own training and education. I like the idea of this app, but 1. I am distracted by the looping jumps in the videos (not sure why they couldn’t video for the whole 30 secs). 2. The overlaid music tempo does not match the movements.( I want to feel motivated by the music and able to match the model’s pace.) 3. Some of the directions do not match the movements being shown. (“Move your arms as if jogging”, but the model’s arms are still.) 4. The model is facing the camera, but they do not mirror the verbal instructions. (So when she goes left it’s to your right.) 4. The video directions leave out any tips for how to remain safe, or have proper alignment. I fear someone is going to get injured. (You may find some in the written directions, but they are not thorough, nor always correct, from what I’ve learned elsewhere.) 4. There’s no connection of breath to your movements in the videos.So many great things all in one place - love the concept.
My current focus is tracking calories. It’s kind of a mess. I could handle the annoying redundancy of the different options, for a bit. Then noticed that my calories were different each time I logged in, something was resetting my calories on food already entered. So tedious. 
Additionally. I bought it for the wall Pilates work out that were advertised on social media…only to find out there were very few actual workouts of that kind. A little bummed.Decided to give this a try based on social media ads (the ones that said “my friend decided to cancel her gym membership and do this instead”). 

Don’t cancel your gym membership. Haha. The program wants you to be active enough to burn 790 calories a day but their workouts only burn like 40-60 calories. So this is not something you do instead of the gym. You still need the gym. 

I was looking simply to change up my workout routine, but this was not for me. I only lasted a few days because the workouts felt more like just stretching and not working out at all. 

Ok app if you’re looking for somewhere to track activities, food, water, etc but not as a workout plan. If I’m unlocking workouts daily, they should cover my full calorie burning goal for the day (or at least way more than 1/10 of it!).I am an active person and was until recently when i started to have knee problems. You take a quiz so they should have a pretty clear idea of your category. There is even tab to check for knee problems but in all the wall yoga and other exercises there is NO modification for bad knees. This app may be good for an inactive person looking for a regiment but not someone that is active. I was once again reminded not to believe the hype from social media and get taken $.I feel like this would be a great app just by looking at the overviews and that I would really
Enjoy it but I cant never seem to get it to work. Every time I try to start a program it keeps saying I don’t have connection and every time I open the app it makes me fill out all the info all over. Every. Single. Time. All my other
Apps that require internet seem to work fine except this one. Please see what’s wrong so I can enjoy this",0,"Not very helpfulCould be betterLots of potentialOK tracking app, not great workout programBasic. Basic. No mention of modificationsFix it please",Simplyfemme1369bnb8!LindzMKNicole 83 BCheffruannabri19,BetterMe Health CoachingBetterMe Health CoachingBetterMe Health CoachingBetterMe Health CoachingBetterMe Health CoachingBetterMe Health Coaching,0,0,0,0,0,6,1,0,0,0,772,has_social,24
