rating,flair_sentiment,date,developerResponse,review,isEdited,title,userName,App_Name,has_leaderboard,has_challenges,has_points,has_badges,has_feedback,has_social,has_tracking,has_goals,has_narrative,has_collab,word_count,Element type,Mentions
4,neg,2023-10-19 13:33:532022-05-16 12:19:372021-06-27 15:40:002021-12-08 01:18:022023-08-28 23:39:092021-08-05 13:21:402023-08-10 21:42:592020-03-04 00:51:50,"{'id': 29812261, 'body': 'Hello! We are so happy that we have found a proper solution for you. Your cooperation means a lot to us. We wish you the best of luck in achieving great results and will keep our fingers crossed. And a separate thank-you for inspiring our team to work even better and with more dedication. Kind regards, team BetterMe', 'modified': '2022-05-18T07:37:56Z'}{'id': 23637897, 'body': 'Hello! Thank you so much for such wonderful and detailed feedback! We appreciate reviews like this the most, as you help us improve the app, and you point out what would you like to see improved so precisely 😍 Please, keep us updated about your results. Good luck with your journey! Kind Regards, Team BetterMe', 'modified': '2021-06-28T19:28:29Z'}{'id': 27827651, 'body': ""Dear Matt, thanks for sharing your concern with our team! There was no intention to mislead you in any possible way as our user. We are always open to cooperation. We'll have a look at this point with reminders, appreciate your effort!  However, it could be just a coincidence to notice the same word that you have mentioned yourself beforehand. Generally, the main idea of pushes is to stimulate you to follow your daily fitness and meal plan as well as other tools or services of the app. Please contact us at gethelp@betterme.tips and share more details if necessary! Best Regards, Team BetterMe "", 'modified': '2022-02-03T12:32:54Z'}{'id': 24432054, 'body': 'Hello! Thank you very much for your feedback. Do not hesitate to contact us at your earliest convenience. You can reach us at gethelp@betterme.tips and our team would be glad to answer your questions and listen to any suggestions. \nUpdate: \nWe are still looking forward to hearing from you back. All the best, team BetterMe', 'modified': '2021-08-10T19:29:23Z'}{'id': 13989902, 'body': ""Hi there, thank you for your feedback! We're really glad to see you enjoy working out with BetterMe. We are currently working on adding more meal options to the base. Stay tuned! :)"", 'modified': '2020-03-11T16:16:49Z'}","The app does an adequate job of helping you keep everything you need to track in one place for the most part. The calorie tracker is very frustrating and time consuming to use however. Simply adding functionality for it to automatically resurface items you’ve tracked before (many of us fitness folks are creatures of habit) like other apps do would go a long way. Instead, it only “remembers” the last 10 things you tracked and after that you have to start from scratch with a new search. Entering key search terms like brand name and item produces an at times seemingly random list of things with the same names and different calorie counts. It takes 3x longer to track a meal than it does with MyFitnessPal and a lot more concentration, sometimes even requiring me to look stuff up online and compare. I’m keeping the app for now because of the exercise program, but unless the tracking becomes a lot more user friendly it’s not a long term solution given the cost.I purchased this app in March! Yeah- amazing access to meals and workouts! I purchased the year subscription. Well something glitched and now I cannot log in. I have contacted the developer and they asked for ALL of the possible emails that I could have used to create the account. None are found. The next message- looks like you signed up and just need to fill out the profile… uhm, I cannot do that if I cannot log in. Please help. This is such a disappointment for weeks now!!! 
     I finally got ahold of someone who reset my account so I could log in. (After trying all the normal things: delete app and reinstall,reset password etc.) Although I lost all the data I was tracking daily- they finally reset my account- and challenge I had also purchased and they updated my renewal. They thankfully reset so I have a year access since I only used about a week- Frustrating at first but so glad they could help!Love the approach of exercise, steps, hydration and food tracking. All these together are giving me a chance at a better me. Loving the program so far. 

Reasons for not giving a 5 are, iPhone and IPad apps don’t work together. App should be device neutral-  Use the devise you have and have any activity or workouts sync up. 

Also app is a little buggy with playback of some workouts with no prompts or visuals. Just ticks down the time  remaining in the exercise. 

Also, profile asks for focus areas yet always provides the same types of workout recommendation even with all areas selected…Arms. I would expect that if more than one focus area was selected, that the recommendations would not always be arms. I don’t have the time to preview the possible workouts everyday to pick the one I want. Want the app to do that for me based on the focus areas selected. 

Lastly, scheduling reminders for workouts if setup, should also drive when workouts at suggested. I use the app to supplement Taekwondo training twice a week. I’d like to not get workouts on those days but the schedule doesn’t really do anything other than pop up a message. It should have those days as off in the suggested workouts. 

Overall, I plan to stick with this program. It has helped start to form some good habits even after 2-3 weeks.The app couldn’t be easier to use and I’m finding it a helpful tool in tracking my diet. 

The app has a mindfulness/psychology component which includes daily lessons that I’ve enjoyed overall. That said, I didn’t appreciate the fact that the app used my answers from yesterday’s lesson in an attempt to motivate me today: the app just sent me a reminder to work out that included the phrase “don’t be lazy!” I had answered on yesterday’s lesson that “lazy” is a word I use in my self talk. Just felt dirty and underhanded that the app was designed to take that information and throw it back at me in an attempt to motivate me.I have an eating disorder and I cannot track calories or meals. I wish I could turn on notifications for workouts only, and it would also be great if I could remove the calorie/meal tracking aspect all together. I really like the workouts, though, so I’m trying to stick with the app. I’m using my regular alarm to try and remind me, which is inconvenient.I wish it was more interactive like Noom, but you can’t beat the lifetime price of $28 for all these trackers and meals I never knew about. Tracking isn’t complicated at all. Hopefully in the future they add an included/free interactive educational platform like Noon to encourage you to reach your goals through facts etc. Noom was way too expensive that’s why I went with BetterMe. Lifetime subscriptions are awesome.I like the workouts offered, but the calorie tracking could use some work. The serving size for most of the items are ""serving size"" and ""ounces"". Most listings don't have options that may make more sense, like cup or tablespoon, etc. It would be really nice if that option was added.This app has good workouts and tracking system for tracking your steps, however it does not have a very wide variety of foods to choose from to log. Even when scanning the barcode of simple things,  the system can’t find them and it doesn’t seem to have very many options to pick from.",0,Decent but the calorie tracker is lackingUpdate/ excellent customer serviceLove this approach and program - app has room for improvementGreat app except for the underhanded remindersWish I could customize moreNot interactivePretty Good but Needs ImprovementsNot too bad,JuanitoElGatoTrimomsarahgln2012Matt ®️FoxsparrowShahmny24clarabear_808heibell,BetterMe Health CoachingBetterMe Health CoachingBetterMe Health CoachingBetterMe Health CoachingBetterMe Health CoachingBetterMe Health CoachingBetterMe Health CoachingBetterMe Health Coaching,0,0,0,0,0,0,8,1,0,0,927,has_tracking,74
4,pos,2023-03-01 16:59:192022-01-07 23:24:582023-05-21 16:00:14,"{'id': 35509268, 'body': 'Hello! Thank you so much for trying our app and for providing such a detailed review. Your suggestions are amazing! We are constantly working on improving the tools, so we appreciate the feedback. 💪️  \n  \nAs for the weight logging, there is an option to do it in the app:  \n1. Tap More → Statistics tab;\n2. Locate Log Weight button and tap on it;\n3. Enter the data and tap Save.  \n  \nShould you need further assistance, or if you would like to share more of your journey with us, please message us at gethelp@betterme.world. Have a pleasant day! Kind Regards, Team BetterMe', 'modified': '2023-03-21T16:30:37Z'}{'id': 27843471, 'body': ""Hi! That is so great to see you enjoy your experience to the fullest! What's more, currently there are even more fasting types, so hopefully, you'll find the best one for your needs! To make your BetterMe journey even more pleasant, easier, and funnier, our team has prepared lots of useful recommendations based on your goals. We will be happy to see your short follow-up email at gethelp@betterme.world. \nIn addition, you may always refer to our useful and informative Help Center at https://bettermesupport.zendesk.com/hc/en-us/categories/360003606438-Help-Center. We will take care of making your new adventure effective and consistent. Kind regards, Team BetterMe"", 'modified': '2022-02-04T08:39:14Z'}{'id': 37257003, 'body': 'Hello! We appreciate your feedback. We hope that BetterMe meal and workout plans will continue to be helpful to you. Kind regards, team BetterMe', 'modified': '2023-06-21T17:27:16Z'}","I’ve been using BetterMe app for over a week now. The encouraging words and overall platform is very user friendly. I’ve enjoyed the workouts, intermittent fasting, and especially the daily inspirational reads so far. I downloaded another fitness app to compare and see which one I’d like to stick with for subscription.

 The biggest thing that stands out is that BetterMe does not have an option for manually documenting your weight, and doesn’t have a lot of foods saved by scanning the barcode on items. Also, I have to spend a lot of time each day tracking down my regular food items since they get booted out of the Recent food selection. Logging daily calories should be easier than this. I like so many other things about the app and would happily stay with this product if they can provide an update on the weight & calorie tracking.This app make rethink how I feel about my body. It’s a help to stay focused on healthy eating and exercise. Fasting is a very new experience for me but I think that so far it’s just what I need. I do feel like I’m on my iPhone checking in on tracking meals, hydration, and reading articles too muchbecause I want to make sure I’m keeping up on everything I need to know to be successful at fasting.Recently downloaded this application. It gives me the sense of satisfaction on tracking my meals and gains. To be able to keep up with caloric intake, carb, protein, and fat intake as well. Keeps me focused on the overall goal of fitness way pass leaving the gym 👍🏿",0,"Great app, needs food log updatesGreat HelpIt’s motivation even after you leave the gym 👍🏿",BellaNa27Cabin@531Sincere S.,BetterMe Health CoachingBetterMe Health CoachingBetterMe Health Coaching,0,0,0,0,0,0,3,0,0,0,274,has_tracking,74
5,neg,2023-06-18 15:45:182023-09-18 12:36:10,"{'id': 37254614, 'body': 'Hello! Thank you for your honest feedback. Unfortunately, technical glitches can happen with any product. And we apologize that it took place. Still, we would really like to help you. Please, contact us at gethelp@betterme.world, and we will do everything to improve the whole situation. Kind regards, team BetterMe', 'modified': '2023-06-21T15:03:32Z'}","I joined the 28 day challenge because this looked like the best at home tool for me. The app looks great but I have had SSOOO many issues with it not tracking my workouts accurately, locking me out of workouts. Logged out hoping to fix and app deleted my entire history. I’m working on a better me and thought this was the app for me. Nope! Nothing should cause this much anxiety!!!!
When it works, I love the work outs. But since I’m one of those people who needs the calm, this app is causing frustration and angst.The account seems to have trouble being linked from phone to iPad or other device. Not tracking progression across platforms . Example phone says I’m on Day one, iPad says day 4, if I want to use the phone it wants me to complete 1-3 to open day 4. 

Am I missing something? I submitted email last week regarding this?",0,Not Better for MeIssue,Maddoghealth62Chris W1986,BetterMe Health CoachingBetterMe Health Coaching,0,0,0,0,0,0,2,0,1,0,158,has_tracking,74
5,pos,2022-03-13 22:33:432020-09-21 19:59:582023-07-23 23:18:582023-02-03 23:46:022021-09-20 17:34:572020-02-27 16:59:08,"{'id': 28582630, 'body': ""Hello there! We wish you could imagine how happy were are to hear such wonderful feedback 🤍\nOur whole team is cheering for you and can't but be grateful that you shared your personal experience and circumstances with us. We are so glad to be a part of your amazing story. And we congratulate you on having a baby. What an exciting period of life you have. If you feel like sharing more details, the BetterMe team always welcomes you at gethelp@betterme.world at any suitable time for you. We have so many tips to share to make your journey fun, safe, and effective, and ready to discuss any of your arising questions. Hope to hear from you soon. With warmest regards, your BetterMe team"", 'modified': '2022-03-15T10:47:54Z'}{'id': 18035698, 'body': ""Thank you for writing a review! We are sure you'll achieve your fitness goals with the help of BetterMe app! We sincerely appreciate you bringing this issue to our attention. We use your reviews as a chance to improve our business.We appreciate your input here, and think this is a great suggestion.\tHave a lovely day and stay safe! :)"", 'modified': '2020-09-23T01:07:14Z'}{'id': 34910574, 'body': 'Hello! Thank you for choosing BetterMe! We are happy to see you are enjoying your plan. Does everything work well now? If you have any questions, or experience any issues - we are always here to help, send us a message at gethelp@betterme.world. Kind Regards, Team BetterMe', 'modified': '2023-02-16T15:44:33Z'}{'id': 25249862, 'body': 'Hey! We treasure reviews like this one. Thank you for your support and kind words! \nAnd, the team has been working hard to improve the quality of the app including its Calorie Tracker. To get great tips on how to use it please check this link:\nhttps://bettermesupport.zendesk.com/hc/en-us/articles/360019399717-Can-I-Log-My-Own-Meals\nIf you ever need additional information, please contact us back at gethelp@betterme.tips. Best Regards, Team BetterMe', 'modified': '2021-09-22T10:39:37Z'}{'id': 13755326, 'body': ""Hello, thank you very much for your feedback. We are sure you'll achieve great results with the help of BetterMe!"", 'modified': '2020-02-28T08:38:52Z'}","I’m returning to this app after a year hiatus.

At the end of 2020, I decided I needed to focus on something other than Covid. My husband and I had been dealing with infertility for 10 years and I know I felt solely responsible. We had a talk about trying IVF and I decided that I was probably not at a healthy weight to be considered for it. An acquaintance suggested this app, so I downloaded it and hit the workouts and calorie tracking hard. I feel that I saw results pretty quickly and was super excited to be on the right track to healthy! Two months into using this app, I started looking into clinics that offered IVF. I didn’t need to though, because the same month I discovered I was pregnant. We welcomed our daughter at the end of October 2021. 

I truly see now how important my health is and I have this app and my experience using it to thank for my new outlook. I’m excited to take up where I left off! Thank you for the hard work you’ve put into this program! It has been life changing!!This is an excellent app for weight loss, tracking calories intake, water intake, as well as workout and daily steps. I am doing the 16hours intermittent fasting and amazed by the results in terms of weight loss! I honestly never imagined an app would keep me as motivated as I am today as I usually lose motivation when it comes to healthy cooking and prepping meals. This worked out well because It lets you select the time you want to spend prepping meals and the ingredients you prefer using, so the suggestions for the Keto plan I chose are working great with my schedule, similarly to the exercise portion of it. The only thing I wish was easier to do is the food tracking, I wish it had a feature to group food in a recipe so I can use it another day if I made this recipe again, also if it had a history of the most recent items I used or the ones I keep reusing. 
The last thing (and it’s not as important) but could be improved, is the ability to add fractions the your weight when you log in.I love how many options there are for working out. This app covers so many topics and options, from home workouts to gym, Pilates to HIIT and everything in between. I also love that they provide options for limited mobility and sensitive areas (like sensitive back, knees, etc.) 

This app also has a great filtering system so you can filter by muscle groups, time, and level of fitness. Even no equipment workouts. Makes it great for someone like me with little experience. 

This app also has calorie tracking and different programs for accountability and motivation. Overall I’m very impressed with this app and everything it has to offer.So far i love it!  Only problem is its not tracking my workouts. Probably something I'm doing wrong. I chose not to do the food plan or have trainers or have it notify me ect that  might be why. 
I do the wall pilates then respond with i could do more and more come up!  I do on average 3 more the last being a stretch or cool down.This app is awesome and super easy to use. I love the layout and all the motivational quotes and workout plans. The only flaw is the food tracking. It’s very confusing and not easy to use. That’s why I use another app to track my food but other than that this app is amazing.I have been using this app mainly for tracking my water intake and the workouts they offer. And I have definitely noticed a difference in my body shape and strength since using this app almost everyday for the past month. (I am following a diet plan but no through this app)",0,"SUPER EffectiveVery Motivating!Enjoying this app. Great for beginners.First weekGreat app, a few flaws.Great for the workouts",Laserchick3000Chaza85SABsGirlGoose annd Gromitmichjabortdcamppp68,BetterMe Health CoachingBetterMe Health CoachingBetterMe Health CoachingBetterMe Health CoachingBetterMe Health CoachingBetterMe Health Coaching,0,0,0,0,0,0,6,0,1,0,668,has_tracking,74
