rating,flair_sentiment,date,developerResponse,review,isEdited,title,userName,App_Name,has_leaderboard,has_challenges,has_points,has_badges,has_feedback,has_social,has_tracking,has_goals,has_narrative,has_collab,word_count,Element type,Mentions
1,neg,2020-10-15 08:19:082023-05-29 15:58:082020-11-15 15:05:472020-03-04 23:20:382023-07-29 03:38:012023-01-05 21:36:062021-02-09 03:01:162020-06-13 21:21:192023-07-30 14:34:572020-09-08 12:58:122020-09-08 10:04:382022-04-09 02:59:08,"{'id': 18547366, 'body': 'Hello! Thank you for your comment. Please feel free to share your suggestions at gethelp@betterme.tips and we will take them into consideration for future app updates.\tKind Regards, Team BetterMe', 'modified': '2020-10-18T14:08:50Z'}{'id': 36870855, 'body': 'Hello. It seems that you have two different plans and are billed for both of them. Still, to know for sure, we would kindly ask you to reach us at gethelp@betterme.world. At the same time, please be informed that the refund policy cannot be ignored, and both the company and the user need to follow the rules together. We will be looking forward to your direct reply via email. Kind regards, team BetterMe', 'modified': '2023-06-01T16:21:44Z'}{'id': 19170279, 'body': ""Hello! Thank you for bringing the issue to our attention. We would appreciate it if you could provide us the 6-digit number you received in your automated email. It'll help us locate your email and provide you with a proper solution faster. Look forward to hearing back from you. Kind regards, team BetterMe"", 'modified': '2020-11-17T16:15:38Z'}{'id': 13989931, 'body': ""Hi there! We invest a lot in the development and support of BetterMe, that's why we can't make it free, unfortunately. The cost of the BetterMe app depends on the subscription plan that our users choose, and there are several options. Moreover, we are constantly testing new cost suggestions. We hope everyone finds something that suits them best!"", 'modified': '2020-03-11T16:19:57Z'}{'id': 38051121, 'body': 'Hello! We take full responsibility for your experience and hope you accept our apology. There are two ways we can proceed. You can reach out to us with a request at gethelp@betterme.world, or, alternatively, if you have already contacted us via email, please send us a 7-digit code from the auto-reply here. Kind regards, Team BetterMe', 'modified': '2023-08-02T14:34:05Z'}{'id': 34141813, 'body': 'Hello! We sincerely apologize for such inconvenience. Would you please\xa0provide us with the 7-digit number of the email you have received in auto-reply? We will get back to you shortly and gladly review your case closer. Looking forward to your reply. Kind regards, team BetterMe', 'modified': '2023-01-07T07:47:06Z'}{'id': 24447356, 'body': ""Hello! We appreciate your detailed feedback, and we would like to address few points you have mentioned. \n\nThe app offers two ways of logging food: in case the food offered by the app does not suit you, feel free to use Calorie Tracker to keep your meals in check. \n\nAs for the steps, try using the Heath app on your iPhone. If you want to log your steps properly, and carrying your phone is not an option for you, you can sync Apple Watch with the Health app. \n\nCurrently, we are working on expanding our recipe database. In the meantime, there is an option to substitute food in case there are ingredients that you don't fancy. The plan offered to you is made based on the information you have provided in the quiz, however, you are welcomed to adjust it according to your likings. \n\nThe same goes for the workouts. The app offers a great variety of them, including those for home fitness. However, you may adjust the existing workout according to your needs and preferences. \n\nWe would be happy if you could text us at gethelp@betterme.tips. Our team will gladly give you a few tips on app usage. We are willing to do our best to improve your experience of the app and service. Do not hesitate to reach us! Kind regards, Team BetterMe"", 'modified': '2021-08-11T12:14:22Z'}{'id': 15967223, 'body': 'Hello, we are so sorry for your unsatisfactory experience with the BetterMe app! We would be grateful if you dropped us a line at support@betterme.tips. We will look into it and see what we can do to help and how we can improve! We will be extra grateful if you mention your App Store comment as it will be easier for us to understand the issue. Kind regards, Team BetterMe', 'modified': '2020-06-14T07:33:02Z'}{'id': 38056562, 'body': 'Hello! All the billing details are available to users upfront. Generally, a paid license already includes all the features; still much depends on the subscription type itself. But, Coaches and Challenges require additional fees and remain optional. Please email us at gethelp@betterme.world as we would like to discuss this matter in further detail. We hope you reach out as we take your input with serious consideration. Kind Regards, Team BetterMe', 'modified': '2023-08-02T18:18:59Z'}{'id': 17801782, 'body': 'Hi, we are sorry to see you have formed a negative opinion about our app!  We would be grateful if you dropped us a line at support@betterme.tips and told us about the cause of your dissatisfaction. We will look into it and see what we can do to help and how we can improve! \nKind regards, Team BetterMe', 'modified': '2020-09-10T10:23:48Z'}{'id': 17800182, 'body': 'Hello!\nPlease accept our apologies for the inconvenience.\nUnfortunately, we were not able to identify which inquiry is yours.\nWould you kindly reply to this review with the number of your e-mail?\nOur team will do their best to provide you with a solution.', 'modified': '2020-09-10T09:05:35Z'}{'id': 30893573, 'body': ""Hello and thanks for the feedback! That's a pity you have faced some inconvenience with the app. Still, once you're successfully registered for BetterMe and then logged into BetterMe you may use the mentioned workouts. Please check your Workouts and Challenges tabs for definite information or start following your Sofa Yoga by clicking on Start a Chair Yoga Flow located in the Plan tab. And we've tried our best to find the golden medium for both sides as the team should be following the refund policy too. All the details are always available on https://betterme.world/money-back-policy. Let's keep in contact!\nUPD: We would greatly appreciate it if you would consider adjusting your feedback about our services. Considering the fact your request has been addressed, we hope you will change your mind. Kind regards, Team BetterMe"", 'modified': '2022-07-14T13:54:32Z'}","I was using the 9.99 a month version. I didn’t keep my subscription in August. I purchased a year subscription to only have a totally different version. It no longer offers the walking and running. It no longer offers the stretching challenge, the plank challenge, the leg challenge and other challenges I enjoyed. I see now they charge extra for these things. Why even charge to use the app if I will have to pay to do challenges as well. Under fitness There are only 6 different types of plans. They no longer separated easy, moderate, and hard workout from each other. I was so disappointed and feel as if I have wasted my money purchasing a full year’s subscription.  I use to love this app but not so much anymore. Also what is the difference between the premium version and the non premium? 
One more thing their should be a voice or a ding to let you know when it is time to change excises.Better me app was great, until the honeymoon is over. I did learned to do my intermittent fasting, and I love the app, but…Slow customer service. There’s no refund, they will charge you for not requested services fees. 

I did my annual renewal subscription this February, and in May they charged me the same amount again, I didn’t ordered any other service. And of course they use their “refund policy” shield, and offer other services or “challenges” instead of giving you your money back. A very abusive practice!

I regret recommending this app. Just lost my annual subscription, and the non requested new subscription (90$ aprox), because I do not trust them anymore. I fear they will charged me again in 2 months, and I will never receive a refund.While this does have a lot of information and the base program is good, I have had some problems with this app that were not resolved, I merely got apologies.
Not acceptable.  An apology is like a promise you make to someone to not repeat the same mistakes, clearly this app failed on that.
The challenge videos I received did not work for about a week straight.  First time I complained, then it just kept happening as though no one was paying any attention to their program. 
The last challenges I signed up for didn’t even show up and now as the challenge moves forward daily when I received nothing.
The base program is good, but do not do any challenges until they fix this.I would give 0 stars but am unable to. Was excited to start my journey to getting fit and healthy and got a week into the app, religiously doing my program each day and ended up locked out because I don’t want to pay for any challenges. Allows you into app but won’t let you access any tracking options or workouts or anything unless you pay to do one of their challenges. Total waste and scam saying it’s free - it’s only free to download. If you want to make any progress you’re stuck subscribing to their food/workout challenges - no choice given not to. 
10/10 would not recommend at this pointI signed up a couple of weeks ago and paid for three months and a meal plan. It locked me out all of a sudden three days ago and I have made two attempts at customer service and tried to reset my password MULTIPLE times and with no success. Everyone I try to reset it says it doesn’t recognize my email yet I’m still getting notifications on challenges I signed up for.  I wanted this to be good but reading these similar reviews makes quickly regret my decision now. Canceling, not recommending and would greatly appreciate a refund.I loved the 30-day Pilates challenge offered when I purchased the app, but life interrupted and I was unable to finish. I didn’t get back to it until I was beyond the first month discount and paying the full monthly price, but that feature was removed, and in its place are a bunch of other challenges which are all behind yet another paywall. In the end, you get very little for your monthly subscription price. When I tried reaching out to customer support, I got auto messages saying someone would contact me within 24hrs, but no one ever does. Very disappointed in this app. 👎I was looking for an app that could do it all, and this is not it. I am extremely disappointed. 

Logging meals is impossible because of the entry methods, scanning a barcode is not useful because 90% of the scans I’ve done have not been there and I have to add them. If the barcodes were there, the information in them is highly inaccurate. 

Exercises, even if you select the home version of exercises you have to own your own gym of equipment to do them.  The walking or movement exercises don’t work with Apple Watch even though you grant access to your movement information. You have to keep your phone in your pocket and can’t view your progress. 

Meal Plans are laid out nicely but they are very odd items that I would never eat.  

Anything extra like challenges cost way more than I paid for the app. 

Major Disappointment for me.You have to pay extra to participate in challenges. The recipes are convoluted and many times not accurate.  You can’t save recipes to refer back to, but there really aren’t many you would want to try again.  You can’t log your workout if you don’t do the generic workout selected for you in the app.  Overall a very disappointing app and I’ve already moved on to another app after just two weeks.  Wish both my wife and I could get our money back.When you sign up for a free trial it sounds simple then they offer a bunch of challenges you can join and one would assume they’re also part of the trial. Wrong, they’re one time purchases. I requested a refund during the trial period without accessing them and no response from the BetterMe team. You would also think that if you purchased these challenges you would be able to access them, but no, you have to subscribe to their monthly plan. What a ripoff!Thought I would try this for a few weeks so I just purchased this morning.  Did the exercises but confusing.  It said 4 minutes but ended up being 11 which I’m fine with 11 but why did it say 4?  Then sometimes it would automatically switch to the next exercise but sometimes not and I would need to click on the arrow. 🤷🏻‍♀️
Then as I am perusing through the app - interested in clean eating and no sugar challenges I see I have to pay more money. What?!   I want my money back.  Bait and switch.  Frustrating!!No clear summary of what they call your “plan” so you have no real overview.  This app is expensive and there are constant pop ups trying to get you to spend even more money on challenges, etc.  I contacted their customer service right away to let them know that this app was not what I expected and wouldn’t work for me and requesting a refund but they did not even listen sending me an email with “tips” as if I am some sort of idiot.  Find yourself a better option and good luck with your personal journey.If I could give it no stars I would have. I have been trying to get a refund from day one, never was able to use, what I purchased did net exist on there app”sofa yoga” does not appear in their challenges or work- out lists. After three days of going back and forth the gave me 50% refund I never used it. Don’t waste your money, just search the internet and book, they are a lot more helpful and most are FREE!",0,"This app has changed since the summerBe careful! - Intermittent CC Charges!ProblemsWow...locked out for not upgradingLocked out, can’t reset password and no supportDisappointedSave your money, this app is not all it’s advertised to be.Don’t waste your time or moneyMisleading marketingDisappointedDon’t waste your moneyRip-off- don’t buy!",joceykay06MJA23024LaocA133256346no1bu+m3sassquatch605alimootooSavoyboy9Lani LBWLovedNValuedCricket in VADeborahYarbcapri2655,BetterMe Health CoachingBetterMe Health CoachingBetterMe Health CoachingBetterMe Health CoachingBetterMe Health CoachingBetterMe Health CoachingBetterMe Health CoachingBetterMe Health CoachingBetterMe Health CoachingBetterMe Health CoachingBetterMe Health CoachingBetterMe Health Coaching,0,12,0,0,0,0,1,0,0,0,1334,has_challenges,33
2,neg,2020-07-01 13:11:052020-08-04 16:46:342020-08-24 18:43:542021-02-06 07:33:082020-12-31 16:51:562020-12-02 18:15:412023-07-11 12:07:05,"{'id': 19739539, 'body': 'Hello! We are truly sorry to hear that you have formed such a negative opinion. We would be happy if you could text us at gethelp@betterme.tips so that we would revise your case and do everything possible to find a proper solution to make your experience more pleasant. Look forward to hearing from you soon. Kind regards, Team BetterMe ', 'modified': '2020-12-14T07:39:12Z'}{'id': 17089008, 'body': 'Hello, we are sorry for your unsatisfactory experience with the BetterMe app! We would be grateful if you dropped us a line at support@betterme.tips and told a little bit more about it. We will look into it and see what we can do to help and how we can improve! Kind regards, Team BetterMe', 'modified': '2020-08-05T05:50:52Z'}{'id': 17509486, 'body': 'Hello! We are sorry to hear that BetterMe did not live up your expectations. We appreciate your feedback. It will help us grow and improve our service to make our app suitable and accessible for a wider number of users. Kind regards, Team BetterMe', 'modified': '2020-08-26T09:26:38Z'}{'id': 20929701, 'body': 'Hello Kexin! We are sorry for any inconvenience caused. Our support team has found your inquiry. We would kindly ask you to check your email inbox. Please reply so that we can provide you with further assistance. Kind Regards, Team BetterMe', 'modified': '2021-02-08T13:48:36Z'}{'id': 20126167, 'body': ""Hello Cyndie! We would appreciate it if you could provide us here the 6-digit number you received in your automated email. It'll help us locate your email and provide you with a proper solution faster. Kind regards, Team BetterMe"", 'modified': '2021-01-02T07:40:31Z'}{'id': 19534051, 'body': ""Hello! We can see how frustrating it must have been for you. We do our best to satisfy our clients' needs! Would you kindly reply to this review with the number of your e-mail? We will try to fix it straight away! Will be waiting for your reply!"", 'modified': '2020-12-04T06:10:57Z'}{'id': 37656697, 'body': 'Hello! Thank you for your feedback! We are very disappointed to hear of your experience. This does not come anywhere near our standards of service. Please email us at gethelp@betterme.world as we would like to discuss this matter in further detail. We hope you reach out as we take your input with serious consideration. Kind Regards, Team BetterMe', 'modified': '2023-07-13T13:00:36Z'}","I got the app years ago & have been in a love/hate relationship with it since. When it first came out the exercises were not as detailed as they are now and I was impressed with the updates they made until the most recent update. I started using the app faithfully (with a faithful monthly subscription) since March but since the last update, last week I believe, every time I open the app their challenges pop up and I have to click on joining one just to be able to get to the home screen. I refuse to pay an extra $10-30 for a challenge when the app barely allows me to enter my meals daily because elf the limited food selection. I shouldn’t have to go through the challenges just to get to the home page to perform my workout, log my weight for the week, or log my water for the hour.

Update: I agree with other reviewers, this app is a scam! It’s not worth the $9.99/month. The calorie counter section does not include many options the barcode scanner does not pick up barcodes leaving you to enter them on your own. It does not let you go back and fix previous day entries (i.e., water intake from the previous day), if you do a different workout aside from the one assigned to you in the app or in a different app it does not count towards your progress for the day. It is pt worth it.For the cost of using this program it could be set up much better.  The food tracker part is seriously lacking.  I can not even accurately use it.  So I’m paying monthly to use the app, but I have to use a completely different app to accurately track food which is a hassle.  The food can only be recorded in ounces.  If I am eating a cheese stick on the go, I have no idea how many ounces it is. If you scan it on the app it may show up as a kraft Colby cheese stick, but you still can only document it in ounces.  You can’t just log one cheese stick with the correct nutrients. Several items I have used are not in the database.  If you have to manually enter the item, you can only enter the calories.  When watching carbs, proteins, and fats, only being able to record calories is not efficient.  All the food that is not in the database for this app are in the database on other apps with accurate measurements.  Any challenges you want to do have to be paid for on top of the regular cost.  The program is not that well set up to account for the cost of using it.  There are much better apps available that are significantly cheaper.I’m torn between at 2 or 3 star rating. I purchased 3 months worth of this app and would not recommend paying for it. The first week I used the app I liked it a lot but as I realized some of my expectations of myself did not fit with what I was actually capable of doing I found I was not able to adjust my plan. I could edit my profile but my plan stayed the same and this discouraged my desire to continue using the app and keeping up with streaks. 
I also found it frustrating that i paid to use the app and then also was expected to pay to participate in challenges. 
I loved the menu and diversity of meals suggested but the pictures don’t match the recipe and the recipes are so basic that they were hard to figure out exact how to cook something. Also, once again, I was unable to change the way it had set up my plan so that it fit what I actually needed. I also was unable to save or find meals that I had made and wanted to make a second time.
I like the idea of the app but it definitely needs some work.The App costs 9.99 USD per week and interesting add-one like meal plans or challenges cost extra. The basic (subscription) App is pretty basic, a plan for building up your daily step number. You can also log water and calories but even the free version of My Fitness Pal is more convenient for these  features and has the advantage of linking with Garmin, Fitbit, or other fitness gadgets and Apps. Great free meal plans are available from other sources. The idea of these services out of one App is good but not yet well enough realized in my opinion, especially considering the steep price tag.

I am impressed with Better Me customer service. They answered promptly to my emails and will refund the amount in line with their purchase terms. I may check back occasionally to see how the app is developing. A free 1 month trial (or even only 1 week) would be a helpful feature.This app has some usefulness which is why I gave it a two.  The food logging is limited so it’s useful for trends but don’t expect a completely accurate calorie count.

The reminders to log your food and workout are helpful.

If you do the trial subscription you will receive several pop-ups with deals for different subscription levels.  I took one of these deals and signed up for the annual subscription.  What they don’t tell you is that you have to manually cancel the trial subscription (which doesn’t show up anywhere on your Apple subscriptions) or you will continue to be charged.  I signed up for an annual subscription and then was charged for two separate (concurrent) quarterly subscriptions.  I didn’t notice when it happened the first time but contacted customer service when the 2nd quarterly charge appeared.  They will not refund the concurrent subscription.  I am one person and have the app on one device - why do I need two subscriptions.  In the end, the “deal” I got for a $20 annual subscription ended up costing me $80.  😡

On top of that you are constantly bombarded with pop-ups for additional paid challenges.  I like the idea of challenges but not when they are popping up as ads for additional purchases every time I open the app.I found this app to be rather frustrating for the most part. It has very little direction and the workouts themselves are not very impactful. The most aggravating aspect are the various “challenges” that you can sign up for. You paid for a service and then have to continually pay for different, short challenges. I purchased 2 in error and notified customer service and it was literally tooth and nail to get a refund and even then, it was only a partial one. We went back and forth over several messages with my messages won’t being heard. 
I didn’t try the food portion so no review on that.I wanted to love this app so badly.  On the surface, it seemed to have it all but then you had to maneuver your way through it on a daily basis.  It is way too cumbersome!  

The exercise videos are a plus. They are fairly easy to follow but the challenges are extra money so that is a definite turn off. 

The logging of foods is ridiculous. The options are too many with differing values attached to them.  When logging weights in pounds, it is in whole numbers.  No allowing for tenths of a pound. So a loss of .8# will not register as a loss.  It made no sense to keep a separate log in my note app.  I emailed customer service-crickets.  Also, there was no reminder about the free trial ending. 

So, I’m going to use Lose It for their ease of logging foods and weights.   I’m thankful I only wasted  $10.   Lesson learned!!!",0,"Like the App, Hate the Update & SCAM!Not worth the money you have to payThe more I use it the less I like itNot enough value for moneyBuyer Beware!Potential but a Long Way to GoJust NOT for me",OfficialNerdsunflower652Songifjoy89KexinFCyndie FAngie100282djc.55,BetterMe Health CoachingBetterMe Health CoachingBetterMe Health CoachingBetterMe Health CoachingBetterMe Health CoachingBetterMe Health CoachingBetterMe Health Coaching,0,7,0,0,0,0,1,0,0,0,1318,has_challenges,33
