rating,flair_sentiment,date,review,isEdited,title,userName,developerResponse,App_Name,has_leaderboard,has_challenges,has_points,has_badges,has_feedback,has_social,has_tracking,has_goals,has_narrative,has_collab,word_count,Element type,Mentions
4,pos,2022-01-31 08:55:162022-10-19 03:59:342017-11-30 20:52:422021-08-17 13:38:172020-08-12 19:52:092022-09-15 23:13:372020-06-05 15:37:142018-03-05 01:21:222019-07-14 07:01:492022-08-28 17:24:562018-06-15 13:25:382019-02-12 16:17:002022-08-19 01:43:562019-05-11 18:14:142018-01-20 17:44:532019-11-25 23:04:072018-11-30 21:46:212020-05-19 20:27:172021-02-20 03:41:512018-06-08 22:47:412020-11-16 19:29:522019-10-24 11:17:152019-05-07 11:38:432023-01-23 08:31:25,"Quick review.  I’ve been playing this at the pro level for a few months now and I enjoy seeing the progress and I feel like it helps me expand my mind and improve the skills that it focuses on which improves how I do my work and interact with others.  I enjoy it enough to have it be one of the first things I do on a daily basis.  It’s actually like a required step in my day.  Which brings me to the star reduction. 
Today I logged on and I had been somewhere in the 90’s for my playing streak.  Yesterday, I played it as I always do.  Today I opened it and my streak said 0 days.  I thought it was an error and would reset after I did the daily workout (because I’ve opened it before and observed that the interface behaved “differently”, I just assumed that this was a one off thing).  But after I did my workout, it updated the day count to one.  That is a big that seriously frustrates me.  
All of the other issues I have with these games have been covered by other reviewers except for the fact that if you name a game Word Fresh Zen and push some of the craziest letter combinations as words, then you had better include the word ZEN as a real word.
Thanks.I was trying Neuronation app before I met this one. They structured it and designed very well. I am looking forward to the next day to better my memory and focus. I usually am very forgettable and lose focus too quickly. I give it a 4.5 stars since today was my first day and I liked it. I like the stats where I can see my progress and I will check it over time to see how I improve. I want to build my memory muscles and focus muscles. I think I found the app that will do that for me. What I like, is that it is backed up by universities and science. So I feel good that I have proven exercises to help me train these areas of my brain. I personally can’t wait to see the changes it will make in my daily life after whole of playing this and bettering my brain muscles. I would recommend this app. I really like how they organized it. They built in this streak for you to keep track. Also I like how they have a few levels from “novice” all the way to “legend”. The games feel very professional and I feel good that I will feel the benefits of these exercises in my daily life. I just really liked it how they have all my stats and progress organized.Been practicing for over a week now with a one year subscription. Peak is fun, addictive while delivering a perfect brain wake up call each morning. 

Peak balances challenge with delightful interface in most games (e.g. compared to the ‘heaviness’ of Luminosity’s game design). I am feeling I can keep going until perfecting on all games as it feels like play time than exam time even though I check score each time...

Compared to other brain game apps I used in the past or currently use, Peak keeps a fresh edge, in its relatively large and diverse selection of games under each section, well targeted to specific brain training dimensions. I like the variety also certain twist on some games common to apps in this category. 

One drawback I have so far, & thus a deduction of 1 Star,  is the rather limited selection under ‘Coordination’ & ‘Emotion’, each with merely 2 or 3 games total right now. That’s just not enough games to either measure user’s performance properly or help user improve on those skills over time. I would say 5-8 games at least to be taken seriously. Or those tiers would also get repetitive than engaging very quickly. 

Though I appreciate there is an ‘Emotion’ section to start with.

Hope there will be improvement for the above from developer in coming weeks.Overall I like this app. I like brain games and I like watching my little brain score go up. I could play for hours honestly. It’s really satisfying and it’s nice to have trackable progress. I just wish it didn’t have to be a subscription. I’m over the subscription craze we’re in and while I’d probably pay good money for this app and be happy to do it o don’t want to pay monthly for it, and unless I suddenly come into wealth I don’t think I ever will. I’d even pay to buy the games in packs so you could buy all the memory games, or all the language games or the emotional awareness games- but I won’t subscribe. Do play this game, you’ll enjoy it.I really enjoy using this app. The brain needs to be exercised and most of the time that is accomplished through academic studies, but not everyone has the luxury to do that on a daily basis. This app is a great solution to that problem. It’s fast, easy in execution and accessible. I have bought the full version and would recommend it to others.

For the developers: 
Can you please fix Word Hunt. There really is no way to improve the score, unless you are finding a word every half second. Try it yourself and I think you will agree that there needs to be some rethinking how it’s point system works. Thank you in advance.I love this app. I have a yearly subscription to it, and I try to train with it every day, usually doing more than one training option. I would give it five stars without hesitation except that some of the games, especially ones that have a lot of moving things on the screen, have a strange glitch where they seem to jump ahead by just about a half a second, which is just enough to throw off a streak of correct answers, which then causes one’s score to suffer. I mentioned this to the game developers but they never got back to me and the issue hasn’t been resolved.Peak is a great brain game to test your skills however I have 2 complaints. 
1.) You have to spend a lot of money just to play all of the games. There should be a way to earn these privileges, like maybe earning a game if you do your daily brain workout every day for 20 days, or if you beat the high score of 5000 in smile on me, then you win the ability to play every game that involves emotion, the options are unlimited!
2.) The game needs to let your brain compare itself to younger ages. I am still a minor but can only compare it to people who are older than 19. It doesn’t really relate.
All in all, this is a great game and helps me think outside the boxThe only reason Peak isn’t getting a five star rating from me is because, without paying or premium or whatever it is, you can only do ONE (1) exercise per day. So if I do terribly, that means I have to wait until tomorrow to get a better score. (It’s honestly diabolical.) 

It’s an EXCELLENT app, with activities that are both challenging and fun—it’s a combination that keeps me coming back, strengthens my resolve, and makes me feel proud of myself.  

And it’s not just the same stuff every day, which was a pleasant surprise. You’ll play a game like Scrabble one day and something completely different the next, and it you never really know what it’ll be. 

One of my absolute favorite things about Peak, though, is the reminders. When I allowed the app to send me notifications, they offered to send me a reminder every day to complete my daily exercise—all I had to do was set the time. But I’m so hooked on it that it’s generally one of the first things I do in the morning.The app works flawless for me. There are a number of mini-games or challenges you can do everyday. At the end of a session (5games in a row) you get presented with a summary, how you compare against others in your age, gender etc group. It also gives you a detailed overview of your areas of strength and weaknesses. 

If it really improves and helps your brain, I don't know. I certainly get better with the scores of the challenges but I have not seen any real life changes, yet. But definitively a better use of your time then most activities we do on our phone everyday.I love this app and really believe in all the benefits of training your brain. I’ve seen the benefits in my own life. My only suggestion/recommendation is it’d be really nice to have something like a streak-freeze for the pro account users. Maybe if you accumulated so many workout days under your belt (like every 14) you’d earn a streak freeze and you’d be able to employ it when life (or cell service) gets in the way so it doesn’t reset your streak all the way back to a big fat zero. Just a suggestion. 😁I really do like this one. I’ve tried several different similar-ish brain apps. This is the only one I’ve kept. I even kept it prior to purchasing my cheap year subscription! I only made the low cost purchase because I was playing it so much and trying to see how well I could do. I strongly suggest to give it a try. You can compare your scores to others in your age group, in your profession, or even friends. So go see how high you can get your scores and enjoy testing yourself and exercising your brain at the same time!!Been using peak (pro on and off) since summer 2017 and I definitely feel it working. Getting quicker at completing little day to day tasks and am steadily raising my scores, now at over 900 in everything but problem solving. One complaint— the word path game breaks down 25% of the time, like it’ll tell me the words aren’t valid or it won’t let me place the final tile where I need it. And it’s been like this since 2017 so I’m wondering how often the developers are quality checking the games.It’s fun to see how far you’ve come and how you stack up to others. The UI is clean & beautiful and there are some throwbacks to the video games of the 80-90s. I’d love see more coordination games but they come out with new games frequently. The scoring and what you should be doing differently to achieve the goal score could use more explanation. Hitting a wall with multiple games and I’m not sure what I can do beyond get faster. Can’t wait to play more!I like the concept, I haven’t been using it very long but I do like it so far. The only thing I would suggest is personalized exercises for people with mental disabilities. For example I have ADHD-C and a Learning Disorder in Mathematics. Because of this I may not score very well in some areas for reasons beyond my control causing my overall score to be skewed. Other than that great app and great idea.I absolutely love this game. I’ve been playing it for months. The only bad thing I have come across is that there is only one game in the category of “coordination” in the free version of the app. That makes my individual “coordination” score the lowest. Ultimately, I wish it had more coordination games for me to play so that I could bring up my score.This game is amazing and I only have one complaint. Well Maybe 2.😂. I wish that you didn’t need pro to play the games as many times that you want because if you want it re try it and try better you can’t you have to wait until the game comes up again. But overall it’s really good and fun I have a 6 day streaks is far!Overall, I love this app. It’s a great way to keep you mind sharp. However, it used to have a feature where you could connect it with your Facebook account and compare your scores to your friends’, but this has been broken for quite some time now. Otherwise, this is an awesome appThe only thing I find annoying about this game is the badges. It might say score higher than # and it won’t give you the badge after you’ve done that. Also I wish it would give you reasons at the end for why you might’ve answered something wrong.There’s a few games that I KNOW I’m not doing wrong and it still sings my score or time. It’s driving me nuts because I just keep replaying them with no solution or option to notify of a mistake. 

That being said, I do love the app overall. Most of the games are amazing and fun.I absolutely love this app!   The only thing to me that would be an improvement is that once you hit a score there should be no going backwards. That has been frustrating especially when reaching higher ranks.I Like The Fact That They Make Percentages And In A Way I Get To See How I Outdid My Score Or The Others. Although I Find The Ads Too Much and Annoying And The Fact That You Must Watch One Every Time For 30 Secs In Order To Replay, Sth That You Won’t Find In The Competitors Apps!I do look forward to playing it everyday. I like the variety of games, the graphics, and sound effects. It's cool! The only thing I would want is for them to have grace period for the streak. Since it’a a paid app, that would be nice.This app makes me feel awesome about myself! Whenever I get a good score, it makes me feel like I’m really smart! It also tells you how much better you are than what percent of users. It’s great. I totally recommend it! 😊😊😊I am enjoying this app. I do look forward to improvements on Word Fresh as some words like “eerie” or “europe” aren't recognized as words (and I thought I was going to get a high score!)",1,"Love the app but I hate bugsPretty well created appPeak Performance Awaits...One thingGreat game, but have an issue for the developers.Excellent but sometimes glitchesGreat Game But...4 outta 5 (For pettiness)Good little Brain TeasersLove this AppGreat app!Definitely workingI’m addicted!Cool app but some recommendations.Why is there only 1 game for “coordination”?AJ’S review on PEAKCool app, with a broken featureGreat except small annoyanceFew quirks, but love it overallAddictive!!Needs ImprovementGreat game but...Self-Esteem Booster!!Challenging",XRayman1961Pr.abhuAppDeeDeeMonte_CristoGreatest game on the iPadAudiebertgabbadab😎Anna_b3ll3mbglobetrotterH BizzSuthrngal18kim.vuLainyLaneJjjahajhajaakshhahaj_coopmhuletdevazul-pyeReviewingisannoying2765sandyr59FarnazzzzToyKerBoxerMomma174Lake City L,"{'id': 27787819, 'body': 'Hi XRayman1961! Oh no! Sorry about the Streak issue. :-( Would you mind sending us a message to support@peak.net? This way, we will be able to support you better. Thanks a lot!', 'modified': '2022-02-01T14:45:37Z'}{'id': 32753582, 'body': 'Hello Pr.abhu! Thank you for taking the time to review us :-) we are happy that you are enjoying Peak!', 'modified': '2022-10-24T13:32:01Z'}{'id': 32082749, 'body': 'Hi! Thank you for taking the time to review us :-) we are happy that you are enjoying Peak! Also, thanks for taking the time to share your feedback with us; we really appreciate it! We will take it on board for future improvements of Peak :-)', 'modified': '2022-09-18T17:32:19Z'}{'id': 31745818, 'body': 'Hi! Thanks for taking the time to share your feedback with us; we really appreciate it! We will take it on board for future improvements of Peak :-)', 'modified': '2022-08-30T13:14:43Z'}{'id': 30877036, 'body': 'Hello LainyLane! Thank you for taking the time to review us :-) we are happy that you are enjoying Peak!', 'modified': '2022-07-13T18:00:57Z'}{'id': 34463237, 'body': 'Hello Lake! Thank you for taking the time to review us :-) we are happy that you are enjoying Peak!', 'modified': '2023-01-24T18:05:51Z'}",PeakPeakPeakPeakPeakPeakPeakPeakPeakPeakPeakPeakPeakPeakPeakPeakPeakPeakPeakPeakPeakPeakPeakPeak,0,1,0,1,0,0,24,0,0,0,2421,has_tracking,283
