rating,flair_sentiment,date,review,isEdited,title,userName,developerResponse,App_Name,has_leaderboard,has_challenges,has_points,has_badges,has_feedback,has_social,has_tracking,has_goals,has_narrative,has_collab,word_count,Element type,Mentions
1,neg,2020-05-14 01:29:332019-08-04 14:57:062019-04-09 04:10:452019-07-05 06:12:352022-06-16 14:55:032023-11-04 15:52:282018-05-05 23:46:102021-09-29 22:58:572019-11-03 13:07:562022-04-24 19:34:082021-04-29 19:19:562023-07-15 20:48:312018-04-04 16:24:242023-07-05 13:20:232019-04-08 17:19:272020-04-10 00:21:412020-02-27 04:23:522022-12-17 20:00:412019-10-24 15:18:342021-11-27 01:59:462022-09-22 01:24:522022-05-21 03:05:132018-05-13 03:46:222018-03-19 05:02:042018-10-23 19:56:342020-08-16 20:20:442021-02-18 14:47:232019-12-12 01:58:082017-10-28 15:56:462020-03-02 13:08:562023-02-21 01:35:002021-09-15 00:20:14,"This app is full of full screen 30-second ads. Literally. Before playing, while playing, and even after you’re done you’re going to see a 30-second full screen ad. I have nothing against ads, but when you pass more time seeing ads than playing, there is something wrong with the app. Also I didn’t mention that’s the only app that makes your overall score go down after making the perfect score in a game, why? Because when they introduce new games to you, you’re a beginner in that game, so no matter how well you play this game, your overall score will go down the first time you play new games, to make sure you keep wasting your time on this app and don’t reach the perfect score. Oh and I forgot, if you don’t pay the monthly subscription, some games won’t be available anymore, that means you’re gonna keep your bad score for ever and there’s nothing you can do about it, to make sure you won’t finish the game without paying. Everything in this app is about ads, making you pay and keeping you playing by making sure you’ll never reach the perfect score. Doesn’t worth paying either since their games are not even working, the vocabulary games are limited to their vocabulary, the sorting cards game doesn’t even alert you before switching sides, if you’re too fast the game say you’re wrong even when you’re not. Bottom of the line: great concept, badly developed, don’t waste your time.This app can be a good idea but there are many flaws. I understand why the point of having ads is important to have a game and it gives you a reason to buy the premium then and also ads=money but my problem lies with the constant ads like after every game another ad! Like calm yourself I’m not going to pay $35 a year just to probably delete the app in a month anyway. Also why do I have to buy the premium to replay a game once. I understand if u want to play the same game twice so you can’t constantly spam to get a higher score. Also one day by accident I held the play button and all my games were completed for me and my score decreased by 25%. Like I this is when I got like 3 weeks into the game and my scores were fairly high so I stopped playing the game for 2 weeks because of it then I recently got back into the game and i was mostly annoyed because I knew i couldn’t get it back anymore because I needed to spam play which I can’t obviously do because I have to pay for the premium. And you may be like then just buy the premium but $35 is a lot for a person who can’t get a job. Also it’s a mobile game which they are only addicting for about a month or so and they get boring.It is set up so there is a daily quiz. There is a set time of 30 seconds or so for each question and then it just ends, so if you have a streak going it’s broken and if your struggling you’ll never figure it out. You can’t go on the app and focus on the areas and problem you struggle with you can only do the set daily quiz. It doesn’t allow you to personalize it so that you can focus on what you struggle with. It might be that you’re not bad with that area of skill but the way that question is designed like you need to color in blocks in a certain manor but they use three or four shades of the same color so because it’s all a matter of shades you take longer double checking the shades to make sure it’s marked correctly than if they would have used different colors vs shades, that makes you struggle but just like a standardized test it’s one size fits all test. The “statistics” they give you about the capability of the “average” mind in an age group is a complete lie. I’ve talked to teachers and psychologists and neurologists and they all say that nobody, absolutely nobody has a perfect balance of medium skill level in all subjects. Everyone does better in some and worse in others by comparison.Don’t fall for it. The free trial will auto renew at a YEARLY membership of $35!!! That’s outrageous. Then the company will point you to Apple and say there is nothing they can do and Apple will point back to the company and shrug their shoulders. It’s a predatory business practice to scam money from people and hope they don’t notice. I almost enjoyed the games enough to consider another month but I wouldn’t willingly pay 35 for five of these apps. And the rankings and scores don’t even feel legit. There is no real information about how they score or why you are ranked a certain way. Overall this is just a big waste of money. They should just call it a game app and stop lying to people. Shame on Apple and this developer for setting up their free trial this way.  If you get enough Complaints that you need to put it in your FAQ you’re probably doing something wrong.Went from zero days issue to now after each game it mostly goes to a black screen never to return again. I need to close app and restart it again. How disappointing. In addition I’ve been getting some high scores but overall rating continues to go down. Old games now showing up again.  Using latest iOS on iPhone 13. Seems like problems continue. 

Why does this app do this? Doing the normal daily routine, complete it but later in Day funky things happen and seems like some link was broke. Is this running on AWS by any chance? My data for Tuesday of this week was there and completed and now again lost all those days so I’m back to zero. Not the first time this has happened and I expect not the last. So disappointing.I am trying out Luminosity, Elevate, and Peak. Park was definitely the first one I UNINSTALLED  because of the terrible annoying video ads for other apps. You have to wait them out, they are pixelated, and my particular ad showed an elderly woman holding her head because of her ""mental age"" score being low.  The ad itself had a very small (x) at the end, and all in all, it felt like it was fishing for someone to accidentally click on it. The games weren't that great, and they seemed like Luminosity rip offs. (FWIW, Elevate is my favorite so far as the games are focused more on math, spelling, writing, and reading - and in general, they feel more useful than the abstract games of Luminosity and Peak.)Started playing, was enjoying it when I noticed the numbers were a bit weird in the results/comparisons section. You can get the same or different scores and get different or the same results, respectively. The numbers have to be made up, and even the “streaks” in games were off. I counted, and once it said 20 when I made sure to make a mistake after 10 in an agility game. The percentage comparison with other people must be randomized, because after playing the same game several times I saw the percentage go up and down willy nilly, despite me obviously doing better or worse in all areas. Not sure why the ratings are so high, maybe people just don’t bother to look at the stats.I paid for a full year of Peak and now, having played for a month or so, I’m not sure I’ll bother continuing with it. The wide variety of games is impressive at first, but most are minor variations of the same idea. There are four or five versions of the Stroop color word test, a handful of word games, and then some clones of other common mobile puzzle games like Flappy Bird and Picross. With many of the games, I couldn’t tell what was being tested or challenged - many are simply tedious or poorly laid out, so the challenge is dealing with the UI. There is no info in the app explaining exactly what is being tested with each game, and the only metric of personal growth is their “Peak IQ” scoreThis app is trying to get you to buy their premium version of the app. The overall brain score it gives you for is really low on purpose. You could be in the top 95% in every game, but your overall score will only be around 300. The only way to make this score higher is by playing the games more times so you improve at that game. That’s where the problem occurs. If you pay for their premium membership, you have unlimited access to all the games and can play them until you master them. This app isn’t making you smarter, it’s making you better at pointless mini games and puzzles, but telling you it’s improving several vague categories of brain activity.I don’t like being told how poorly I’m doing compared to others. I’m recovering from a concussion and was told this app would be helpful. It’s not. I would like to be compared only to my previous scores to look for improvement. Being compared to the “child prodigy's” (from an earlier review) doesn’t help my self esteem, which has already taken a hit. Nor does this app seem to be helping me. If you’re already in Mensa and want to feel even more smug about how smart you are, you’ll enjoy this app. If you’re fighting your way back from traumatic brain injury, this app will only make you feel worse.Do yourself a favor and don’t get sucked into this game. I started playing a few months ago I had 130 day playing streak and then I missed a day and now I’m on an 80 day streak. The game is rigged so that no matter how well you do on each game it will find ways to deduct points until you subscribe and then you’ll be a superstar for doing the exact same thing. Such a scam, and it’s so not affordable! Please do yourself a favor and stay away from this horrible app! These sad people are only money hungry and are trying to convince you that you are stupid unless you pay. Literally.I used to play Peak when it had started. It was a fun game that I would compete with my dad and brother in, to see who could get the highest score on games. Back when it first came out, it didn’t have nearly the amount of ads it does now, if it even had any. But now, trying to play the game for free is a nightmare. 
In between games: 10 second ad
Replaying games: 30 second ad
Playing all the games in the daily routine: 30 second ad
Most of the time you’ll be watching ads more than you’re actually playing the game. It’s just a sad shell of what it used to be.At the end of the day it’s a money grab and the logic behind it doesn’t make any sense. Like today I played a focus game called unique and it said I scored above 98 percent then I finish my “workout” and it said my focus rating went down I can’t see if that’s possible when I did better than most people and the brain mapping can’t be right either because in most little game so score well above 80 percent then I go to the summary and it says you are 62% above your group then if you go to the brain mapping it shows mine much smaller than my age group it doesn’t all coordinate... I guess it’s fun but you won’t actually gain anythingNew update now slaps an ad in between each training game, rather than just having to watch ads to play more than the first two Super intrusive and annoying, I liked watching a couple to unlock more but now I don't even want to open the app

Update to dev response:
 Cop out answer. They're not short video ads they are intrusive long ads. Longer than the games between the ads, not to mention the extra banners thrown on top of the ads to block the timers/force you to go to their store page to get you more clicks

There are ways to improve the customer experience so they WANT to support you, rather than choke people until they're forced to either purchase or uninstall, I'd still be building my streak on a daily basis if it wasn't for those ads, getting me closer and closer to buying in to spend more time training, now it's just an uninstalled forgotten appPeak certainly provides hours of mindless fun, but its contention that using it actually improves cognitive performance are suspect.  As a clinician, I have yet to see that using programs like PEAK improves cognitive performance demonstrated in a double-blinded study.  Until that happens, this will be nothing more than what it is: something to occupy idle hands on long flights.  

Furthermore, how it assigns ‘improvements’ in any of the cognitive domains seems decidedly unidimensional - how can one play ANY of these games without improving one’s scores on at least two (and possibly three) metrics, particularly when all of the games are timed?The issue was fixed after my last review and worked for a day or two. Now it just had a loading circle on the main page and games won’t load. 

 I love this game and plan on buying the full version when the next sale comes along. 
BUT, since the last update it does nothing but crash. Over and over. Sometimes I can make it work for a game if I turn off my iPad and turn it back on again. Once I leave the app, it will just crash again as soon as I try to start the app again. 
I have contacted customer service but just got some canned response that has nothing to do with what I (and many others) are experiencing. 
I have lost my daily streak and am truly sad about that. 
Please fix this ASAP and not wait until the weekly or bi weekly update for the app.I really enjoy this app, but I will never tolerate something that makes me feel scammed out of my time. My time being made to watch ads in order to play a game I enjoy, then denying to allow me to play said game. I literally watched 2 ads, one to exit out of a game and post my score, then went back to replay the game, watched another ad, then got denied to play after watching another ad. One star for wasting my time instead of being up front about it and just denying me before wasting my time.Many of the games are fun to play when they come up in rotation. Pay no attention to that score because half the word games are testing how well you can text rather than any other skill. What really disappoints me is recent developments that have limited the access to games without watching extended commercials. While the games are fun, this is a company that couldn’t care less about its customers. Monthly cost is close to premium movie channel.I’ve been playing this game for a while and am a tester for it. I like the variety of games but it is frustrating to do really well and have no change to overall score and then do slightly less well and overall score goes down. The algorithms seem very skewed towards negative performance. There are quite a few glitches also which have been around for a long time with no fix. Overall I enjoy it but wish these things would get addressed.So, I’ve been paying for this service for years.  I put up with being harassed for reviews.  I put up with be constantly coerced to do what *they* wanted me to do. 

I was a Grand Master at some games.  A Legend for years at another.  I constantly scored at the 99th and 100th percentile.  

I logged in today and was told that I was close to leveling up.  At the game that I’ve been a Legend at for years.   I threw the app away and relaunched.  Three times.  Same result.  I restarted the phone and relaunched the app.  Same result. 

Bye.  

If you can’t do something as simple as keeping score, what else can’t you do?   I don’t want to know.  And I’m not paying you for the privilege.  

From a business perspective, you’re morons.I fully understand the need for ads and I don’t mind them if it means I can continue to play for free. (That’s my budget right now.) The problem is when the ad pops up before the end of the game. Of the three free games today it happened twice, and the second time I had to shut down the app and restart it to get to the third game. I wonder what my score would be if I could actually play to the end?I’ve been a user on and off for about 3 years, and at one point I was using it every day.

I came back today and honestly, this app is nothing like it used to be, and is borderline unplayable now. 

More and more features have been taken away to be pro exclusive, the app has never really adjusted it’s scoring system to recognize really good scores as opposed to slightly off ones, and now there is more ads than ever before.

If you’re looking for a brain training app and you’re willing to drop money on a subscription to play connect four for five minutes a day, be my guest. But if you’re here to even attempt the free trial version, just don’t bother.Paid for subscription based upon my poor initial assessment performance. Pro Games are good. But I realized when I took the initial test I was tired so maybe I didn’t score well. I signed out and created a new account. I destroyed all the assessment games and was in above 95 percentile for all of them, but again, they scored me poorly in a few areas. Total ripoff and feel cheated. But maybe that was the real test of my intelligence and I failed since I bought a subscriptionThis game makes it a really big deal to compare you to other users. The app praises you for high scores and kinda brings you down for low scores. You don't get to play any of the fun games they show in their advertisements that actually require evaluation and thought. Most of the games are timed and increase in difficulty the longer you play. It's just not what they make it out to be. I will be deleting app.This is just a trick to force you to spend money. After taking the prognosis test, I was told on the memory test the average score is 67% where I got 100%. It then gave me a really low percentile for my brain map. As someone who qualifies for Mensa, I know I am not only in the 58th percentile, so I know my current brainmap from the app was just a marketing tool to try and get me to pay the exorbitant subscription cost. Don’t fall for it.Don’t know who is writing the other reviews—bots?  I see no impact from this other than the wasting of my time. Score progression is opaque. Games are not fun. I see no real improvement. But worst of all are the horribly stupid ads. That alone would erase any improvement you might have seen (if that’s even possible given the silliness of the “games”). This is just an ad machine. I’m deleting this.WTH is up with the 30 second ads after every single game? It’s really distracting and disappointing that you guys would do this to your free users. I’d understand one ad before starting the session and one after, but after every single game? Come on! And now you can’t see your score until after you watch an ad. This app is becoming unusable.I enjoyed this app very much until it stopped recording my progress and updating my scores. I know this should not be happening and have contacted the developers twice already with no response. I’ve basically paid for a year subscription on a now utterly useless app with zero customer support. Lovely. 

Don’t risk your money on this app, if it breaks you have no recourse.I like the premise of the game, but they're just trying to sell you on their paid version.

Furthermore, at least one of the games (the one with the faces) scores half of your correct answers as incorrect for some reason (""Is the man wearing glasses?"" He is not, and you select ""No"", and get scored as an incorrect answer) .

Very frustrating. Needs improvement. Could be a fun activity.Thought I loved this app, spent money finally for pro and all my scores dropped instantly.

Since I haven’t heard back from anyone, I’d like a refund and my scores to be returned to what they were. It took me 9 months to get my score above 800 and it dropped like a rock because I bought pro...Please fix the bugs in the latest version!! After you play a game and it’s showing the score, there’s no way to continue on to the next game or to a different game.

Forced to Exit out of the app and restart. I’ve stopped playing and only playing Luminosity now.I can't believe the devs. If you want to complete your daily streak you have to watch an ad. If you want to see your stats you have to watch an ad. If you want to replay a game you have to watch an ad! And it has ads even between games. Not worth downloading at all",0,"Don’t waste your time watching adsI have many problemsStandardized testing in an appScammyBlack screen after completing a game!Free version has terrible video ads eventuallyMade-Up ResultsDoes not seem scientifically groundedScamWill not help recovery from traumatic brain injuryHorrible Scoring Geared Only To Subscribers!Ad ridden nightmareMoney grabTerrible ad practiceMindless FunFixed but now just has a loading signWill not tolerate forcing ads for nothingGood games. Bad philosophy.Good app but scoring makes no senseJust canceled - after years as a paying memberGame cut offAlmost unplayable nowTotal scamFalse AdvertisementGambitSo uselessAds Ads AdsApp is broken with no supportNot ImpressedHad this app for months, bought pro and my scores dropped 200 points eachBugs in Latest VersionToo many ads",James R5dabbing isabelledreamneophytemelibs5Star buckarooqwickening3948382marxistjohncenaihavebeebkidnappedbluesinthenight1234Ldbryant55Anti-Ad GamerSubway lordBread SwampjgdrosekeungfamilyJake with a Kpeacehammer123Kcdee71ejcatlmeech06FunkyRobotRsato8ZombieGlitternightbirdflyingsmtdsltNatashaB.crisee17Hawk33Tfawcpalease. stay awayMamdosein^_^,"{'id': 15347009, 'body': 'Hi Malcolm. Thank you for taking the time to leave us a review. We value all the feedback we receive and we will pass this on to our product teams. For further queries or support, please contact us at support@peak.net. Thank you -Team@peak.', 'modified': '2020-05-15T17:22:48Z'}{'id': 9865434, 'body': 'Hi there, thank you for your message. Please do note that we notify our users, upon signing up for the free trial, that the trial is set to turn into a yearly subscription automatically unless the feature is cancelled by the user. We also provide the cancellation steps in the \'Help\' menu inside the app.\nAlso note that you need to cancel this at least 24 hours before it is set to turn into a subscription, otherwise the charge will already be underway and charged to your account. Unfortunately, on our side, we cannot provide a refund for iOS users, as Apple does not provide us with any tools to do so. We do not have any access to their billing platform nor your payment details. Apple manage refund requests internally so you will need to submit your request to them directly: https://getsupport.apple.com/\n\nThe steps given in the following link might also help you request a refund for this purchase: http://www.imore.com/how-to-get-refund-itunes-app-store"". We hope this is of help, thank you again for your feedback. - Team at Peak', 'modified': '2019-07-26T15:14:27Z'}{'id': 30449066, 'body': 'Hi Star! Would you mind sending us a message to support@peak.net? This way, we will be able to support you better. Thanks a lot!', 'modified': '2022-06-20T08:44:13Z'}{'id': 39946306, 'body': 'Hi qwickening! Would you mind sending us a message to support@peak.net? This way, we will be able to support you better. Thanks a lot!', 'modified': '2023-11-06T06:13:07Z'}{'id': 25438763, 'body': 'Hi, thanks for taking the time to share your feedback with us; we really appreciate it! I will forward your comments to our Product Team to take your feedback on board for future improvements of Peak! You can find more information about the science behind Peak in our help section under ""The Science of Peak"". For this, please click ""Me"" then click on ""The Science of Peak"" close to the logout button and there you find ""The Science Stuff"". You can also find out more on our website https://peak.net/science/.', 'modified': '2021-10-01T11:56:25Z'}{'id': 12000208, 'body': 'Hi there, sorry to hear you are not enjoying the app. We value your feedback and we will pass this on to our product team. For further information on our research, please see link: https://www.peak.net/science/. If you require any further information on the app please contact us at support@peak.net. Thank you- Team at Peak.', 'modified': '2019-11-22T17:28:45Z'}{'id': 22609054, 'body': 'Hi there! Oh no! Sorry that you encountered this issue. :-( Would you mind sending us a message to support@peak.net or if you can, via our help section in the app? This way we can get your account info and we will be able to support you further. Thanks a lot!', 'modified': '2021-05-04T08:35:37Z'}{'id': 37716531, 'body': ""Hi there! Thanks for your review. To keep providing a free version for Peak, we're trying to find ways to monetize the app enough with ads to enable us to keep working on the app without our users having to buy Peak Pro. This is why you have to watch short ads to unlock more games."", 'modified': '2023-07-17T09:20:21Z'}{'id': 37536696, 'body': 'Hi Bread! Would you mind sending us a message to support@peak.net? This way, we will be able to support you better. Thanks a lot!', 'modified': '2023-07-07T11:50:00Z'}{'id': 14679036, 'body': ""Hi there, we're very sorry about this issue. We will be releasing a fix for this in the next couple days. Thank you for your patience. - Team@Peak"", 'modified': '2020-04-15T09:32:14Z'}{'id': 13736535, 'body': 'Thank you for your feedback. We will pass this on to all the relevant teams. We are committed to providing effective brain training for our users, and this means we are continuously working on and developing Peak. In order to maximise the benefits to our users we must make part of the app - Peak Pro a subscription based service.\xa0 -Team@Peak', 'modified': '2020-02-27T10:24:13Z'}{'id': 33811403, 'body': 'Hi peacehammer123! Thanks for taking the time to write a review for us. We are happy to hear that you like our games, but we are very sorry to hear that you\'re not enjoying the philosophy of Peak. Would you mind explaining to us what you mean by ""we have limited access with recent developments""? Do you mean the switch a while back when we introduced ads to the free version? You should be able to unlock more games by watching ads if you are in the free version. To keep providing a free version for Peak, we\'re trying to find ways to monetise the app with ads to enable us to keep working on the app without our users having to buy Peak Pro. If this is not the case for you and you cannot unlock games by watching ads, we are happy to look into this for you. You can reach us at support@peak.net, and one of our CS agents will help you. Regarding our word games, you can find what each game trains when you click on a game and scroll to ""Helps you train"". We also have more information about our language category when you click on ""Me"" -> click on the little cogwheel in the top right corner and scroll to ""The Science Of Peak"". While we do not intend to help train texting speed or how well people text with our language games, this might be a welcome side effect 😁. We base our pricing on other similar brain training apps on the market, so if you look to train your brain, you will find that Peak is priced fairly when you compare our app to our competitors. We care a lot about our customers, so we are sad to hear that you feel otherwise; please feel free to send us an email with your suggestion on what we can improve in the app to change your mind (if you like). We wish you a happy festive season! 🎄', 'modified': '2022-12-19T16:09:27Z'}{'id': 32187123, 'body': 'Hi meech06! Would you mind sending us a message to support@peak.net? This way, we will be able to support you better. Thanks a lot!', 'modified': '2022-09-23T08:45:30Z'}{'id': 30056373, 'body': ""Hi there\u200b! Thank you for sharing your feedback with us. :-) To keep on providing a free version for Peak, we're trying to find ways to monetise the app without our users having to buy Peak Pro. This is why you currently have to watch short ads to unlock more games. "", 'modified': '2022-05-30T15:59:59Z'}{'id': 17356735, 'body': ""Hi there! Fortunately, we don't have bots that write positive reviews for us, this goes against our values as a company. Please note, to continue working on the free version of the app we need revenue from Ads. If you prefer not to see the ads we recommend purchasing the Pro version which does not contain ads. If you have any further questions or issues, please contact support@peak.net. Thanks for your understanding. -Team@Peak."", 'modified': '2020-08-18T14:52:34Z'}{'id': 21209671, 'body': 'We are sorry for this, to continue working on the free version of the app we need revenue from Ads. Thanks for your understanding. -Team@Peak.', 'modified': '2021-02-22T10:18:25Z'}{'id': 13828119, 'body': 'Hi there, thank you for your review. Unfortunately, we are unable to assist you through the App Store. Please contact support@peak.net for further assistance. We look forward to your email. Thank you - Team@Peak', 'modified': '2020-03-03T10:26:04Z'}{'id': 35015268, 'body': 'Hi palease.! Would you mind sending us a message to support@peak.net? This way, we will be able to support you better. Thanks a lot!', 'modified': '2023-02-22T13:35:18Z'}{'id': 25137708, 'body': ""Hi! We are sorry for this; to keep on providing a free version for Peak, we're trying to find ways to monetise the app without our users having to buy Peak Pro. This is why you currently have to watch short ads to unlock more games. However, I will, of course, pass your feedback on to our Product Team. Thanks for reviewing us! :-)"", 'modified': '2021-09-16T08:34:38Z'}",PeakPeakPeakPeakPeakPeakPeakPeakPeakPeakPeakPeakPeakPeakPeakPeakPeakPeakPeakPeakPeakPeakPeakPeakPeakPeakPeakPeakPeakPeakPeakPeak,0,0,2,0,0,0,32,0,0,0,3730,has_tracking,283
